"No.","Time","Source","Destination","Protocol","Length","Info"
"22","0.019421695","bom07s16-in-x03.1e100.net","tanvi-HP-Notebook.local","TCP","94","443  >  49902 [SYN, ACK] Seq=0 Ack=1 Win=65535 Len=0 MSS=1360 SACK_PERM=1 TSval=322568487 TSecr=3935640745 WS=256"
"23","0.000057160","tanvi-HP-Notebook.local","bom07s16-in-x03.1e100.net","TCP","86","49902  >  443 [ACK] Seq=1 Ack=1 Win=28800 Len=0 TSval=3935641468 TSecr=322568487"
"25","0.035190595","bom07s01-in-f131.1e100.net","tanvi-HP-Notebook-d585","TCP","74","443  >  46692 [SYN, ACK] Seq=0 Ack=1 Win=60192 Len=0 MSS=1380 SACK_PERM=1 TSval=3333833428 TSecr=740254233 WS=256"
"26","0.000049054","tanvi-HP-Notebook-d585","bom07s01-in-f131.1e100.net","TCP","66","46692  >  443 [ACK] Seq=1 Ack=1 Win=29312 Len=0 TSval=740254616 TSecr=3333833428"
"27","0.000024013","www.gstatic.com","tanvi-HP-Notebook-d585","TCP","74","443  >  36948 [SYN, ACK] Seq=0 Ack=1 Win=60192 Len=0 MSS=1380 SACK_PERM=1 TSval=2563387677 TSecr=1341718125 WS=256"
"28","0.000011831","tanvi-HP-Notebook-d585","www.gstatic.com","TCP","66","36948  >  443 [ACK] Seq=1 Ack=1 Win=29312 Len=0 TSval=1341718582 TSecr=2563387677"
"31","0.007457553","bom07s16-in-x03.1e100.net","tanvi-HP-Notebook.local","TCP","94","443  >  49904 [SYN, ACK] Seq=0 Ack=1 Win=65535 Len=0 MSS=1360 SACK_PERM=1 TSval=986718714 TSecr=3935640745 WS=256"
"38","0.000224071","bom07s01-in-x03.1e100.net","tanvi-HP-Notebook.local","TCP","94","443  >  54338 [SYN, ACK] Seq=0 Ack=1 Win=65535 Len=0 MSS=1360 SACK_PERM=1 TSval=904711566 TSecr=732766050 WS=256"
"42","0.000149805","bom07s16-in-x03.1e100.net","tanvi-HP-Notebook.local","TCP","94","443  >  49908 [SYN, ACK] Seq=0 Ack=1 Win=65535 Len=0 MSS=1360 SACK_PERM=1 TSval=220667510 TSecr=3935640994 WS=256"
"43","0.000122307","tanvi-HP-Notebook.local","bom07s16-in-x03.1e100.net","TCP","86","49908  >  443 [ACK] Seq=1 Ack=1 Win=28800 Len=0 TSval=3935641519 TSecr=220667510"
"44","0.000898447","bom12s01-in-x0d.1e100.net","tanvi-HP-Notebook.local","TCP","94","443  >  33132 [SYN, ACK] Seq=0 Ack=1 Win=65535 Len=0 MSS=1360 SACK_PERM=1 TSval=3963627858 TSecr=691093400 WS=256"
"45","0.000093141","tanvi-HP-Notebook.local","bom12s01-in-x0d.1e100.net","TCP","86","33132  >  443 [ACK] Seq=1 Ack=1 Win=28800 Len=0 TSval=691093796 TSecr=3963627858"
"47","0.000497512","bom07s01-in-x03.1e100.net","tanvi-HP-Notebook.local","TCP","94","443  >  54346 [SYN, ACK] Seq=0 Ack=1 Win=65535 Len=0 MSS=1360 SACK_PERM=1 TSval=765658414 TSecr=732766300 WS=256"
"48","0.000040110","tanvi-HP-Notebook.local","bom07s01-in-x03.1e100.net","TCP","86","54346  >  443 [ACK] Seq=1 Ack=1 Win=28800 Len=0 TSval=732766754 TSecr=765658414"
"50","0.000519781","www.gstatic.com","tanvi-HP-Notebook-d585","TCP","74","443  >  36946 [SYN, ACK] Seq=0 Ack=1 Win=60192 Len=0 MSS=1380 SACK_PERM=1 TSval=369106497 TSecr=1341718125 WS=256"
"53","0.022418888","www.gstatic.com","tanvi-HP-Notebook-d585","TCP","74","443  >  36958 [SYN, ACK] Seq=0 Ack=1 Win=60192 Len=0 MSS=1380 SACK_PERM=1 TSval=1311315828 TSecr=1341718373 WS=256"
"55","0.011504625","del03s10-in-x04.1e100.net","tanvi-HP-Notebook.local","TCP","94","443  >  45868 [SYN, ACK] Seq=0 Ack=1 Win=65535 Len=0 MSS=1360 SACK_PERM=1 TSval=1945087439 TSecr=43081646 WS=256"
"56","0.000070567","tanvi-HP-Notebook.local","del03s10-in-x04.1e100.net","TCP","86","45868  >  443 [ACK] Seq=1 Ack=1 Win=28800 Len=0 TSval=43082074 TSecr=1945087439"
"58","0.004745232","bom12s01-in-x0d.1e100.net","tanvi-HP-Notebook.local","TCP","94","443  >  33142 [SYN, ACK] Seq=0 Ack=1 Win=65535 Len=0 MSS=1360 SACK_PERM=1 TSval=2145652204 TSecr=691093651 WS=256"
"59","0.000054544","tanvi-HP-Notebook.local","bom12s01-in-x0d.1e100.net","TCP","86","33142  >  443 [ACK] Seq=1 Ack=1 Win=28800 Len=0 TSval=691093837 TSecr=2145652204"
"60","0.000066140","bom07s01-in-f131.1e100.net","tanvi-HP-Notebook-d585","TCP","74","443  >  46700 [SYN, ACK] Seq=0 Ack=1 Win=60192 Len=0 MSS=1380 SACK_PERM=1 TSval=1697706384 TSecr=740254480 WS=256"
"62","0.000069455","bom12s01-in-f13.1e100.net","tanvi-HP-Notebook-d585","TCP","74","443  >  33762 [SYN, ACK] Seq=0 Ack=1 Win=60192 Len=0 MSS=1380 SACK_PERM=1 TSval=1544750493 TSecr=8408082 WS=256"
"65","0.002693350","del03s10-in-f4.1e100.net","tanvi-HP-Notebook-d585","TCP","74","443  >  54102 [SYN, ACK] Seq=0 Ack=1 Win=60192 Len=0 MSS=1380 SACK_PERM=1 TSval=3818398490 TSecr=49981762 WS=256"
"67","0.001536750","bom07s16-in-x03.1e100.net","tanvi-HP-Notebook.local","TCP","86","443  >  49902 [ACK] Seq=1 Ack=518 Win=66816 Len=0 TSval=322568577 TSecr=3935641469"
"72","0.002386750","del03s10-in-x04.1e100.net","tanvi-HP-Notebook.local","TCP","94","443  >  45874 [SYN, ACK] Seq=0 Ack=1 Win=65535 Len=0 MSS=1360 SACK_PERM=1 TSval=612596307 TSecr=43081892 WS=256"
"73","0.000065636","tanvi-HP-Notebook.local","del03s10-in-x04.1e100.net","TCP","86","45874  >  443 [ACK] Seq=1 Ack=1 Win=28800 Len=0 TSval=43082103 TSecr=612596307"
"75","0.007614635","del03s10-in-x04.1e100.net","tanvi-HP-Notebook.local","TCP","94","443  >  45880 [SYN, ACK] Seq=0 Ack=1 Win=65535 Len=0 MSS=1360 SACK_PERM=1 TSval=3081964186 TSecr=43081942 WS=256"
"76","0.000046772","tanvi-HP-Notebook.local","del03s10-in-x04.1e100.net","TCP","86","45880  >  443 [ACK] Seq=1 Ack=1 Win=28800 Len=0 TSval=43082114 TSecr=3081964186"
"77","0.000068120","del03s10-in-x04.1e100.net","tanvi-HP-Notebook.local","TCP","94","443  >  45884 [SYN, ACK] Seq=0 Ack=1 Win=65535 Len=0 MSS=1360 SACK_PERM=1 TSval=108576392 TSecr=43081966 WS=256"
"78","0.000011929","tanvi-HP-Notebook.local","del03s10-in-x04.1e100.net","TCP","86","45884  >  443 [ACK] Seq=1 Ack=1 Win=28800 Len=0 TSval=43082114 TSecr=108576392"
"82","0.001145490","bom07s01-in-f131.1e100.net","tanvi-HP-Notebook-d585","TCP","66","443  >  46692 [ACK] Seq=1 Ack=518 Win=61440 Len=0 TSval=3333833518 TSecr=740254616"
"84","0.000023594","tanvi-HP-Notebook.local","bom07s16-in-x03.1e100.net","TCP","86","49902  >  443 [ACK] Seq=518 Ack=1209 Win=31232 Len=0 TSval=3935641622 TSecr=322568637"
"86","0.000012002","tanvi-HP-Notebook.local","bom07s16-in-x03.1e100.net","TCP","86","49902  >  443 [ACK] Seq=518 Ack=2417 Win=33664 Len=0 TSval=3935641622 TSecr=322568637"
"88","0.000018071","tanvi-HP-Notebook.local","bom07s16-in-x03.1e100.net","TCP","86","49902  >  443 [ACK] Seq=518 Ack=3625 Win=36096 Len=0 TSval=3935641622 TSecr=322568637"
"90","0.000004657","tanvi-HP-Notebook.local","bom07s16-in-x03.1e100.net","TCP","86","49902  >  443 [ACK] Seq=518 Ack=3781 Win=38528 Len=0 TSval=3935641622 TSecr=322568637"
"97","0.011883720","www.gstatic.com","tanvi-HP-Notebook-d585","TCP","66","443  >  36948 [ACK] Seq=1 Ack=518 Win=61440 Len=0 TSval=2563387801 TSecr=1341718583"
"98","0.009651687","bom12s01-in-x0d.1e100.net","tanvi-HP-Notebook.local","TCP","86","443  >  33132 [ACK] Seq=1 Ack=518 Win=66816 Len=0 TSval=3963627977 TSecr=691093797"
"99","0.000167536","bom07s16-in-x03.1e100.net","tanvi-HP-Notebook.local","TCP","86","443  >  49908 [ACK] Seq=1 Ack=518 Win=66816 Len=0 TSval=220667635 TSecr=3935641521"
"100","0.009755030","bom12s01-in-x0d.1e100.net","tanvi-HP-Notebook.local","TCP","86","443  >  33142 [ACK] Seq=1 Ack=518 Win=66816 Len=0 TSval=2145652304 TSecr=691093838"
"101","0.000148271","bom07s01-in-x03.1e100.net","tanvi-HP-Notebook.local","TCP","86","443  >  54346 [ACK] Seq=1 Ack=518 Win=66816 Len=0 TSval=765658548 TSecr=732766755"
"103","0.000028553","tanvi-HP-Notebook-d585","bom07s01-in-f131.1e100.net","TCP","66","46692  >  443 [ACK] Seq=518 Ack=1389 Win=32128 Len=0 TSval=740254773 TSecr=3333833578"
"105","0.000009880","tanvi-HP-Notebook-d585","bom07s01-in-f131.1e100.net","TCP","66","46692  >  443 [ACK] Seq=518 Ack=2777 Win=35072 Len=0 TSval=740254773 TSecr=3333833578"
"107","0.000009876","tanvi-HP-Notebook-d585","bom07s01-in-f131.1e100.net","TCP","66","46692  >  443 [ACK] Seq=518 Ack=3069 Win=37888 Len=0 TSval=740254773 TSecr=3333833578"
"111","0.008349778","del03s10-in-x04.1e100.net","tanvi-HP-Notebook.local","TCP","86","443  >  45868 [ACK] Seq=1 Ack=518 Win=66816 Len=0 TSval=1945087568 TSecr=43082075"
"120","0.000056905","tanvi-HP-Notebook.local","bom12s01-in-x0d.1e100.net","TCP","86","33132  >  443 [ACK] Seq=518 Ack=1209 Win=31232 Len=0 TSval=691093973 TSecr=3963628038"
"122","0.000033377","tanvi-HP-Notebook.local","bom12s01-in-x0d.1e100.net","TCP","86","33132  >  443 [ACK] Seq=518 Ack=2417 Win=33664 Len=0 TSval=691093973 TSecr=3963628038"
"124","0.000048123","tanvi-HP-Notebook.local","bom12s01-in-x0d.1e100.net","TCP","86","33132  >  443 [ACK] Seq=518 Ack=3049 Win=36096 Len=0 TSval=691093973 TSecr=3963628038"
"126","0.000076958","tanvi-HP-Notebook.local","bom07s16-in-x03.1e100.net","TCP","86","49908  >  443 [ACK] Seq=518 Ack=1209 Win=31232 Len=0 TSval=3935641697 TSecr=220667695"
"128","0.000022496","tanvi-HP-Notebook.local","bom07s16-in-x03.1e100.net","TCP","86","49908  >  443 [ACK] Seq=518 Ack=2417 Win=33664 Len=0 TSval=3935641697 TSecr=220667695"
"130","0.000036037","tanvi-HP-Notebook.local","bom07s16-in-x03.1e100.net","TCP","86","49908  >  443 [ACK] Seq=518 Ack=3625 Win=36096 Len=0 TSval=3935641697 TSecr=220667695"
"132","0.000018860","tanvi-HP-Notebook.local","bom07s16-in-x03.1e100.net","TCP","86","49908  >  443 [ACK] Seq=518 Ack=3780 Win=38528 Len=0 TSval=3935641697 TSecr=220667695"
"133","0.004068105","del03s10-in-x04.1e100.net","tanvi-HP-Notebook.local","TCP","86","443  >  45874 [ACK] Seq=1 Ack=518 Win=66816 Len=0 TSval=612596432 TSecr=43082107"
"136","0.007615430","www.gstatic.com","tanvi-HP-Notebook-d585","TCP","66","443  >  36948 [FIN, ACK] Seq=3782 Ack=519 Win=61440 Len=0 TSval=2563387886 TSecr=1341718704"
"138","0.009935331","bom07s16-in-x03.1e100.net","tanvi-HP-Notebook.local","TCP","86","443  >  49902 [ACK] Seq=3781 Ack=582 Win=66816 Len=0 TSval=322568737 TSecr=3935641625"
"140","0.000043718","tanvi-HP-Notebook.local","bom12s01-in-x0d.1e100.net","TCP","86","33142  >  443 [ACK] Seq=518 Ack=1209 Win=31232 Len=0 TSval=691093999 TSecr=2145652365"
"142","0.000010531","tanvi-HP-Notebook.local","bom12s01-in-x0d.1e100.net","TCP","86","33142  >  443 [ACK] Seq=518 Ack=2417 Win=33664 Len=0 TSval=691093999 TSecr=2145652365"
"144","0.000017126","tanvi-HP-Notebook.local","bom12s01-in-x0d.1e100.net","TCP","86","33142  >  443 [ACK] Seq=518 Ack=3049 Win=36096 Len=0 TSval=691093999 TSecr=2145652365"
"146","0.000001313","bom07s16-in-x03.1e100.net","tanvi-HP-Notebook.local","TCP","86","443  >  49902 [ACK] Seq=3781 Ack=668 Win=66816 Len=0 TSval=322568737 TSecr=3935641626"
"148","0.000008316","tanvi-HP-Notebook.local","bom07s01-in-x03.1e100.net","TCP","86","54346  >  443 [ACK] Seq=518 Ack=1209 Win=31232 Len=0 TSval=732766956 TSecr=765658609"
"149","-0.000007872","bom07s16-in-x03.1e100.net","tanvi-HP-Notebook.local","TCP","86","443  >  49902 [ACK] Seq=3781 Ack=877 Win=67840 Len=0 TSval=322568737 TSecr=3935641626"
"150","0.000075680","bom07s16-in-x03.1e100.net","tanvi-HP-Notebook.local","TCP","86","443  >  49902 [ACK] Seq=3781 Ack=950 Win=67840 Len=0 TSval=322568737 TSecr=3935641626"
"152","0.000005867","tanvi-HP-Notebook.local","bom07s01-in-x03.1e100.net","TCP","86","54346  >  443 [ACK] Seq=518 Ack=2417 Win=33664 Len=0 TSval=732766956 TSecr=765658609"
"154","0.000005008","tanvi-HP-Notebook.local","bom07s01-in-x03.1e100.net","TCP","86","54346  >  443 [ACK] Seq=518 Ack=3068 Win=36096 Len=0 TSval=732766957 TSecr=765658609"
"160","0.000012582","tanvi-HP-Notebook.local","bom07s16-in-x03.1e100.net","TCP","86","49902  >  443 [ACK] Seq=950 Ack=5029 Win=45824 Len=0 TSval=3935641724 TSecr=322568737"
"163","0.000152929","del03s10-in-x04.1e100.net","tanvi-HP-Notebook.local","TCP","86","443  >  45880 [ACK] Seq=1 Ack=518 Win=66816 Len=0 TSval=3081964321 TSecr=43082115"
"164","0.000048954","del03s10-in-x04.1e100.net","tanvi-HP-Notebook.local","TCP","86","443  >  45884 [ACK] Seq=1 Ack=518 Win=66816 Len=0 TSval=108576527 TSecr=43082115"
"166","0.002409420","tanvi-HP-Notebook.local","bom07s16-in-x03.1e100.net","HTTP2","117","SETTINGS[0]"
"170","0.000031188","tanvi-HP-Notebook.local","del03s10-in-x04.1e100.net","TCP","86","45868  >  443 [ACK] Seq=518 Ack=1209 Win=31232 Len=0 TSval=43082260 TSecr=1945087636"
"172","0.000013883","tanvi-HP-Notebook.local","del03s10-in-x04.1e100.net","TCP","86","45868  >  443 [ACK] Seq=518 Ack=2417 Win=33664 Len=0 TSval=43082260 TSecr=1945087636"
"174","0.000008555","tanvi-HP-Notebook.local","del03s10-in-x04.1e100.net","TCP","86","45868  >  443 [ACK] Seq=518 Ack=2625 Win=36096 Len=0 TSval=43082260 TSecr=1945087636"
"179","0.000183905","bom07s01-in-f131.1e100.net","tanvi-HP-Notebook-d585","TCP","66","443  >  46692 [ACK] Seq=3069 Ack=582 Win=61440 Len=0 TSval=3333833672 TSecr=740254779"
"184","0.000026918","tanvi-HP-Notebook-d585","bom07s01-in-f131.1e100.net","HTTP2","97","SETTINGS[0]"
"190","0.001922057","bom07s01-in-f131.1e100.net","tanvi-HP-Notebook-d585","HTTP2","97","SETTINGS[0]"
"191","0.005518805","bom07s01-in-f131.1e100.net","tanvi-HP-Notebook-d585","TCP","66","443  >  46692 [ACK] Seq=3680 Ack=957 Win=62464 Len=0 TSval=3333833682 TSecr=740254779"
"198","0.022783573","tanvi-HP-Notebook-d585","bom07s01-in-f131.1e100.net","TCP","66","46692  >  443 [ACK] Seq=988 Ack=3680 Win=40576 Len=0 TSval=740254907 TSecr=3333833677"
"206","0.000018483","tanvi-HP-Notebook.local","del03s10-in-x04.1e100.net","TCP","86","45884  >  443 [ACK] Seq=518 Ack=1209 Win=31232 Len=0 TSval=43082317 TSecr=108576594"
"207","0.012149299","bom12s01-in-x0d.1e100.net","tanvi-HP-Notebook.local","TCP","86","443  >  33132 [ACK] Seq=3049 Ack=582 Win=66816 Len=0 TSval=3963628137 TSecr=691093982"
"209","0.000009584","tanvi-HP-Notebook.local","del03s10-in-x04.1e100.net","TCP","86","45884  >  443 [ACK] Seq=518 Ack=2417 Win=33664 Len=0 TSval=43082329 TSecr=108576594"
"211","0.000005746","tanvi-HP-Notebook.local","del03s10-in-x04.1e100.net","TCP","86","45884  >  443 [ACK] Seq=518 Ack=2624 Win=36096 Len=0 TSval=43082329 TSecr=108576594"
"213","0.000039328","bom07s16-in-x03.1e100.net","tanvi-HP-Notebook.local","TCP","86","443  >  49908 [ACK] Seq=3780 Ack=582 Win=66816 Len=0 TSval=220667794 TSecr=3935641703"
"216","0.009858360","bom12s01-in-x0d.1e100.net","tanvi-HP-Notebook.local","TCP","86","443  >  33142 [ACK] Seq=3049 Ack=582 Win=66816 Len=0 TSval=2145652469 TSecr=691094002"
"218","0.002125382","bom07s16-in-x03.1e100.net","tanvi-HP-Notebook.local","TCP","86","443  >  49902 [ACK] Seq=5136 Ack=981 Win=67840 Len=0 TSval=322568841 TSecr=3935641731"
"219","0.000076940","bom07s16-in-x03.1e100.net","tanvi-HP-Notebook.local","TCP","86","443  >  49902 [ACK] Seq=5136 Ack=1020 Win=67840 Len=0 TSval=322568842 TSecr=3935641731"
"220","0.003254629","bom07s01-in-x03.1e100.net","tanvi-HP-Notebook.local","TCP","86","443  >  54346 [ACK] Seq=3068 Ack=582 Win=66816 Len=0 TSval=765658723 TSecr=732766961"
"222","0.011110652","bom07s01-in-f131.1e100.net","tanvi-HP-Notebook-d585","TCP","66","443  >  46692 [ACK] Seq=3680 Ack=988 Win=62464 Len=0 TSval=3333833763 TSecr=740254860"
"224","0.010301176","tanvi-HP-Notebook.local","bom12s01-in-x0d.1e100.net","TCP","86","33132  >  443 [ACK] Seq=582 Ack=3629 Win=38528 Len=0 TSval=691094127 TSecr=3963628138"
"225","0.004045099","tanvi-HP-Notebook.local","bom07s16-in-x03.1e100.net","TCP","86","49908  >  443 [ACK] Seq=582 Ack=4360 Win=40960 Len=0 TSval=3935641855 TSecr=220667794"
"226","0.007953878","tanvi-HP-Notebook.local","bom12s01-in-x0d.1e100.net","TCP","86","33142  >  443 [ACK] Seq=582 Ack=3629 Win=38528 Len=0 TSval=691094139 TSecr=2145652469"
"227","0.002870109","del03s10-in-x04.1e100.net","tanvi-HP-Notebook.local","TCP","86","443  >  45874 [FIN, ACK] Seq=2626 Ack=519 Win=66816 Len=0 TSval=612596592 TSecr=43082264"
"229","0.000136457","del03s10-in-x04.1e100.net","tanvi-HP-Notebook.local","TCP","86","443  >  45868 [ACK] Seq=2625 Ack=582 Win=66816 Len=0 TSval=1945087758 TSecr=43082264"
"231","0.000129417","del03s10-in-x04.1e100.net","tanvi-HP-Notebook.local","TCP","86","443  >  45868 [ACK] Seq=2625 Ack=668 Win=66816 Len=0 TSval=1945087758 TSecr=43082265"
"232","0.000063745","del03s10-in-x04.1e100.net","tanvi-HP-Notebook.local","TCP","86","443  >  45868 [ACK] Seq=2625 Ack=1802 Win=69120 Len=0 TSval=1945087758 TSecr=43082265"
"233","0.000147476","del03s10-in-x04.1e100.net","tanvi-HP-Notebook.local","TCP","86","443  >  45868 [ACK] Seq=2625 Ack=1893 Win=69120 Len=0 TSval=1945087758 TSecr=43082265"
"234","0.000022519","del03s10-in-x04.1e100.net","tanvi-HP-Notebook.local","TCP","86","443  >  45868 [ACK] Seq=2625 Ack=1974 Win=69120 Len=0 TSval=1945087758 TSecr=43082265"
"236","0.000205628","tanvi-HP-Notebook.local","del03s10-in-x04.1e100.net","HTTP2","117","SETTINGS[0]"
"237","0.001974974","tanvi-HP-Notebook.local","bom07s01-in-x03.1e100.net","TCP","86","54346  >  443 [ACK] Seq=582 Ack=3648 Win=38528 Len=0 TSval=732767104 TSecr=765658724"
"239","0.002064499","del03s10-in-x04.1e100.net","tanvi-HP-Notebook.local","TCP","86","443  >  45880 [FIN, ACK] Seq=2626 Ack=519 Win=66816 Len=0 TSval=3081964471 TSecr=43082265"
"245","0.002829456","tanvi-HP-Notebook.local","del03s10-in-x04.1e100.net","TCP","86","45868  >  443 [ACK] Seq=2005 Ack=3236 Win=38528 Len=0 TSval=43082437 TSecr=1945087761"
"249","0.018833846","del03s10-in-x04.1e100.net","tanvi-HP-Notebook.local","TCP","86","443  >  45884 [ACK] Seq=2624 Ack=582 Win=66816 Len=0 TSval=108576741 TSecr=43082330"
"252","0.000032175","tanvi-HP-Notebook-d585","bom07s01-in-f131.1e100.net","TCP","66","46692  >  443 [ACK] Seq=988 Ack=3949 Win=43392 Len=0 TSval=740255077 TSecr=3333833891"
"254","0.000025382","tanvi-HP-Notebook-d585","bom07s01-in-f131.1e100.net","TCP","66","46692  >  443 [ACK] Seq=988 Ack=3980 Win=43392 Len=0 TSval=740255079 TSecr=3333833893"
"256","0.000010966","tanvi-HP-Notebook-d585","bom07s01-in-f131.1e100.net","TCP","66","46692  >  443 [ACK] Seq=988 Ack=4019 Win=43392 Len=0 TSval=740255079 TSecr=3333833893"
"259","0.000025952","tanvi-HP-Notebook.local","del03s10-in-x04.1e100.net","TCP","86","45868  >  443 [ACK] Seq=2040 Ack=3747 Win=40960 Len=0 TSval=43082490 TSecr=1945087860"
"261","0.000017324","tanvi-HP-Notebook.local","del03s10-in-x04.1e100.net","TCP","86","45868  >  443 [ACK] Seq=2040 Ack=3811 Win=40960 Len=0 TSval=43082490 TSecr=1945087860"
"263","0.000011836","tanvi-HP-Notebook.local","del03s10-in-x04.1e100.net","TCP","86","45868  >  443 [ACK] Seq=2040 Ack=3842 Win=40960 Len=0 TSval=43082490 TSecr=1945087861"
"265","0.000457923","tanvi-HP-Notebook.local","del03s10-in-x04.1e100.net","TCP","86","45868  >  443 [ACK] Seq=2040 Ack=3881 Win=40960 Len=0 TSval=43082490 TSecr=1945087861"
"267","0.025639950","del03s10-in-x04.1e100.net","tanvi-HP-Notebook.local","HTTP2","312","HEADERS[3]: 200 OK"
"269","0.000018420","tanvi-HP-Notebook.local","del03s10-in-x04.1e100.net","TCP","86","45868  >  443 [ACK] Seq=2079 Ack=5315 Win=45824 Len=0 TSval=43082516 TSecr=1945087877"
"272","0.000009354","tanvi-HP-Notebook.local","del03s10-in-x04.1e100.net","TCP","86","45868  >  443 [ACK] Seq=2079 Ack=7731 Win=50560 Len=0 TSval=43082516 TSecr=1945087880"
"275","0.000008227","tanvi-HP-Notebook.local","del03s10-in-x04.1e100.net","TCP","86","45868  >  443 [ACK] Seq=2079 Ack=10147 Win=55424 Len=0 TSval=43082516 TSecr=1945087886"
"278","0.000012209","tanvi-HP-Notebook.local","del03s10-in-x04.1e100.net","TCP","86","45868  >  443 [ACK] Seq=2079 Ack=12563 Win=60288 Len=0 TSval=43082521 TSecr=1945087892"
"281","0.000015618","tanvi-HP-Notebook.local","del03s10-in-x04.1e100.net","TCP","86","45868  >  443 [ACK] Seq=2079 Ack=14979 Win=65152 Len=0 TSval=43082526 TSecr=1945087897"
"284","0.000015118","tanvi-HP-Notebook.local","del03s10-in-x04.1e100.net","TCP","86","45868  >  443 [ACK] Seq=2079 Ack=17395 Win=69888 Len=0 TSval=43082532 TSecr=1945087903"
"287","0.000017541","tanvi-HP-Notebook.local","del03s10-in-x04.1e100.net","TCP","86","45868  >  443 [ACK] Seq=2079 Ack=19811 Win=74752 Len=0 TSval=43082537 TSecr=1945087909"
"290","0.000036375","tanvi-HP-Notebook.local","del03s10-in-x04.1e100.net","TCP","86","45868  >  443 [ACK] Seq=2079 Ack=22227 Win=79616 Len=0 TSval=43082553 TSecr=1945087915"
"293","0.000013254","tanvi-HP-Notebook.local","del03s10-in-x04.1e100.net","TCP","86","45868  >  443 [ACK] Seq=2079 Ack=24643 Win=84480 Len=0 TSval=43082553 TSecr=1945087921"
"294","0.008502480","del03s10-in-x04.1e100.net","tanvi-HP-Notebook.local","TCP","86","443  >  45868 [ACK] Seq=24643 Ack=2040 Win=69120 Len=0 TSval=1945087933 TSecr=43082438"
"295","0.013604469","bom07s01-in-f131.1e100.net","tanvi-HP-Notebook-d585","TCP","66","443  >  46692 [ACK] Seq=4019 Ack=1027 Win=62464 Len=0 TSval=3333833982 TSecr=740255080"
"299","0.000024036","tanvi-HP-Notebook.local","del03s10-in-x04.1e100.net","TCP","86","45868  >  443 [ACK] Seq=2079 Ack=27059 Win=89216 Len=0 TSval=43082600 TSecr=1945087973"
"302","0.000051339","tanvi-HP-Notebook.local","del03s10-in-x04.1e100.net","TCP","86","45868  >  443 [ACK] Seq=2079 Ack=29475 Win=94080 Len=0 TSval=43082606 TSecr=1945087978"
"305","0.000048490","tanvi-HP-Notebook.local","del03s10-in-x04.1e100.net","TCP","86","45868  >  443 [ACK] Seq=2079 Ack=31891 Win=98944 Len=0 TSval=43082611 TSecr=1945087983"
"308","0.000048737","tanvi-HP-Notebook.local","del03s10-in-x04.1e100.net","TCP","86","45868  >  443 [ACK] Seq=2079 Ack=34307 Win=103808 Len=0 TSval=43082615 TSecr=1945087988"
"309","0.005483483","del03s10-in-x04.1e100.net","tanvi-HP-Notebook.local","TCP","86","443  >  45868 [ACK] Seq=34307 Ack=2079 Win=69120 Len=0 TSval=1945087993 TSecr=43082490"
"312","0.000044066","tanvi-HP-Notebook.local","del03s10-in-x04.1e100.net","TCP","86","45868  >  443 [ACK] Seq=2079 Ack=36723 Win=108544 Len=0 TSval=43082625 TSecr=1945087998"
"315","0.000074885","tanvi-HP-Notebook.local","del03s10-in-x04.1e100.net","TCP","86","45868  >  443 [ACK] Seq=2079 Ack=39139 Win=113408 Len=0 TSval=43082629 TSecr=1945088001"
"318","0.000039239","tanvi-HP-Notebook.local","del03s10-in-x04.1e100.net","TCP","86","45868  >  443 [ACK] Seq=2079 Ack=41555 Win=118272 Len=0 TSval=43082638 TSecr=1945088007"
"322","0.000054552","tanvi-HP-Notebook.local","del03s10-in-x04.1e100.net","TCP","86","45868  >  443 [ACK] Seq=2079 Ack=43971 Win=123136 Len=0 TSval=43082645 TSecr=1945088009"
"326","0.000019796","tanvi-HP-Notebook.local","del03s10-in-x04.1e100.net","TCP","86","45868  >  443 [ACK] Seq=2079 Ack=46387 Win=127872 Len=0 TSval=43082648 TSecr=1945088015"
"331","0.000030318","tanvi-HP-Notebook.local","del03s10-in-x04.1e100.net","TCP","86","45868  >  443 [ACK] Seq=2079 Ack=48803 Win=132736 Len=0 TSval=43082655 TSecr=1945088021"
"334","0.000051351","tanvi-HP-Notebook.local","del03s10-in-x04.1e100.net","TCP","86","45868  >  443 [ACK] Seq=2079 Ack=51219 Win=137600 Len=0 TSval=43082661 TSecr=1945088027"
"337","0.000054465","tanvi-HP-Notebook.local","del03s10-in-x04.1e100.net","TCP","86","45868  >  443 [ACK] Seq=2079 Ack=53635 Win=142464 Len=0 TSval=43082665 TSecr=1945088033"
"340","0.000044074","tanvi-HP-Notebook.local","del03s10-in-x04.1e100.net","TCP","86","45868  >  443 [ACK] Seq=2079 Ack=56051 Win=147200 Len=0 TSval=43082672 TSecr=1945088039"
"343","0.000048914","tanvi-HP-Notebook.local","del03s10-in-x04.1e100.net","TCP","86","45868  >  443 [ACK] Seq=2079 Ack=58467 Win=152064 Len=0 TSval=43082685 TSecr=1945088045"
"346","0.000014714","tanvi-HP-Notebook.local","del03s10-in-x04.1e100.net","TCP","86","45868  >  443 [ACK] Seq=2079 Ack=60883 Win=156928 Len=0 TSval=43082689 TSecr=1945088053"
"349","0.000060124","tanvi-HP-Notebook.local","del03s10-in-x04.1e100.net","TCP","86","45868  >  443 [ACK] Seq=2079 Ack=63299 Win=161792 Len=0 TSval=43082695 TSecr=1945088059"
"352","0.000028050","tanvi-HP-Notebook.local","del03s10-in-x04.1e100.net","TCP","86","45868  >  443 [ACK] Seq=2079 Ack=65715 Win=166528 Len=0 TSval=43082702 TSecr=1945088064"
"355","0.000064355","tanvi-HP-Notebook.local","del03s10-in-x04.1e100.net","TCP","86","45868  >  443 [ACK] Seq=2079 Ack=68131 Win=171392 Len=0 TSval=43082709 TSecr=1945088069"
"358","0.000026597","tanvi-HP-Notebook.local","del03s10-in-x04.1e100.net","TCP","86","45868  >  443 [ACK] Seq=2079 Ack=70547 Win=176256 Len=0 TSval=43082714 TSecr=1945088074"
"361","0.000018684","tanvi-HP-Notebook.local","del03s10-in-x04.1e100.net","TCP","86","45868  >  443 [ACK] Seq=2079 Ack=72963 Win=181120 Len=0 TSval=43082720 TSecr=1945088079"
"364","0.000065452","tanvi-HP-Notebook.local","del03s10-in-x04.1e100.net","TCP","86","45868  >  443 [ACK] Seq=2079 Ack=75379 Win=182144 Len=0 TSval=43082727 TSecr=1945088084"
"367","0.000018060","tanvi-HP-Notebook.local","del03s10-in-x04.1e100.net","TCP","86","45868  >  443 [ACK] Seq=2079 Ack=77795 Win=183296 Len=0 TSval=43082749 TSecr=1945088089"
"369","0.044237074","tanvi-HP-Notebook.local","del03s10-in-x04.1e100.net","TCP","86","45868  >  443 [ACK] Seq=2079 Ack=77823 Win=183296 Len=0 TSval=43082793 TSecr=1945088092"
"467","0.022749989","twitch.map.fastly.net","tanvi-HP-Notebook-d585","TCP","74","443  >  47990 [SYN, ACK] Seq=0 Ack=1 Win=28160 Len=0 MSS=1400 SACK_PERM=1 TSval=2024400611 TSecr=957045848 WS=512"
"468","0.000044746","tanvi-HP-Notebook-d585","twitch.map.fastly.net","TCP","66","47990  >  443 [ACK] Seq=1 Ack=1 Win=29312 Len=0 TSval=957046038 TSecr=2024400611"
"470","0.015375676","twitch.map.fastly.net","tanvi-HP-Notebook-d585","TCP","74","443  >  47992 [SYN, ACK] Seq=0 Ack=1 Win=28160 Len=0 MSS=1400 SACK_PERM=1 TSval=1269388786 TSecr=957045848 WS=512"
"471","0.000037822","tanvi-HP-Notebook-d585","twitch.map.fastly.net","TCP","66","47992  >  443 [ACK] Seq=1 Ack=1 Win=29312 Len=0 TSval=957046053 TSecr=1269388786"
"474","0.091415561","twitch.map.fastly.net","tanvi-HP-Notebook-d585","TCP","74","443  >  47994 [SYN, ACK] Seq=0 Ack=1 Win=28160 Len=0 MSS=1400 SACK_PERM=1 TSval=6831220 TSecr=957046015 WS=512"
"475","0.000051538","tanvi-HP-Notebook-d585","twitch.map.fastly.net","TCP","66","47994  >  443 [ACK] Seq=1 Ack=1 Win=29312 Len=0 TSval=957046220 TSecr=6831220"
"477","0.031455423","twitch.map.fastly.net","tanvi-HP-Notebook-d585","TCP","66","443  >  47990 [ACK] Seq=1 Ack=518 Win=29696 Len=0 TSval=2024400665 TSecr=957046038"
"479","0.000086052","tanvi-HP-Notebook-d585","twitch.map.fastly.net","TCP","66","47990  >  443 [ACK] Seq=518 Ack=1389 Win=32128 Len=0 TSval=957046254 TSecr=2024400666"
"481","0.000111999","tanvi-HP-Notebook-d585","twitch.map.fastly.net","TCP","66","47990  >  443 [ACK] Seq=518 Ack=2777 Win=35072 Len=0 TSval=957046258 TSecr=2024400666"
"483","0.000030356","tanvi-HP-Notebook-d585","twitch.map.fastly.net","TCP","66","47990  >  443 [ACK] Seq=518 Ack=4165 Win=37888 Len=0 TSval=957046258 TSecr=2024400666"
"485","0.000052488","tanvi-HP-Notebook-d585","twitch.map.fastly.net","TCP","66","47990  >  443 [ACK] Seq=518 Ack=4928 Win=40704 Len=0 TSval=957046258 TSecr=2024400666"
"488","0.005586285","twitch.map.fastly.net","tanvi-HP-Notebook-d585","TCP","66","443  >  47992 [ACK] Seq=1 Ack=518 Win=29696 Len=0 TSval=1269388840 TSecr=957046054"
"490","0.000015225","tanvi-HP-Notebook-d585","twitch.map.fastly.net","TCP","66","47992  >  443 [ACK] Seq=518 Ack=1389 Win=32128 Len=0 TSval=957046270 TSecr=1269388840"
"492","0.000035637","tanvi-HP-Notebook-d585","twitch.map.fastly.net","TCP","66","47992  >  443 [ACK] Seq=518 Ack=2777 Win=35072 Len=0 TSval=957046270 TSecr=1269388840"
"494","0.000005635","tanvi-HP-Notebook-d585","twitch.map.fastly.net","TCP","66","47992  >  443 [ACK] Seq=518 Ack=4165 Win=37888 Len=0 TSval=957046270 TSecr=1269388840"
"496","0.000010555","tanvi-HP-Notebook-d585","twitch.map.fastly.net","TCP","66","47992  >  443 [ACK] Seq=518 Ack=4928 Win=40704 Len=0 TSval=957046270 TSecr=1269388840"
"498","0.164974051","twitch.map.fastly.net","tanvi-HP-Notebook-d585","TCP","66","443  >  47994 [ACK] Seq=1 Ack=518 Win=29696 Len=0 TSval=6831274 TSecr=957046221"
"500","0.000016057","tanvi-HP-Notebook-d585","twitch.map.fastly.net","TCP","66","47994  >  443 [ACK] Seq=518 Ack=1389 Win=32128 Len=0 TSval=957046436 TSecr=6831274"
"502","0.000010164","tanvi-HP-Notebook-d585","twitch.map.fastly.net","TCP","66","47994  >  443 [ACK] Seq=518 Ack=2777 Win=35072 Len=0 TSval=957046437 TSecr=6831274"
"504","0.000009618","tanvi-HP-Notebook-d585","twitch.map.fastly.net","TCP","66","47994  >  443 [ACK] Seq=518 Ack=4165 Win=37888 Len=0 TSval=957046437 TSecr=6831274"
"506","0.000006319","tanvi-HP-Notebook-d585","twitch.map.fastly.net","TCP","66","47994  >  443 [ACK] Seq=518 Ack=4928 Win=40704 Len=0 TSval=957046437 TSecr=6831274"
"508","0.018252228","twitch.map.fastly.net","tanvi-HP-Notebook-d585","TLSv1.2","324","New Session Ticket, Change Cipher Spec, Finished"
"509","0.038119378","twitch.map.fastly.net","tanvi-HP-Notebook-d585","TCP","1454","443  >  47990 [ACK] Seq=5186 Ack=1315 Win=30720 Len=1388 TSval=2024400723 TSecr=957046264 [TCP segment of a reassembled PDU]"
"510","0.000060422","tanvi-HP-Notebook-d585","twitch.map.fastly.net","TCP","66","47990  >  443 [ACK] Seq=1315 Ack=6574 Win=46336 Len=0 TSval=957046497 TSecr=2024400716"
"513","0.000010272","tanvi-HP-Notebook-d585","twitch.map.fastly.net","TCP","66","47990  >  443 [ACK] Seq=1315 Ack=7974 Win=49280 Len=0 TSval=957046497 TSecr=2024400723"
"514","-0.000010006","twitch.map.fastly.net","tanvi-HP-Notebook-d585","TLSv1.2","324","New Session Ticket, Change Cipher Spec, Finished"
"517","0.000005263","tanvi-HP-Notebook-d585","twitch.map.fastly.net","TCP","66","47990  >  443 [ACK] Seq=1315 Ack=10750 Win=55040 Len=0 TSval=957046497 TSecr=2024400723"
"520","0.000007230","tanvi-HP-Notebook-d585","twitch.map.fastly.net","TCP","66","47990  >  443 [ACK] Seq=1315 Ack=12150 Win=57984 Len=0 TSval=957046497 TSecr=2024400723"
"523","0.000005651","tanvi-HP-Notebook-d585","twitch.map.fastly.net","TCP","66","47990  >  443 [ACK] Seq=1315 Ack=13550 Win=60928 Len=0 TSval=957046497 TSecr=2024400723"
"524","0.039748133","tanvi-HP-Notebook-d585","twitch.map.fastly.net","TCP","66","47992  >  443 [ACK] Seq=611 Ack=5186 Win=43520 Len=0 TSval=957046537 TSecr=1269388893"
"564","0.000432232","twitch.map.fastly.net","tanvi-HP-Notebook-d585","TLSv1.2","324","New Session Ticket, Change Cipher Spec, Finished"
"575","0.013905915","mobile-gtalk.l.google.com","tanvi-HP-Notebook.local","TCP","94","5228  >  45240 [SYN, ACK] Seq=0 Ack=1 Win=61512 Len=0 MSS=1400 SACK_PERM=1 TSval=2666072291 TSecr=897926070 WS=256"
"576","0.000036712","tanvi-HP-Notebook.local","mobile-gtalk.l.google.com","TCP","86","45240  >  5228 [ACK] Seq=1 Ack=1 Win=28800 Len=0 TSval=897926177 TSecr=2666072291"
"580","0.000976699","safebrowsing.googleapis.com","tanvi-HP-Notebook.local","TCP","94","443  >  60672 [SYN, ACK] Seq=0 Ack=1 Win=65535 Len=0 MSS=1360 SACK_PERM=1 TSval=4144057669 TSecr=3282427047 WS=256"
"581","0.000026884","tanvi-HP-Notebook.local","safebrowsing.googleapis.com","TCP","86","60672  >  443 [ACK] Seq=1 Ack=1 Win=28800 Len=0 TSval=3282427179 TSecr=4144057669"
"586","0.004486651","tanvi-HP-Notebook-d585","twitch.map.fastly.net","TCP","66","47994  >  443 [ACK] Seq=611 Ack=5186 Win=43520 Len=0 TSval=957046697 TSecr=6831329"
"589","0.000007790","tanvi-HP-Notebook-d585","twitch.map.fastly.net","TCP","66","47990  >  443 [ACK] Seq=1315 Ack=16326 Win=66688 Len=0 TSval=957046700 TSecr=2024400776"
"592","0.000005060","tanvi-HP-Notebook-d585","twitch.map.fastly.net","TCP","66","47990  >  443 [ACK] Seq=1315 Ack=19102 Win=72448 Len=0 TSval=957046700 TSecr=2024400776"
"595","0.000021903","tanvi-HP-Notebook-d585","twitch.map.fastly.net","TCP","78","47990  >  443 [ACK] Seq=1315 Ack=20490 Win=78208 Len=0 TSval=957046708 TSecr=2024400779 SLE=21878 SRE=23266"
"683","0.031221664","mobile-gtalk.l.google.com","tanvi-HP-Notebook.local","TCP","86","5228  >  45240 [ACK] Seq=1 Ack=518 Win=62720 Len=0 TSval=2666072426 TSecr=897926179"
"685","0.000032078","tanvi-HP-Notebook.local","mobile-gtalk.l.google.com","TCP","86","45240  >  5228 [ACK] Seq=518 Ack=1209 Win=31232 Len=0 TSval=897926314 TSecr=2666072427"
"687","0.000078486","tanvi-HP-Notebook.local","mobile-gtalk.l.google.com","TCP","86","45240  >  5228 [ACK] Seq=518 Ack=2417 Win=33664 Len=0 TSval=897926314 TSecr=2666072427"
"689","0.000012225","tanvi-HP-Notebook.local","mobile-gtalk.l.google.com","TCP","86","45240  >  5228 [ACK] Seq=518 Ack=3625 Win=36096 Len=0 TSval=897926314 TSecr=2666072427"
"691","0.000024726","tanvi-HP-Notebook.local","mobile-gtalk.l.google.com","TCP","86","45240  >  5228 [ACK] Seq=518 Ack=3772 Win=38528 Len=0 TSval=897926314 TSecr=2666072427"
"692","0.007763532","safebrowsing.googleapis.com","tanvi-HP-Notebook.local","TCP","86","443  >  60672 [ACK] Seq=1 Ack=518 Win=66816 Len=0 TSval=4144057809 TSecr=3282427179"
"703","0.007763049","h2.twitch.map.fastly.net","tanvi-HP-Notebook-d585","TCP","74","443  >  54618 [SYN, ACK] Seq=0 Ack=1 Win=28160 Len=0 MSS=1400 SACK_PERM=1 TSval=857710796 TSecr=2744164741 WS=512"
"704","0.000118238","tanvi-HP-Notebook-d585","h2.twitch.map.fastly.net","TCP","66","54618  >  443 [ACK] Seq=1 Ack=1 Win=29312 Len=0 TSval=2744164953 TSecr=857710796"
"707","0.001659564","h2.twitch.map.fastly.net","tanvi-HP-Notebook-d585","TCP","74","443  >  54620 [SYN, ACK] Seq=0 Ack=1 Win=28160 Len=0 MSS=1400 SACK_PERM=1 TSval=676078181 TSecr=2744164741 WS=512"
"708","0.000050194","tanvi-HP-Notebook-d585","h2.twitch.map.fastly.net","TCP","66","54620  >  443 [ACK] Seq=1 Ack=1 Win=29312 Len=0 TSval=2744164956 TSecr=676078181"
"712","0.003260922","twitch.map.fastly.net","tanvi-HP-Notebook-d585","TCP","74","443  >  48006 [SYN, ACK] Seq=0 Ack=1 Win=28160 Len=0 MSS=1400 SACK_PERM=1 TSval=855643732 TSecr=957046660 WS=512"
"713","0.000136988","tanvi-HP-Notebook-d585","twitch.map.fastly.net","TCP","66","48006  >  443 [ACK] Seq=1 Ack=1 Win=29312 Len=0 TSval=957046875 TSecr=855643732"
"716","0.000040554","tanvi-HP-Notebook.local","safebrowsing.googleapis.com","TCP","86","60672  >  443 [ACK] Seq=518 Ack=1209 Win=31232 Len=0 TSval=3282427391 TSecr=4144057879"
"718","0.000016224","tanvi-HP-Notebook.local","safebrowsing.googleapis.com","TCP","86","60672  >  443 [ACK] Seq=518 Ack=2417 Win=33664 Len=0 TSval=3282427391 TSecr=4144057879"
"720","0.000034176","tanvi-HP-Notebook.local","safebrowsing.googleapis.com","TCP","86","60672  >  443 [ACK] Seq=518 Ack=3069 Win=36096 Len=0 TSval=3282427391 TSecr=4144057879"
"722","0.000032709","tanvi-HP-Notebook-d585","twitch.map.fastly.net","TCP","66","47990  >  443 [ACK] Seq=1315 Ack=33453 Win=104192 Len=0 TSval=957046900 TSecr=2024400826"
"731","0.015133546","science-edge-external-prod-73889260.us-west-2.elb.amazonaws.com","tanvi-HP-Notebook-d585","TCP","74","443  >  52360 [SYN, ACK] Seq=0 Ack=1 Win=26847 Len=0 MSS=1400 SACK_PERM=1 TSval=1074869196 TSecr=3120154079 WS=256"
"732","0.000042569","tanvi-HP-Notebook-d585","science-edge-external-prod-73889260.us-west-2.elb.amazonaws.com","TCP","66","52360  >  443 [ACK] Seq=1 Ack=1 Win=29312 Len=0 TSval=3120154433 TSecr=1074869196"
"734","0.008019639","mobile-gtalk.l.google.com","tanvi-HP-Notebook.local","TCP","86","5228  >  45240 [ACK] Seq=3772 Ack=759 Win=63744 Len=0 TSval=2666072562 TSecr=897926323"
"737","0.000069829","tanvi-HP-Notebook.local","mobile-gtalk.l.google.com","TCP","86","45240  >  5228 [ACK] Seq=759 Ack=4413 Win=40960 Len=0 TSval=897926474 TSecr=2666072562"
"739","0.026426065","h2.twitch.map.fastly.net","tanvi-HP-Notebook-d585","TCP","74","443  >  54624 [SYN, ACK] Seq=0 Ack=1 Win=28160 Len=0 MSS=1400 SACK_PERM=1 TSval=1916561324 TSecr=2744164869 WS=512"
"740","0.000046861","tanvi-HP-Notebook-d585","h2.twitch.map.fastly.net","TCP","66","54624  >  443 [ACK] Seq=1 Ack=1 Win=29312 Len=0 TSval=2744165100 TSecr=1916561324"
"742","0.017147909","tanvi-HP-Notebook.local","mobile-gtalk.l.google.com","TCP","86","45240  >  5228 [ACK] Seq=759 Ack=4540 Win=40960 Len=0 TSval=897926520 TSecr=2666072568"
"743","0.012853843","safebrowsing.googleapis.com","tanvi-HP-Notebook.local","TCP","86","443  >  60672 [ACK] Seq=3069 Ack=582 Win=66816 Len=0 TSval=4144058009 TSecr=3282427399"
"744","0.000003722","safebrowsing.googleapis.com","tanvi-HP-Notebook.local","TCP","86","443  >  60672 [ACK] Seq=3069 Ack=668 Win=66816 Len=0 TSval=4144058009 TSecr=3282427401"
"745","0.000210742","safebrowsing.googleapis.com","tanvi-HP-Notebook.local","TCP","86","443  >  60672 [ACK] Seq=3069 Ack=1480 Win=68352 Len=0 TSval=4144058009 TSecr=3282427401"
"747","0.001442641","tanvi-HP-Notebook.local","safebrowsing.googleapis.com","HTTP2","117","SETTINGS[0]"
"749","0.001253911","h2.twitch.map.fastly.net","tanvi-HP-Notebook-d585","TCP","74","443  >  54626 [SYN, ACK] Seq=0 Ack=1 Win=28160 Len=0 MSS=1400 SACK_PERM=1 TSval=1936638750 TSecr=2744164940 WS=512"
"750","0.000028371","tanvi-HP-Notebook-d585","h2.twitch.map.fastly.net","TCP","66","54626  >  443 [ACK] Seq=1 Ack=1 Win=29312 Len=0 TSval=2744165140 TSecr=1936638750"
"752","0.003172400","update.googleapis.com","tanvi-HP-Notebook.local","TCP","94","443  >  44136 [SYN, ACK] Seq=0 Ack=1 Win=65535 Len=0 MSS=1360 SACK_PERM=1 TSval=2077815221 TSecr=1398089247 WS=256"
"753","0.000042448","tanvi-HP-Notebook.local","update.googleapis.com","TCP","86","44136  >  443 [ACK] Seq=1 Ack=1 Win=28800 Len=0 TSval=1398089390 TSecr=2077815221"
"755","0.009840501","static.twitchcdn.net","tanvi-HP-Notebook-d585","TCP","74","443  >  37550 [SYN, ACK] Seq=0 Ack=1 Win=28160 Len=0 MSS=1400 SACK_PERM=1 TSval=857710854 TSecr=1170465352 WS=512"
"756","0.000160907","tanvi-HP-Notebook-d585","static.twitchcdn.net","TCP","66","37550  >  443 [ACK] Seq=1 Ack=1 Win=29312 Len=0 TSval=1170465549 TSecr=857710854"
"761","0.005611994","h2.twitch.map.fastly.net","tanvi-HP-Notebook-d585","TCP","66","443  >  54618 [ACK] Seq=1 Ack=518 Win=29696 Len=0 TSval=857710851 TSecr=2744164953"
"763","0.000020703","tanvi-HP-Notebook-d585","h2.twitch.map.fastly.net","TCP","66","54618  >  443 [ACK] Seq=518 Ack=1389 Win=32128 Len=0 TSval=2744165171 TSecr=857710852"
"765","0.000026000","tanvi-HP-Notebook-d585","h2.twitch.map.fastly.net","TCP","66","54618  >  443 [ACK] Seq=518 Ack=2777 Win=35072 Len=0 TSval=2744165172 TSecr=857710852"
"767","0.000008564","tanvi-HP-Notebook-d585","h2.twitch.map.fastly.net","TCP","66","54618  >  443 [ACK] Seq=518 Ack=4165 Win=37888 Len=0 TSval=2744165172 TSecr=857710852"
"769","0.000008429","tanvi-HP-Notebook-d585","h2.twitch.map.fastly.net","TCP","66","54618  >  443 [ACK] Seq=518 Ack=4922 Win=40704 Len=0 TSval=2744165172 TSecr=857710852"
"773","0.002099975","h2.twitch.map.fastly.net","tanvi-HP-Notebook-d585","TCP","66","443  >  54620 [ACK] Seq=1 Ack=518 Win=29696 Len=0 TSval=676078236 TSecr=2744164957"
"775","0.000009313","tanvi-HP-Notebook-d585","h2.twitch.map.fastly.net","TCP","66","54620  >  443 [ACK] Seq=518 Ack=1389 Win=32128 Len=0 TSval=2744165179 TSecr=676078236"
"777","0.000005670","tanvi-HP-Notebook-d585","h2.twitch.map.fastly.net","TCP","66","54620  >  443 [ACK] Seq=518 Ack=2777 Win=35072 Len=0 TSval=2744165179 TSecr=676078236"
"779","0.000004033","tanvi-HP-Notebook-d585","h2.twitch.map.fastly.net","TCP","66","54620  >  443 [ACK] Seq=518 Ack=4165 Win=37888 Len=0 TSval=2744165179 TSecr=676078236"
"781","0.000004757","tanvi-HP-Notebook-d585","h2.twitch.map.fastly.net","TCP","66","54620  >  443 [ACK] Seq=518 Ack=4922 Win=40704 Len=0 TSval=2744165179 TSecr=676078236"
"783","0.001436939","tanvi-HP-Notebook.local","safebrowsing.googleapis.com","TCP","86","60672  >  443 [ACK] Seq=1511 Ack=3680 Win=38528 Len=0 TSval=3282427582 TSecr=4144058009"
"784","0.004270577","twitch.map.fastly.net","tanvi-HP-Notebook-d585","TCP","66","443  >  48006 [ACK] Seq=1 Ack=518 Win=29696 Len=0 TSval=855643787 TSecr=957046876"
"786","0.000017832","tanvi-HP-Notebook-d585","twitch.map.fastly.net","TCP","66","48006  >  443 [ACK] Seq=518 Ack=1389 Win=32128 Len=0 TSval=957047100 TSecr=855643787"
"788","0.000008064","tanvi-HP-Notebook-d585","twitch.map.fastly.net","TCP","66","48006  >  443 [ACK] Seq=518 Ack=2777 Win=35072 Len=0 TSval=957047100 TSecr=855643787"
"790","0.000004642","tanvi-HP-Notebook-d585","twitch.map.fastly.net","TCP","66","48006  >  443 [ACK] Seq=518 Ack=4165 Win=37888 Len=0 TSval=957047100 TSecr=855643787"
"792","0.000007998","tanvi-HP-Notebook-d585","twitch.map.fastly.net","TCP","66","48006  >  443 [ACK] Seq=518 Ack=4928 Win=40704 Len=0 TSval=957047100 TSecr=855643787"
