"No.","Time","Source","Destination","Protocol","Length","Info"
"16","0.077258570","www.gstatic.com","tanvi-HP-Notebook.local","TCP","94","443  >  55706 [SYN, ACK] Seq=0 Ack=1 Win=65535 Len=0 MSS=1360 SACK_PERM=1 TSval=3581115125 TSecr=1211707805 WS=256"
"17","0.000040414","tanvi-HP-Notebook.local","www.gstatic.com","TCP","86","55706  >  443 [ACK] Seq=1 Ack=1 Win=28800 Len=0 TSval=1211707882 TSecr=3581115125"
"19","0.009365302","www.gstatic.com","tanvi-HP-Notebook.local","TCP","94","443  >  55708 [SYN, ACK] Seq=0 Ack=1 Win=65535 Len=0 MSS=1360 SACK_PERM=1 TSval=3466275713 TSecr=1211707805 WS=256"
"20","0.000043938","tanvi-HP-Notebook.local","www.gstatic.com","TCP","86","55708  >  443 [ACK] Seq=1 Ack=1 Win=28800 Len=0 TSval=1211707894 TSecr=3466275713"
"25","0.000750698","www.gstatic.com","tanvi-HP-Notebook.local","TCP","86","443  >  55706 [ACK] Seq=1 Ack=518 Win=66816 Len=0 TSval=3581115215 TSecr=1211707884"
"26","0.026284792","www.gstatic.com","tanvi-HP-Notebook.local","TCP","86","443  >  55708 [ACK] Seq=1 Ack=518 Win=66816 Len=0 TSval=3466275818 TSecr=1211707904"
"28","0.000193117","tanvi-HP-Notebook.local","www.gstatic.com","TCP","86","55706  >  443 [ACK] Seq=518 Ack=1209 Win=31232 Len=0 TSval=1211708025 TSecr=3581115247"
"30","0.000052856","tanvi-HP-Notebook.local","www.gstatic.com","TCP","86","55706  >  443 [ACK] Seq=518 Ack=2417 Win=33664 Len=0 TSval=1211708025 TSecr=3581115247"
"32","0.000110056","tanvi-HP-Notebook.local","www.gstatic.com","TCP","86","55706  >  443 [ACK] Seq=518 Ack=3625 Win=36096 Len=0 TSval=1211708025 TSecr=3581115247"
"34","0.000143457","tanvi-HP-Notebook.local","www.gstatic.com","TCP","86","55706  >  443 [ACK] Seq=518 Ack=3782 Win=38528 Len=0 TSval=1211708025 TSecr=3581115247"
"36","0.000029332","tanvi-HP-Notebook.local","www.gstatic.com","TCP","86","55708  >  443 [ACK] Seq=518 Ack=1209 Win=31232 Len=0 TSval=1211708033 TSecr=3466275850"
"38","0.000008067","tanvi-HP-Notebook.local","www.gstatic.com","TCP","86","55708  >  443 [ACK] Seq=518 Ack=2417 Win=33664 Len=0 TSval=1211708033 TSecr=3466275850"
"40","0.000007525","tanvi-HP-Notebook.local","www.gstatic.com","TCP","86","55708  >  443 [ACK] Seq=518 Ack=3625 Win=36096 Len=0 TSval=1211708033 TSecr=3466275850"
"42","0.000007368","tanvi-HP-Notebook.local","www.gstatic.com","TCP","86","55708  >  443 [ACK] Seq=518 Ack=3782 Win=38528 Len=0 TSval=1211708033 TSecr=3466275850"
"52","0.062708616","www.gstatic.com","tanvi-HP-Notebook.local","HTTP2","666","SETTINGS[0], WINDOW_UPDATE[0]"
"53","0.000270481","tanvi-HP-Notebook.local","www.gstatic.com","HTTP2","117","SETTINGS[0]"
"54","0.009588073","www.gstatic.com","tanvi-HP-Notebook.local","TCP","86","443  >  55706 [ACK] Seq=4362 Ack=950 Win=67840 Len=0 TSval=3581115375 TSecr=1211708048"
"56","0.000030118","www.gstatic.com","tanvi-HP-Notebook.local","HTTP2","666","SETTINGS[0], WINDOW_UPDATE[0]"
"61","0.000017967","tanvi-HP-Notebook.local","www.gstatic.com","TCP","86","55706  >  443 [ACK] Seq=981 Ack=4849 Win=43392 Len=0 TSval=1211708133 TSecr=3581115376"
"65","0.000948284","tanvi-HP-Notebook.local","www.gstatic.com","TCP","86","55706  >  443 [ACK] Seq=981 Ack=5137 Win=45824 Len=0 TSval=1211708134 TSecr=3581115376"
"71","0.038429054","update.googleapis.com","tanvi-HP-Notebook.local","TCP","94","443  >  45068 [SYN, ACK] Seq=0 Ack=1 Win=65535 Len=0 MSS=1360 SACK_PERM=1 TSval=4002786603 TSecr=1541883949 WS=256"
"72","0.000034338","tanvi-HP-Notebook.local","update.googleapis.com","TCP","86","45068  >  443 [ACK] Seq=1 Ack=1 Win=28800 Len=0 TSval=1541884079 TSecr=4002786603"
"84","0.030119716","www.gstatic.com","tanvi-HP-Notebook.local","TCP","86","443  >  55706 [ACK] Seq=5137 Ack=981 Win=67840 Len=0 TSval=3581115459 TSecr=1211708122"
"85","0.000106919","www.gstatic.com","tanvi-HP-Notebook.local","TCP","86","443  >  55706 [ACK] Seq=5137 Ack=1020 Win=67840 Len=0 TSval=3581115460 TSecr=1211708135"
"86","0.096118865","update.googleapis.com","tanvi-HP-Notebook.local","TCP","86","443  >  45068 [ACK] Seq=1 Ack=518 Win=66816 Len=0 TSval=4002786733 TSecr=1541884079"
"90","0.000025917","tanvi-HP-Notebook.local","update.googleapis.com","TCP","86","45068  >  443 [ACK] Seq=518 Ack=1209 Win=31232 Len=0 TSval=1541884280 TSecr=4002786801"
"92","0.000014521","tanvi-HP-Notebook.local","update.googleapis.com","TCP","86","45068  >  443 [ACK] Seq=518 Ack=2417 Win=33664 Len=0 TSval=1541884280 TSecr=4002786801"
"94","0.000008186","tanvi-HP-Notebook.local","update.googleapis.com","TCP","86","45068  >  443 [ACK] Seq=518 Ack=3069 Win=36096 Len=0 TSval=1541884280 TSecr=4002786801"
"111","0.130375204","update.googleapis.com","tanvi-HP-Notebook.local","TLSv1.3","117","[TCP Previous segment not captured] , Application Data"
"117","0.000021754","tanvi-HP-Notebook.local","update.googleapis.com","TCP","86","45068  >  443 [ACK] Seq=957 Ack=3680 Win=40960 Len=0 TSval=1541884428 TSecr=4002786938"
"131","0.061331901","update.googleapis.com","tanvi-HP-Notebook.local","TCP","86","443  >  45068 [ACK] Seq=3680 Ack=988 Win=67840 Len=0 TSval=4002787087 TSecr=1541884428"
"141","0.000031941","tanvi-HP-Notebook.local","update.googleapis.com","TCP","86","45068  >  443 [ACK] Seq=988 Ack=3980 Win=43392 Len=0 TSval=1541884636 TSecr=4002787161"
"143","0.000285921","tanvi-HP-Notebook.local","update.googleapis.com","HTTP2","125","PING[0]"
"189","0.002323710","update.googleapis.com","tanvi-HP-Notebook.local","TCP","86","443  >  45068 [ACK] Seq=4019 Ack=1027 Win=67840 Len=0 TSval=4002787283 TSecr=1541884636"
"294","0.106427050","twitch.map.fastly.net","tanvi-HP-Notebook-d18b","TCP","74","443  >  49016 [SYN, ACK] Seq=0 Ack=1 Win=28160 Len=0 MSS=1400 SACK_PERM=1 TSval=952060853 TSecr=1099631344 WS=512"
"295","0.000036730","tanvi-HP-Notebook-d18b","twitch.map.fastly.net","TCP","66","49016  >  443 [ACK] Seq=1 Ack=1 Win=29312 Len=0 TSval=1099631549 TSecr=952060853"
"297","0.005849200","twitch.map.fastly.net","tanvi-HP-Notebook-d18b","TCP","74","443  >  49018 [SYN, ACK] Seq=0 Ack=1 Win=28160 Len=0 MSS=1400 SACK_PERM=1 TSval=2033098072 TSecr=1099631344 WS=512"
"298","0.000050177","tanvi-HP-Notebook-d18b","twitch.map.fastly.net","TCP","66","49018  >  443 [ACK] Seq=1 Ack=1 Win=29312 Len=0 TSval=1099631555 TSecr=2033098072"
"300","0.082992667","twitch.map.fastly.net","tanvi-HP-Notebook-d18b","TCP","74","443  >  49020 [SYN, ACK] Seq=0 Ack=1 Win=28160 Len=0 MSS=1400 SACK_PERM=1 TSval=864859309 TSecr=1099631443 WS=512"
"301","0.000046542","tanvi-HP-Notebook-d18b","twitch.map.fastly.net","TCP","66","49020  >  443 [ACK] Seq=1 Ack=1 Win=29312 Len=0 TSval=1099631638 TSecr=864859309"
"303","0.132221302","twitch.map.fastly.net","tanvi-HP-Notebook-d18b","TCP","66","443  >  49016 [ACK] Seq=1 Ack=518 Win=29696 Len=0 TSval=952060908 TSecr=1099631549"
"305","0.000023121","tanvi-HP-Notebook-d18b","twitch.map.fastly.net","TCP","66","49016  >  443 [ACK] Seq=518 Ack=1389 Win=32128 Len=0 TSval=1099631783 TSecr=952060908"
"307","0.000009128","tanvi-HP-Notebook-d18b","twitch.map.fastly.net","TCP","66","49016  >  443 [ACK] Seq=518 Ack=2777 Win=35072 Len=0 TSval=1099631783 TSecr=952060908"
"309","0.000008464","tanvi-HP-Notebook-d18b","twitch.map.fastly.net","TCP","66","49016  >  443 [ACK] Seq=518 Ack=4165 Win=37888 Len=0 TSval=1099631783 TSecr=952060908"
"311","0.000005475","tanvi-HP-Notebook-d18b","twitch.map.fastly.net","TCP","66","49016  >  443 [ACK] Seq=518 Ack=4928 Win=40704 Len=0 TSval=1099631783 TSecr=952060908"
"314","0.018643541","twitch.map.fastly.net","tanvi-HP-Notebook-d18b","TCP","66","443  >  49018 [ACK] Seq=1 Ack=518 Win=29696 Len=0 TSval=2033098135 TSecr=1099631555"
"316","0.000020962","tanvi-HP-Notebook-d18b","twitch.map.fastly.net","TCP","66","49018  >  443 [ACK] Seq=518 Ack=1389 Win=32128 Len=0 TSval=1099631819 TSecr=2033098135"
"318","0.000011202","tanvi-HP-Notebook-d18b","twitch.map.fastly.net","TCP","66","49018  >  443 [ACK] Seq=518 Ack=2777 Win=35072 Len=0 TSval=1099631819 TSecr=2033098135"
"320","0.000006093","tanvi-HP-Notebook-d18b","twitch.map.fastly.net","TCP","66","49018  >  443 [ACK] Seq=518 Ack=4165 Win=37888 Len=0 TSval=1099631819 TSecr=2033098135"
"322","0.000006480","tanvi-HP-Notebook-d18b","twitch.map.fastly.net","TCP","66","49018  >  443 [ACK] Seq=518 Ack=4928 Win=40704 Len=0 TSval=1099631819 TSecr=2033098135"
"324","0.022071489","twitch.map.fastly.net","tanvi-HP-Notebook-d18b","TCP","66","443  >  49020 [ACK] Seq=1 Ack=518 Win=29696 Len=0 TSval=864859360 TSecr=1099631639"
"326","0.000028378","tanvi-HP-Notebook-d18b","twitch.map.fastly.net","TCP","66","49020  >  443 [ACK] Seq=518 Ack=1389 Win=32128 Len=0 TSval=1099631855 TSecr=864859360"
"328","0.000014932","tanvi-HP-Notebook-d18b","twitch.map.fastly.net","TCP","66","49020  >  443 [ACK] Seq=518 Ack=2777 Win=35072 Len=0 TSval=1099631855 TSecr=864859360"
"330","0.000007172","tanvi-HP-Notebook-d18b","twitch.map.fastly.net","TCP","66","49020  >  443 [ACK] Seq=518 Ack=4165 Win=37888 Len=0 TSval=1099631855 TSecr=864859360"
"332","0.000006176","tanvi-HP-Notebook-d18b","twitch.map.fastly.net","TCP","66","49020  >  443 [ACK] Seq=518 Ack=4928 Win=40704 Len=0 TSval=1099631855 TSecr=864859360"
"334","0.136765027","twitch.map.fastly.net","tanvi-HP-Notebook-d18b","TLSv1.2","324","New Session Ticket, Change Cipher Spec, Finished"
"335","0.038120293","twitch.map.fastly.net","tanvi-HP-Notebook-d18b","TLSv1.2","924","[SSL segment of a reassembled PDU]"
"336","0.000038628","tanvi-HP-Notebook-d18b","twitch.map.fastly.net","TCP","66","49016  >  443 [ACK] Seq=1325 Ack=6044 Win=46336 Len=0 TSval=1099632032 TSecr=952060964"
"339","0.000009484","tanvi-HP-Notebook-d18b","twitch.map.fastly.net","TCP","66","49016  >  443 [ACK] Seq=1325 Ack=8820 Win=52096 Len=0 TSval=1099632032 TSecr=952060973"
"341","0.042045904","tanvi-HP-Notebook-d18b","twitch.map.fastly.net","TCP","66","49016  >  443 [ACK] Seq=1325 Ack=10208 Win=54912 Len=0 TSval=1099632074 TSecr=952060973"
"343","0.002099514","twitch.map.fastly.net","tanvi-HP-Notebook-d18b","TLSv1.2","324","New Session Ticket, Change Cipher Spec, Finished"
"345","0.000010949","tanvi-HP-Notebook-d18b","twitch.map.fastly.net","TCP","66","49016  >  443 [ACK] Seq=1325 Ack=11596 Win=57856 Len=0 TSval=1099632077 TSecr=952060973"
"347","0.000011180","tanvi-HP-Notebook-d18b","twitch.map.fastly.net","TCP","66","49016  >  443 [ACK] Seq=1325 Ack=12984 Win=60800 Len=0 TSval=1099632077 TSecr=952060973"
"349","0.000006261","tanvi-HP-Notebook-d18b","twitch.map.fastly.net","TCP","66","49016  >  443 [ACK] Seq=1325 Ack=14372 Win=63616 Len=0 TSval=1099632077 TSecr=952060973"
"351","0.000006032","tanvi-HP-Notebook-d18b","twitch.map.fastly.net","TCP","66","49016  >  443 [ACK] Seq=1325 Ack=15760 Win=66560 Len=0 TSval=1099632077 TSecr=952060973"
"353","0.000005422","tanvi-HP-Notebook-d18b","twitch.map.fastly.net","TCP","66","49016  >  443 [ACK] Seq=1325 Ack=17148 Win=69504 Len=0 TSval=1099632077 TSecr=952060973"
"354","0.000032066","twitch.map.fastly.net","tanvi-HP-Notebook-d18b","TLSv1.2","324","New Session Ticket, Change Cipher Spec, Finished"
"369","0.002693125","tanvi-HP-Notebook-d18b","twitch.map.fastly.net","TCP","66","49020  >  443 [ACK] Seq=611 Ack=5186 Win=43520 Len=0 TSval=1099632118 TSecr=864859414"
"370","0.000014952","tanvi-HP-Notebook-d18b","twitch.map.fastly.net","TCP","66","49018  >  443 [ACK] Seq=611 Ack=5186 Win=43520 Len=0 TSval=1099632118 TSecr=2033098192"
"376","0.042853365","safebrowsing.googleapis.com","tanvi-HP-Notebook.local","TCP","94","443  >  42678 [SYN, ACK] Seq=0 Ack=1 Win=65535 Len=0 MSS=1360 SACK_PERM=1 TSval=4095970983 TSecr=3814131709 WS=256"
"377","0.000164001","tanvi-HP-Notebook.local","safebrowsing.googleapis.com","TCP","86","42678  >  443 [ACK] Seq=1 Ack=1 Win=28800 Len=0 TSval=3814131790 TSecr=4095970983"
"389","0.000023663","tanvi-HP-Notebook-d18b","twitch.map.fastly.net","TCP","66","49016  >  443 [ACK] Seq=1325 Ack=18536 Win=72320 Len=0 TSval=1099632248 TSecr=952061025"
"391","0.000010391","tanvi-HP-Notebook-d18b","twitch.map.fastly.net","TCP","66","49016  >  443 [ACK] Seq=1325 Ack=19924 Win=75264 Len=0 TSval=1099632248 TSecr=952061025"
"393","0.000007364","tanvi-HP-Notebook-d18b","twitch.map.fastly.net","TCP","66","49016  >  443 [ACK] Seq=1325 Ack=21312 Win=78080 Len=0 TSval=1099632248 TSecr=952061025"
"395","0.000008250","tanvi-HP-Notebook-d18b","twitch.map.fastly.net","TCP","66","49016  >  443 [ACK] Seq=1325 Ack=22700 Win=81024 Len=0 TSval=1099632248 TSecr=952061025"
"396","0.002139315","mobile-gtalk.l.google.com","tanvi-HP-Notebook.local","TCP","94","5228  >  47458 [SYN, ACK] Seq=0 Ack=1 Win=61512 Len=0 MSS=1400 SACK_PERM=1 TSval=3465111242 TSecr=1390282787 WS=256"
"397","0.000142130","tanvi-HP-Notebook.local","mobile-gtalk.l.google.com","TCP","86","47458  >  5228 [ACK] Seq=1 Ack=1 Win=28800 Len=0 TSval=1390282908 TSecr=3465111242"
"407","0.000020169","tanvi-HP-Notebook-d18b","twitch.map.fastly.net","TCP","66","49016  >  443 [ACK] Seq=1325 Ack=24088 Win=83968 Len=0 TSval=1099632256 TSecr=952061026"
"409","0.000011370","tanvi-HP-Notebook-d18b","twitch.map.fastly.net","TCP","66","49016  >  443 [ACK] Seq=1325 Ack=25476 Win=86784 Len=0 TSval=1099632256 TSecr=952061026"
"411","0.000006906","tanvi-HP-Notebook-d18b","twitch.map.fastly.net","TCP","66","49016  >  443 [ACK] Seq=1325 Ack=26864 Win=89728 Len=0 TSval=1099632256 TSecr=952061026"
"413","0.000007703","tanvi-HP-Notebook-d18b","twitch.map.fastly.net","TCP","66","49016  >  443 [ACK] Seq=1325 Ack=28252 Win=92672 Len=0 TSval=1099632256 TSecr=952061026"
"420","0.001899507","safebrowsing.googleapis.com","tanvi-HP-Notebook.local","TCP","86","443  >  42678 [ACK] Seq=1 Ack=518 Win=66816 Len=0 TSval=4095971073 TSecr=3814131791"
"424","0.000096920","tanvi-HP-Notebook-d18b","twitch.map.fastly.net","TCP","66","49016  >  443 [ACK] Seq=1325 Ack=29640 Win=95488 Len=0 TSval=1099632278 TSecr=952061035"
"426","0.000034126","tanvi-HP-Notebook-d18b","twitch.map.fastly.net","TCP","66","49016  >  443 [ACK] Seq=1325 Ack=31028 Win=98432 Len=0 TSval=1099632278 TSecr=952061035"
"435","0.000021720","tanvi-HP-Notebook-d18b","twitch.map.fastly.net","TCP","66","49016  >  443 [ACK] Seq=1325 Ack=32416 Win=101248 Len=0 TSval=1099632284 TSecr=952061036"
"437","0.000008591","tanvi-HP-Notebook-d18b","twitch.map.fastly.net","TCP","66","49016  >  443 [ACK] Seq=1325 Ack=33547 Win=104064 Len=0 TSval=1099632284 TSecr=952061036"
"443","0.000026139","tanvi-HP-Notebook.local","safebrowsing.googleapis.com","TCP","86","42678  >  443 [ACK] Seq=518 Ack=1209 Win=31232 Len=0 TSval=3814131940 TSecr=4095971133"
"445","0.000013803","tanvi-HP-Notebook.local","safebrowsing.googleapis.com","TCP","86","42678  >  443 [ACK] Seq=518 Ack=2417 Win=33664 Len=0 TSval=3814131941 TSecr=4095971133"
"447","0.000006201","tanvi-HP-Notebook.local","safebrowsing.googleapis.com","TCP","86","42678  >  443 [ACK] Seq=518 Ack=3070 Win=36096 Len=0 TSval=3814131941 TSecr=4095971133"
"462","0.002148735","mobile-gtalk.l.google.com","tanvi-HP-Notebook.local","TCP","86","5228  >  47458 [ACK] Seq=1 Ack=518 Win=62720 Len=0 TSval=3465111377 TSecr=1390282909"
"464","0.000017280","tanvi-HP-Notebook.local","mobile-gtalk.l.google.com","TCP","86","47458  >  5228 [ACK] Seq=518 Ack=1209 Win=31232 Len=0 TSval=1390283033 TSecr=3465111377"
"466","0.000024793","tanvi-HP-Notebook.local","mobile-gtalk.l.google.com","TCP","86","47458  >  5228 [ACK] Seq=518 Ack=2417 Win=33664 Len=0 TSval=1390283044 TSecr=3465111377"
"468","0.000012856","tanvi-HP-Notebook.local","mobile-gtalk.l.google.com","TCP","86","47458  >  5228 [ACK] Seq=518 Ack=3625 Win=36096 Len=0 TSval=1390283044 TSecr=3465111377"
"470","0.000020665","tanvi-HP-Notebook.local","mobile-gtalk.l.google.com","TCP","86","47458  >  5228 [ACK] Seq=518 Ack=3773 Win=38528 Len=0 TSval=1390283044 TSecr=3465111377"
"472","0.002026767","h2.twitch.map.fastly.net","tanvi-HP-Notebook-d18b","TCP","74","443  >  55242 [SYN, ACK] Seq=0 Ack=1 Win=28160 Len=0 MSS=1400 SACK_PERM=1 TSval=2059199093 TSecr=3805590871 WS=512"
"473","0.000147895","tanvi-HP-Notebook-d18b","h2.twitch.map.fastly.net","TCP","66","55242  >  443 [ACK] Seq=1 Ack=1 Win=29312 Len=0 TSval=3805591003 TSecr=2059199093"
"474","0.001692507","twitch.map.fastly.net","tanvi-HP-Notebook-d18b","TCP","74","443  >  49468 [SYN, ACK] Seq=0 Ack=1 Win=28160 Len=0 MSS=1400 SACK_PERM=1 TSval=2059199094 TSecr=1448386437 WS=512"
"475","0.000030667","tanvi-HP-Notebook-d18b","twitch.map.fastly.net","TCP","66","49468  >  443 [ACK] Seq=1 Ack=1 Win=29312 Len=0 TSval=1448386568 TSecr=2059199094"
"477","0.000048895","h2.twitch.map.fastly.net","tanvi-HP-Notebook-d18b","TCP","74","443  >  55246 [SYN, ACK] Seq=0 Ack=1 Win=28160 Len=0 MSS=1400 SACK_PERM=1 TSval=979412231 TSecr=3805590894 WS=512"
"478","0.000027440","tanvi-HP-Notebook-d18b","h2.twitch.map.fastly.net","TCP","66","55246  >  443 [ACK] Seq=1 Ack=1 Win=29312 Len=0 TSval=3805591007 TSecr=979412231"
"486","0.001712353","h2.twitch.map.fastly.net","tanvi-HP-Notebook-d18b","TCP","74","443  >  55248 [SYN, ACK] Seq=0 Ack=1 Win=28160 Len=0 MSS=1400 SACK_PERM=1 TSval=2534500208 TSecr=3805590894 WS=512"
"487","0.000060441","tanvi-HP-Notebook-d18b","h2.twitch.map.fastly.net","TCP","66","55248  >  443 [ACK] Seq=1 Ack=1 Win=29312 Len=0 TSval=3805591015 TSecr=2534500208"
"503","0.000900802","safebrowsing.googleapis.com","tanvi-HP-Notebook.local","TCP","86","443  >  42678 [ACK] Seq=3070 Ack=582 Win=66816 Len=0 TSval=4095971222 TSecr=3814131946"
"506","0.000542731","tanvi-HP-Notebook.local","safebrowsing.googleapis.com","HTTP2","117","SETTINGS[0]"
"508","0.003906634","safebrowsing.googleapis.com","tanvi-HP-Notebook.local","TCP","86","443  >  42678 [ACK] Seq=3650 Ack=1481 Win=68352 Len=0 TSval=4095971228 TSecr=3814131947"
"515","0.014050288","tanvi-HP-Notebook.local","safebrowsing.googleapis.com","TCP","86","42678  >  443 [ACK] Seq=1512 Ack=3681 Win=38528 Len=0 TSval=3814132080 TSecr=4095971228"
"517","0.000037658","tanvi-HP-Notebook.local","safebrowsing.googleapis.com","TCP","86","42678  >  443 [ACK] Seq=1512 Ack=3998 Win=40960 Len=0 TSval=3814132096 TSecr=4095971290"
"519","0.000010728","tanvi-HP-Notebook.local","safebrowsing.googleapis.com","TCP","86","42678  >  443 [ACK] Seq=1512 Ack=4239 Win=43392 Len=0 TSval=3814132096 TSecr=4095971290"
"521","0.000007358","tanvi-HP-Notebook.local","safebrowsing.googleapis.com","TCP","86","42678  >  443 [ACK] Seq=1512 Ack=4278 Win=43392 Len=0 TSval=3814132096 TSecr=4095971290"
"523","0.036412460","safebrowsing.googleapis.com","tanvi-HP-Notebook.local","TCP","86","443  >  42678 [ACK] Seq=4278 Ack=1512 Win=68352 Len=0 TSval=4095971317 TSecr=3814132031"
"524","0.000196196","h2.twitch.map.fastly.net","tanvi-HP-Notebook-d18b","TCP","66","443  >  55242 [ACK] Seq=1 Ack=518 Win=29696 Len=0 TSval=2059199124 TSecr=3805591007"
"527","0.002386376","mobile-gtalk.l.google.com","tanvi-HP-Notebook.local","TCP","86","5228  >  47458 [ACK] Seq=3773 Ack=759 Win=63744 Len=0 TSval=3465111517 TSecr=1390283053"
"528","0.001177760","e9221.i.akamaiedge.net","tanvi-HP-Notebook-d18b","TCP","74","443  >  36300 [SYN, ACK] Seq=0 Ack=1 Win=28960 Len=0 MSS=1400 SACK_PERM=1 TSval=16704102 TSecr=1735156777 WS=128"
"529","0.000188163","tanvi-HP-Notebook-d18b","e9221.i.akamaiedge.net","TCP","66","36300  >  443 [ACK] Seq=1 Ack=1 Win=29312 Len=0 TSval=1735156887 TSecr=16704102"
"531","0.000089096","tanvi-HP-Notebook-d18b","h2.twitch.map.fastly.net","TCP","66","55242  >  443 [ACK] Seq=518 Ack=1389 Win=32128 Len=0 TSval=3805591137 TSecr=2059199124"
"533","0.000051388","tanvi-HP-Notebook-d18b","h2.twitch.map.fastly.net","TCP","66","55242  >  443 [ACK] Seq=518 Ack=2777 Win=35072 Len=0 TSval=3805591137 TSecr=2059199124"
"535","0.000083768","tanvi-HP-Notebook-d18b","h2.twitch.map.fastly.net","TCP","66","55242  >  443 [ACK] Seq=518 Ack=4165 Win=37888 Len=0 TSval=3805591137 TSecr=2059199124"
"538","0.000019175","tanvi-HP-Notebook-d18b","h2.twitch.map.fastly.net","TCP","66","55242  >  443 [ACK] Seq=518 Ack=4922 Win=40704 Len=0 TSval=3805591137 TSecr=2059199124"
"540","0.001244394","h2.twitch.map.fastly.net","tanvi-HP-Notebook-d18b","TCP","66","443  >  55246 [ACK] Seq=1 Ack=518 Win=29696 Len=0 TSval=979412264 TSecr=3805591008"
"542","0.000061905","tanvi-HP-Notebook-d18b","h2.twitch.map.fastly.net","TCP","66","55246  >  443 [ACK] Seq=518 Ack=1389 Win=32128 Len=0 TSval=3805591139 TSecr=979412264"
"544","0.000050554","tanvi-HP-Notebook-d18b","h2.twitch.map.fastly.net","TCP","66","55246  >  443 [ACK] Seq=518 Ack=2777 Win=35072 Len=0 TSval=3805591139 TSecr=979412264"
"546","0.000087974","tanvi-HP-Notebook-d18b","h2.twitch.map.fastly.net","TCP","66","55246  >  443 [ACK] Seq=518 Ack=4165 Win=37888 Len=0 TSval=3805591139 TSecr=979412264"
"548","0.000020312","tanvi-HP-Notebook-d18b","h2.twitch.map.fastly.net","TCP","66","55246  >  443 [ACK] Seq=518 Ack=4922 Win=40704 Len=0 TSval=3805591139 TSecr=979412264"
"551","0.000318043","tanvi-HP-Notebook.local","mobile-gtalk.l.google.com","TCP","86","47458  >  5228 [ACK] Seq=759 Ack=4424 Win=40960 Len=0 TSval=1390283183 TSecr=3465111518"
"552","0.003335361","h2.twitch.map.fastly.net","tanvi-HP-Notebook-d18b","TCP","66","443  >  55248 [ACK] Seq=1 Ack=518 Win=29696 Len=0 TSval=2534500241 TSecr=3805591016"
"553","0.000040918","twitch.map.fastly.net","tanvi-HP-Notebook-d18b","TCP","66","443  >  49468 [ACK] Seq=1 Ack=518 Win=29696 Len=0 TSval=2059199129 TSecr=1448386571"
"555","0.000012773","tanvi-HP-Notebook-d18b","twitch.map.fastly.net","TCP","66","49468  >  443 [ACK] Seq=518 Ack=1389 Win=32128 Len=0 TSval=1448386707 TSecr=2059199129"
"557","0.000007990","tanvi-HP-Notebook-d18b","twitch.map.fastly.net","TCP","66","49468  >  443 [ACK] Seq=518 Ack=2777 Win=35072 Len=0 TSval=1448386707 TSecr=2059199129"
"559","0.000006156","tanvi-HP-Notebook-d18b","twitch.map.fastly.net","TCP","66","49468  >  443 [ACK] Seq=518 Ack=4165 Win=37888 Len=0 TSval=1448386707 TSecr=2059199129"
"561","0.000005002","tanvi-HP-Notebook-d18b","twitch.map.fastly.net","TCP","66","49468  >  443 [ACK] Seq=518 Ack=4928 Win=40704 Len=0 TSval=1448386707 TSecr=2059199129"
"569","0.006099775","safebrowsing.googleapis.com","tanvi-HP-Notebook.local","TCP","86","443  >  42678 [ACK] Seq=4278 Ack=1551 Win=68352 Len=0 TSval=4095971392 TSecr=3814132098"
"571","0.000052325","e9221.i.akamaiedge.net","tanvi-HP-Notebook-d18b","TCP","66","443  >  36300 [ACK] Seq=1 Ack=518 Win=30080 Len=0 TSval=16704217 TSecr=1735156890"
"573","0.000014474","tanvi-HP-Notebook-d18b","h2.twitch.map.fastly.net","TCP","66","55248  >  443 [ACK] Seq=518 Ack=1389 Win=32128 Len=0 TSval=3805591246 TSecr=2534500241"
"576","0.000007322","tanvi-HP-Notebook-d18b","h2.twitch.map.fastly.net","TCP","66","55248  >  443 [ACK] Seq=518 Ack=2777 Win=35072 Len=0 TSval=3805591246 TSecr=2534500241"
"578","0.000007364","tanvi-HP-Notebook-d18b","h2.twitch.map.fastly.net","TCP","66","55248  >  443 [ACK] Seq=518 Ack=4165 Win=37888 Len=0 TSval=3805591246 TSecr=2534500241"
"580","0.000007640","tanvi-HP-Notebook-d18b","e9221.i.akamaiedge.net","TCP","66","36300  >  443 [ACK] Seq=518 Ack=1389 Win=32128 Len=0 TSval=1735156996 TSecr=16704218"
"581","-0.000007369","static.twitchcdn.net","tanvi-HP-Notebook-d18b","TCP","74","443  >  58870 [SYN, ACK] Seq=0 Ack=1 Win=28160 Len=0 MSS=1400 SACK_PERM=1 TSval=1277246651 TSecr=904325960 WS=512"
"582","0.000025764","tanvi-HP-Notebook-d18b","static.twitchcdn.net","TCP","66","58870  >  443 [ACK] Seq=1 Ack=1 Win=29312 Len=0 TSval=904326177 TSecr=1277246651"
"584","0.000035811","tanvi-HP-Notebook-d18b","h2.twitch.map.fastly.net","TCP","66","55248  >  443 [ACK] Seq=518 Ack=4922 Win=40704 Len=0 TSval=3805591246 TSecr=2534500241"
"586","0.000023159","tanvi-HP-Notebook-d18b","e9221.i.akamaiedge.net","TCP","66","36300  >  443 [ACK] Seq=518 Ack=2777 Win=35072 Len=0 TSval=1735156998 TSecr=16704218"
"589","0.000007566","tanvi-HP-Notebook-d18b","e9221.i.akamaiedge.net","TCP","66","36300  >  443 [ACK] Seq=518 Ack=4038 Win=37888 Len=0 TSval=1735156998 TSecr=16704218"
"595","0.000744041","science-edge-external-prod-73889260.us-west-2.elb.amazonaws.com","tanvi-HP-Notebook-d18b","TCP","74","443  >  40776 [SYN, ACK] Seq=0 Ack=1 Win=26847 Len=0 MSS=1400 SACK_PERM=1 TSval=1004400120 TSecr=1979132240 WS=256"
"596","0.000037282","tanvi-HP-Notebook-d18b","science-edge-external-prod-73889260.us-west-2.elb.amazonaws.com","TCP","66","40776  >  443 [ACK] Seq=1 Ack=1 Win=29312 Len=0 TSval=1979132557 TSecr=1004400120"
"598","0.006000972","h2.twitch.map.fastly.net","tanvi-HP-Notebook-d18b","TLSv1.2","324","New Session Ticket, Change Cipher Spec, Finished"
"599","0.000085950","h2.twitch.map.fastly.net","tanvi-HP-Notebook-d18b","TLSv1.2","324","New Session Ticket, Change Cipher Spec, Finished"
"600","0.003566592","h2.twitch.map.fastly.net","tanvi-HP-Notebook-d18b","TCP","66","443  >  55246 [ACK] Seq=5180 Ack=1172 Win=30720 Len=0 TSval=979412296 TSecr=3805591151"
"602","0.000064482","tanvi-HP-Notebook-d18b","h2.twitch.map.fastly.net","TCP","66","55246  >  443 [ACK] Seq=1172 Ack=5246 Win=43520 Len=0 TSval=3805591268 TSecr=979412295"
"604","0.006746230","twitch.map.fastly.net","tanvi-HP-Notebook-d18b","TLSv1.2","324","New Session Ticket, Change Cipher Spec, Finished"
"605","0.033799580","tanvi-HP-Notebook-d18b","h2.twitch.map.fastly.net","TCP","66","55242  >  443 [ACK] Seq=611 Ack=5180 Win=43520 Len=0 TSval=3805591308 TSecr=2059199159"
"606","0.012064926","tanvi-HP-Notebook-d18b","twitch.map.fastly.net","TCP","66","49468  >  443 [ACK] Seq=611 Ack=5186 Win=43520 Len=0 TSval=1448386883 TSecr=2059199161"
"610","0.013083441","e9221.i.akamaiedge.net","tanvi-HP-Notebook-d18b","TLSv1.3","337","New Session Ticket"
"612","0.000447261","tanvi-HP-Notebook-d18b","e9221.i.akamaiedge.net","TCP","66","36300  >  443 [ACK] Seq=598 Ack=4580 Win=43392 Len=0 TSval=1735157120 TSecr=16704332"
"614","0.002263821","h2.twitch.map.fastly.net","tanvi-HP-Notebook-d18b","TLSv1.2","324","New Session Ticket, Change Cipher Spec, Finished"
"615","0.004528658","science-edge-external-prod-73889260.us-west-2.elb.amazonaws.com","tanvi-HP-Notebook-d18b","TCP","74","443  >  40782 [SYN, ACK] Seq=0 Ack=1 Win=26847 Len=0 MSS=1400 SACK_PERM=1 TSval=1004400151 TSecr=1979132361 WS=256"
"616","0.000048611","tanvi-HP-Notebook-d18b","science-edge-external-prod-73889260.us-west-2.elb.amazonaws.com","TCP","66","40782  >  443 [ACK] Seq=1 Ack=1 Win=29312 Len=0 TSval=1979132686 TSecr=1004400151"
"618","0.033877920","h2.twitch.map.fastly.net","tanvi-HP-Notebook-d18b","TCP","66","443  >  55246 [ACK] Seq=5246 Ack=1210 Win=30720 Len=0 TSval=979412335 TSecr=3805591268"
"619","0.002759447","tanvi-HP-Notebook-d18b","h2.twitch.map.fastly.net","TCP","66","55248  >  443 [ACK] Seq=611 Ack=5180 Win=43520 Len=0 TSval=3805591424 TSecr=2534500297"
"621","0.001242959","api2.branch.io","tanvi-HP-Notebook.local","TCP","94","443  >  37962 [SYN, ACK] Seq=0 Ack=1 Win=24160 Len=0 MSS=1220 SACK_PERM=1 TSval=3613079120 TSecr=850735923 WS=256"
"622","0.000038275","tanvi-HP-Notebook.local","api2.branch.io","TCP","86","37962  >  443 [ACK] Seq=1 Ack=1 Win=28800 Len=0 TSval=850736012 TSecr=3613079120"
"626","0.016320595","static.twitchcdn.net","tanvi-HP-Notebook-d18b","TCP","66","443  >  58870 [ACK] Seq=1 Ack=518 Win=29696 Len=0 TSval=1277246706 TSecr=904326180"
"628","0.000030303","tanvi-HP-Notebook-d18b","static.twitchcdn.net","TCP","66","58870  >  443 [ACK] Seq=518 Ack=1389 Win=32128 Len=0 TSval=904326383 TSecr=1277246706"
"630","0.000011622","tanvi-HP-Notebook-d18b","static.twitchcdn.net","TCP","66","58870  >  443 [ACK] Seq=518 Ack=2777 Win=35072 Len=0 TSval=904326383 TSecr=1277246706"
"632","0.000042224","tanvi-HP-Notebook-d18b","static.twitchcdn.net","TCP","66","58870  >  443 [ACK] Seq=518 Ack=4165 Win=37888 Len=0 TSval=904326383 TSecr=1277246706"
"634","0.000052548","tanvi-HP-Notebook-d18b","static.twitchcdn.net","TCP","66","58870  >  443 [ACK] Seq=518 Ack=4928 Win=40704 Len=0 TSval=904326383 TSecr=1277246706"
"636","0.004322862","pubsub-edge.chat.twitch.tv","tanvi-HP-Notebook-d18b","TCP","74","443  >  60380 [SYN, ACK] Seq=0 Ack=1 Win=26847 Len=0 MSS=1400 SACK_PERM=1 TSval=391404599 TSecr=1065928695 WS=256"
"637","0.000049069","tanvi-HP-Notebook-d18b","pubsub-edge.chat.twitch.tv","TCP","66","60380  >  443 [ACK] Seq=1 Ack=1 Win=29312 Len=0 TSval=1065929025 TSecr=391404599"
"639","0.009267790","tanvi-HP-Notebook-d18b","h2.twitch.map.fastly.net","TCP","66","55246  >  443 [ACK] Seq=1210 Ack=5676 Win=46336 Len=0 TSval=3805591472 TSecr=979412336"
"641","0.039623893","api2.branch.io","tanvi-HP-Notebook.local","TCP","86","443  >  37962 [ACK] Seq=1 Ack=518 Win=25344 Len=0 TSval=3613079130 TSecr=850736013"
"643","0.000023983","tanvi-HP-Notebook.local","api2.branch.io","TCP","86","37962  >  443 [ACK] Seq=518 Ack=1209 Win=31232 Len=0 TSval=850736118 TSecr=3613079130"
"645","0.000012733","tanvi-HP-Notebook.local","api2.branch.io","TCP","86","37962  >  443 [ACK] Seq=518 Ack=2417 Win=33664 Len=0 TSval=850736118 TSecr=3613079130"
"647","0.000006441","tanvi-HP-Notebook.local","api2.branch.io","TCP","86","37962  >  443 [ACK] Seq=518 Ack=3625 Win=36096 Len=0 TSval=850736118 TSecr=3613079130"
"649","0.000022328","tanvi-HP-Notebook.local","api2.branch.io","TCP","86","37962  >  443 [ACK] Seq=518 Ack=4798 Win=38528 Len=0 TSval=850736120 TSecr=3613079131"
"655","0.012166784","h2.twitch.map.fastly.net","tanvi-HP-Notebook-d18b","TCP","66","443  >  55248 [ACK] Seq=5180 Ack=1357 Win=30720 Len=0 TSval=2534500343 TSecr=3805591433"
"657","0.000077714","tanvi-HP-Notebook-d18b","h2.twitch.map.fastly.net","TCP","66","55248  >  443 [ACK] Seq=1357 Ack=5246 Win=43520 Len=0 TSval=3805591556 TSecr=2534500343"
"659","0.025000466","science-edge-external-prod-73889260.us-west-2.elb.amazonaws.com","tanvi-HP-Notebook-d18b","TCP","66","443  >  40776 [ACK] Seq=1 Ack=518 Win=28160 Len=0 TSval=1004400202 TSecr=1979132557"
"661","0.000212314","tanvi-HP-Notebook-d18b","science-edge-external-prod-73889260.us-west-2.elb.amazonaws.com","TCP","66","40776  >  443 [ACK] Seq=518 Ack=1389 Win=32128 Len=0 TSval=1979132885 TSecr=1004400202"
"663","0.000067035","tanvi-HP-Notebook-d18b","science-edge-external-prod-73889260.us-west-2.elb.amazonaws.com","TCP","66","40776  >  443 [ACK] Seq=518 Ack=2777 Win=35072 Len=0 TSval=1979132885 TSecr=1004400202"
"665","0.000112166","tanvi-HP-Notebook-d18b","science-edge-external-prod-73889260.us-west-2.elb.amazonaws.com","TCP","66","40776  >  443 [ACK] Seq=518 Ack=4165 Win=37888 Len=0 TSval=1979132885 TSecr=1004400202"
"667","0.000156655","tanvi-HP-Notebook-d18b","science-edge-external-prod-73889260.us-west-2.elb.amazonaws.com","TCP","66","40776  >  443 [ACK] Seq=518 Ack=5296 Win=40704 Len=0 TSval=1979132885 TSecr=1004400202"
"678","0.017750403","api2.branch.io","tanvi-HP-Notebook.local","TCP","86","443  >  37962 [ACK] Seq=4798 Ack=1056 Win=26368 Len=0 TSval=3613079142 TSecr=850736125"
"679","0.000068422","api2.branch.io","tanvi-HP-Notebook.local","TCP","86","443  >  37962 [ACK] Seq=4798 Ack=2264 Win=28928 Len=0 TSval=3613079142 TSecr=850736125"
"680","0.000081090","api2.branch.io","tanvi-HP-Notebook.local","TCP","86","443  >  37962 [ACK] Seq=4798 Ack=2462 Win=31232 Len=0 TSval=3613079142 TSecr=850736125"
"683","0.000895230","tanvi-HP-Notebook.local","api2.branch.io","TCP","86","37962  >  443 [ACK] Seq=2462 Ack=5046 Win=40960 Len=0 TSval=850736250 TSecr=3613079142"
"685","0.044692987","static.twitchcdn.net","tanvi-HP-Notebook-d18b","TLSv1.2","324","New Session Ticket, Change Cipher Spec, Finished"
"686","0.000039033","h2.twitch.map.fastly.net","tanvi-HP-Notebook-d18b","TCP","66","443  >  55248 [ACK] Seq=5246 Ack=1395 Win=30720 Len=0 TSval=2534500384 TSecr=3805591557"
"687","0.006585678","science-edge-external-prod-73889260.us-west-2.elb.amazonaws.com","tanvi-HP-Notebook-d18b","TCP","66","443  >  40782 [ACK] Seq=1 Ack=518 Win=28160 Len=0 TSval=1004400234 TSecr=1979132687"
"689","0.000024807","tanvi-HP-Notebook-d18b","science-edge-external-prod-73889260.us-west-2.elb.amazonaws.com","TCP","66","40782  >  443 [ACK] Seq=518 Ack=1389 Win=32128 Len=0 TSval=1979133023 TSecr=1004400235"
"691","0.000018134","tanvi-HP-Notebook-d18b","science-edge-external-prod-73889260.us-west-2.elb.amazonaws.com","TCP","66","40782  >  443 [ACK] Seq=518 Ack=2777 Win=35072 Len=0 TSval=1979133023 TSecr=1004400235"
"693","0.000007588","tanvi-HP-Notebook-d18b","science-edge-external-prod-73889260.us-west-2.elb.amazonaws.com","TCP","66","40782  >  443 [ACK] Seq=518 Ack=4165 Win=37888 Len=0 TSval=1979133023 TSecr=1004400235"
"695","0.000027250","tanvi-HP-Notebook-d18b","science-edge-external-prod-73889260.us-west-2.elb.amazonaws.com","TCP","66","40782  >  443 [ACK] Seq=518 Ack=5296 Win=40704 Len=0 TSval=1979133023 TSecr=1004400235"
"698","0.005992090","twitch.map.fastly.net","tanvi-HP-Notebook-d18b","TCP","74","443  >  49488 [SYN, ACK] Seq=0 Ack=1 Win=28160 Len=0 MSS=1400 SACK_PERM=1 TSval=2078340516 TSecr=1448387173 WS=512"
"699","0.000043867","tanvi-HP-Notebook-d18b","twitch.map.fastly.net","TCP","66","49488  >  443 [ACK] Seq=1 Ack=1 Win=29312 Len=0 TSval=1448387298 TSecr=2078340516"
"701","0.015856747","tanvi-HP-Notebook-d18b","static.twitchcdn.net","TCP","66","58870  >  443 [ACK] Seq=611 Ack=5186 Win=43520 Len=0 TSval=904326687 TSecr=1277246772"
"703","0.043476794","api2.branch.io","tanvi-HP-Notebook.local","TCP","86","443  >  37962 [ACK] Seq=5046 Ack=2500 Win=31232 Len=0 TSval=3613079158 TSecr=850736251"
"704","0.001087118","tanvi-HP-Notebook-d18b","h2.twitch.map.fastly.net","TCP","66","55248  >  443 [ACK] Seq=1395 Ack=6426 Win=46336 Len=0 TSval=3805591808 TSecr=2534500396"
"705","0.033085601","irc-ws-edge.chat.twitch.tv","tanvi-HP-Notebook-d18b","TCP","74","443  >  60402 [SYN, ACK] Seq=0 Ack=1 Win=26847 Len=0 MSS=1400 SACK_PERM=1 TSval=913154336 TSecr=1547285592 WS=256"
"706","0.000037846","tanvi-HP-Notebook-d18b","irc-ws-edge.chat.twitch.tv","TCP","66","60402  >  443 [ACK] Seq=1 Ack=1 Win=29312 Len=0 TSval=1547285935 TSecr=913154336"
"708","0.012284981","pubsub-edge.chat.twitch.tv","tanvi-HP-Notebook-d18b","TCP","66","443  >  60380 [ACK] Seq=1 Ack=518 Win=28160 Len=0 TSval=391404990 TSecr=1065929025"
"710","0.000051420","tanvi-HP-Notebook-d18b","pubsub-edge.chat.twitch.tv","TCP","66","60380  >  443 [ACK] Seq=518 Ack=1389 Win=32128 Len=0 TSval=1065929416 TSecr=391404990"
"712","0.000074846","tanvi-HP-Notebook-d18b","pubsub-edge.chat.twitch.tv","TCP","66","60380  >  443 [ACK] Seq=518 Ack=2777 Win=35072 Len=0 TSval=1065929416 TSecr=391404990"
"714","0.000006413","tanvi-HP-Notebook-d18b","pubsub-edge.chat.twitch.tv","TCP","66","60380  >  443 [ACK] Seq=518 Ack=4097 Win=37888 Len=0 TSval=1065929416 TSecr=391404990"
"716","0.000008006","tanvi-HP-Notebook-d18b","pubsub-edge.chat.twitch.tv","TCP","66","60380  >  443 [ACK] Seq=518 Ack=5265 Win=40576 Len=0 TSval=1065929416 TSecr=391404991"
"717","0.009554758","twitch.map.fastly.net","tanvi-HP-Notebook-d18b","TCP","66","443  >  49488 [ACK] Seq=1 Ack=518 Win=29696 Len=0 TSval=2078340549 TSecr=1448387303"
"719","0.000018730","tanvi-HP-Notebook-d18b","twitch.map.fastly.net","TCP","66","49488  >  443 [ACK] Seq=518 Ack=1389 Win=32128 Len=0 TSval=1448387427 TSecr=2078340549"
"721","0.000010202","tanvi-HP-Notebook-d18b","twitch.map.fastly.net","TCP","66","49488  >  443 [ACK] Seq=518 Ack=2777 Win=35072 Len=0 TSval=1448387427 TSecr=2078340549"
"723","0.000007153","tanvi-HP-Notebook-d18b","twitch.map.fastly.net","TCP","66","49488  >  443 [ACK] Seq=518 Ack=4165 Win=37888 Len=0 TSval=1448387427 TSecr=2078340549"
"725","0.000018356","tanvi-HP-Notebook-d18b","twitch.map.fastly.net","TCP","66","49488  >  443 [ACK] Seq=518 Ack=4928 Win=40704 Len=0 TSval=1448387429 TSecr=2078340549"
"729","0.038630481","science-edge-external-prod-73889260.us-west-2.elb.amazonaws.com","tanvi-HP-Notebook-d18b","TLSv1.2","356","New Session Ticket, Change Cipher Spec, Finished"
"731","0.000054989","tanvi-HP-Notebook-d18b","science-edge-external-prod-73889260.us-west-2.elb.amazonaws.com","TCP","66","40776  >  443 [ACK] Seq=2151 Ack=5655 Win=43520 Len=0 TSval=1979133212 TSecr=1004400284"
"735","0.000109646","tanvi-HP-Notebook.local","api2.branch.io","TCP","86","37962  >  443 [ACK] Seq=2500 Ack=5467 Win=43392 Len=0 TSval=850736496 TSecr=3613079168"
"736","0.011849302","science-edge-external-prod-73889260.us-west-2.elb.amazonaws.com","tanvi-HP-Notebook-d18b","TCP","66","443  >  40776 [ACK] Seq=5655 Ack=1726 Win=29952 Len=0 TSval=1004400288 TSecr=1979132893"
"737","0.000064284","science-edge-external-prod-73889260.us-west-2.elb.amazonaws.com","tanvi-HP-Notebook-d18b","HTTP2","104","SETTINGS[0]"
"739","0.000019840","tanvi-HP-Notebook-d18b","science-edge-external-prod-73889260.us-west-2.elb.amazonaws.com","TCP","66","40776  >  443 [ACK] Seq=2189 Ack=5830 Win=46336 Len=0 TSval=1979133226 TSecr=1004400288"
"740","0.073640290","twitch.map.fastly.net","tanvi-HP-Notebook-d18b","TCP","66","443  >  49488 [ACK] Seq=4928 Ack=1143 Win=30720 Len=0 TSval=2078340582 TSecr=1448387437"
"743","0.000026294","tanvi-HP-Notebook-d18b","twitch.map.fastly.net","TCP","66","49488  >  443 [ACK] Seq=1143 Ack=5762 Win=46336 Len=0 TSval=1448387563 TSecr=2078340582"
"746","0.063875001","science-edge-external-prod-73889260.us-west-2.elb.amazonaws.com","tanvi-HP-Notebook-d18b","TLSv1.2","356","New Session Ticket, Change Cipher Spec, Finished"
"748","0.000787037","tanvi-HP-Notebook-d18b","science-edge-external-prod-73889260.us-west-2.elb.amazonaws.com","TCP","66","40782  >  443 [ACK] Seq=644 Ack=5655 Win=43520 Len=0 TSval=1979133369 TSecr=1004400321"
"749","0.059105118","twitch.map.fastly.net","tanvi-HP-Notebook-d18b","TCP","66","443  >  49488 [ACK] Seq=5762 Ack=2788 Win=33792 Len=0 TSval=2078340615 TSecr=1448387567"
"750","0.041607982","irc-ws-edge.chat.twitch.tv","tanvi-HP-Notebook-d18b","TCP","66","443  >  60402 [ACK] Seq=1 Ack=518 Win=28160 Len=0 TSval=913154665 TSecr=1547285935"
"752","0.000091459","tanvi-HP-Notebook-d18b","irc-ws-edge.chat.twitch.tv","TCP","66","60402  >  443 [ACK] Seq=518 Ack=1389 Win=32128 Len=0 TSval=1547286264 TSecr=913154665"
"754","0.000009137","tanvi-HP-Notebook-d18b","irc-ws-edge.chat.twitch.tv","TCP","66","60402  >  443 [ACK] Seq=518 Ack=2777 Win=35072 Len=0 TSval=1547286265 TSecr=913154665"
"756","0.000020243","tanvi-HP-Notebook-d18b","irc-ws-edge.chat.twitch.tv","TCP","66","60402  >  443 [ACK] Seq=518 Ack=4097 Win=37888 Len=0 TSval=1547286265 TSecr=913154665"
"758","0.000087873","tanvi-HP-Notebook-d18b","irc-ws-edge.chat.twitch.tv","TCP","66","60402  >  443 [ACK] Seq=518 Ack=5275 Win=40576 Len=0 TSval=1547286266 TSecr=913154667"
"760","0.028950055","pubsub-edge.chat.twitch.tv","tanvi-HP-Notebook-d18b","TLSv1.2","117","Change Cipher Spec, Finished"
"761","0.000458150","tanvi-HP-Notebook-d18b","pubsub-edge.chat.twitch.tv","HTTP","848","GET /v1 HTTP/1.1 "
"762","0.067950231","science-edge-external-prod-73889260.us-west-2.elb.amazonaws.com","tanvi-HP-Notebook-d18b","TCP","66","443  >  40776 [ACK] Seq=5830 Ack=2189 Win=32000 Len=0 TSval=1004400375 TSecr=1979133212"
"769","0.000032109","tanvi-HP-Notebook-d18b","twitch.map.fastly.net","TCP","66","49488  >  443 [ACK] Seq=2788 Ack=8168 Win=51968 Len=0 TSval=1448387970 TSecr=2078340685"
"787","0.005769268","twitch.map.fastly.net","tanvi-HP-Notebook-d18b","TCP","74","443  >  49490 [SYN, ACK] Seq=0 Ack=1 Win=28160 Len=0 MSS=1400 SACK_PERM=1 TSval=2534500574 TSecr=1448387928 WS=512"
"788","0.000048565","tanvi-HP-Notebook-d18b","twitch.map.fastly.net","TCP","66","49490  >  443 [ACK] Seq=1 Ack=1 Win=29312 Len=0 TSval=1448388042 TSecr=2534500574"
"792","0.019715056","irc-ws-edge.chat.twitch.tv","tanvi-HP-Notebook-d18b","TLSv1.2","117","Change Cipher Spec, Finished"
"793","0.000433790","tanvi-HP-Notebook-d18b","irc-ws-edge.chat.twitch.tv","HTTP","846","GET / HTTP/1.1 "
"796","0.029827819","twitch.map.fastly.net","tanvi-HP-Notebook-d18b","TCP","66","443  >  49488 [ACK] Seq=8168 Ack=4728 Win=38912 Len=0 TSval=2078340719 TSecr=1448387972"
"797","0.004365841","twitch.map.fastly.net","tanvi-HP-Notebook-d18b","TCP","66","443  >  49488 [ACK] Seq=8168 Ack=7504 Win=44544 Len=0 TSval=2078340720 TSecr=1448387972"
"798","0.000067618","twitch.map.fastly.net","tanvi-HP-Notebook-d18b","TCP","66","443  >  49488 [ACK] Seq=8168 Ack=9558 Win=49664 Len=0 TSval=2078340720 TSecr=1448387972"
