"No.","Time","Source","Destination","Protocol","Length","Info"
"15","0.016019069","www.gstatic.com","tanvi-HP-Notebook.local","TCP","94","443  >  44752 [SYN, ACK] Seq=0 Ack=1 Win=65535 Len=0 MSS=1360 SACK_PERM=1 TSval=4073010388 TSecr=173347342 WS=256"
"16","0.000053023","tanvi-HP-Notebook.local","www.gstatic.com","TCP","86","44752  >  443 [ACK] Seq=1 Ack=1 Win=28800 Len=0 TSval=173347431 TSecr=4073010388"
"18","0.002642334","www.gstatic.com","tanvi-HP-Notebook.local","TCP","94","443  >  44754 [SYN, ACK] Seq=0 Ack=1 Win=65535 Len=0 MSS=1360 SACK_PERM=1 TSval=3165463686 TSecr=173347342 WS=256"
"19","0.000046114","tanvi-HP-Notebook.local","www.gstatic.com","TCP","86","44754  >  443 [ACK] Seq=1 Ack=1 Win=28800 Len=0 TSval=173347434 TSecr=3165463686"
"21","0.024640850","update.googleapis.com","tanvi-HP-Notebook.local","TCP","94","443  >  49888 [SYN, ACK] Seq=0 Ack=1 Win=65535 Len=0 MSS=1360 SACK_PERM=1 TSval=3607321011 TSecr=4058281835 WS=256"
"22","0.000045682","tanvi-HP-Notebook.local","update.googleapis.com","TCP","86","49888  >  443 [ACK] Seq=1 Ack=1 Win=28800 Len=0 TSval=4058281934 TSecr=3607321011"
"31","0.031163937","www.gstatic.com","tanvi-HP-Notebook.local","TCP","86","443  >  44752 [ACK] Seq=1 Ack=518 Win=66816 Len=0 TSval=4073010488 TSecr=173347432"
"32","0.000946214","www.gstatic.com","tanvi-HP-Notebook.local","TCP","86","443  >  44754 [ACK] Seq=1 Ack=518 Win=66816 Len=0 TSval=3165463781 TSecr=173347435"
"33","0.056114392","update.googleapis.com","tanvi-HP-Notebook.local","TCP","86","443  >  49888 [ACK] Seq=1 Ack=518 Win=66816 Len=0 TSval=3607321121 TSecr=4058281935"
"35","0.000024101","tanvi-HP-Notebook.local","www.gstatic.com","TCP","86","44754  >  443 [ACK] Seq=518 Ack=1209 Win=31232 Len=0 TSval=173347594 TSecr=3165463841"
"37","0.000006576","tanvi-HP-Notebook.local","www.gstatic.com","TCP","86","44754  >  443 [ACK] Seq=518 Ack=2417 Win=33664 Len=0 TSval=173347594 TSecr=3165463841"
"39","0.000008219","tanvi-HP-Notebook.local","www.gstatic.com","TCP","86","44754  >  443 [ACK] Seq=518 Ack=3625 Win=36096 Len=0 TSval=173347594 TSecr=3165463841"
"41","0.000005041","tanvi-HP-Notebook.local","www.gstatic.com","TCP","86","44752  >  443 [ACK] Seq=518 Ack=1209 Win=31232 Len=0 TSval=173347594 TSecr=4073010548"
"43","0.000004894","tanvi-HP-Notebook.local","www.gstatic.com","TCP","86","44752  >  443 [ACK] Seq=518 Ack=2417 Win=33664 Len=0 TSval=173347594 TSecr=4073010548"
"45","0.000009607","tanvi-HP-Notebook.local","www.gstatic.com","TCP","86","44752  >  443 [ACK] Seq=518 Ack=3625 Win=36096 Len=0 TSval=173347594 TSecr=4073010548"
"47","0.000014281","tanvi-HP-Notebook.local","www.gstatic.com","TCP","86","44754  >  443 [ACK] Seq=518 Ack=3781 Win=38528 Len=0 TSval=173347594 TSecr=3165463841"
"49","0.000004556","tanvi-HP-Notebook.local","www.gstatic.com","TCP","86","44752  >  443 [ACK] Seq=518 Ack=3782 Win=38528 Len=0 TSval=173347594 TSecr=4073010548"
"56","0.007677189","accounts.google.com","tanvi-HP-Notebook.local","TCP","94","443  >  40472 [SYN, ACK] Seq=0 Ack=1 Win=65535 Len=0 MSS=1360 SACK_PERM=1 TSval=2839341653 TSecr=3134758014 WS=256"
"57","0.000028308","tanvi-HP-Notebook.local","accounts.google.com","TCP","86","40472  >  443 [ACK] Seq=1 Ack=1 Win=28800 Len=0 TSval=3134758133 TSecr=2839341653"
"62","0.000022486","tanvi-HP-Notebook.local","update.googleapis.com","TCP","86","49888  >  443 [ACK] Seq=518 Ack=1209 Win=31232 Len=0 TSval=4058282138 TSecr=3607321198"
"64","0.000013678","tanvi-HP-Notebook.local","update.googleapis.com","TCP","86","49888  >  443 [ACK] Seq=518 Ack=2417 Win=33664 Len=0 TSval=4058282139 TSecr=3607321198"
"66","0.000008303","tanvi-HP-Notebook.local","update.googleapis.com","TCP","86","49888  >  443 [ACK] Seq=518 Ack=3069 Win=36096 Len=0 TSval=4058282139 TSecr=3607321198"
"83","0.020280082","www.gstatic.com","tanvi-HP-Notebook.local","TCP","86","443  >  44754 [ACK] Seq=3781 Ack=582 Win=66816 Len=0 TSval=3165463960 TSecr=173347603"
"84","0.000074134","www.gstatic.com","tanvi-HP-Notebook.local","TCP","86","443  >  44754 [ACK] Seq=3781 Ack=668 Win=66816 Len=0 TSval=3165463960 TSecr=173347604"
"85","0.000084948","www.gstatic.com","tanvi-HP-Notebook.local","TCP","86","443  >  44754 [ACK] Seq=3781 Ack=877 Win=67840 Len=0 TSval=3165463961 TSecr=173347605"
"86","0.000051279","www.gstatic.com","tanvi-HP-Notebook.local","TCP","86","443  >  44752 [ACK] Seq=3782 Ack=582 Win=66816 Len=0 TSval=4073010668 TSecr=173347604"
"87","0.000051933","www.gstatic.com","tanvi-HP-Notebook.local","TCP","86","443  >  44754 [ACK] Seq=3781 Ack=950 Win=67840 Len=0 TSval=3165463961 TSecr=173347605"
"88","0.000064933","www.gstatic.com","tanvi-HP-Notebook.local","HTTP2","666","SETTINGS[0], WINDOW_UPDATE[0]"
"95","0.000072224","tanvi-HP-Notebook.local","www.gstatic.com","TCP","86","44754  >  443 [ACK] Seq=950 Ack=4848 Win=43392 Len=0 TSval=173347713 TSecr=3165463961"
"99","0.000787089","tanvi-HP-Notebook.local","www.gstatic.com","TCP","86","44754  >  443 [ACK] Seq=950 Ack=5136 Win=45824 Len=0 TSval=173347714 TSecr=3165463961"
"102","0.008949648","accounts.google.com","tanvi-HP-Notebook.local","TCP","86","443  >  40472 [ACK] Seq=1 Ack=518 Win=66816 Len=0 TSval=2839341773 TSecr=3134758134"
"103","0.075865798","update.googleapis.com","tanvi-HP-Notebook.local","TCP","86","443  >  49888 [ACK] Seq=3069 Ack=582 Win=66816 Len=0 TSval=3607321340 TSecr=4058282148"
"105","0.000229793","tanvi-HP-Notebook.local","update.googleapis.com","HTTP2","117","SETTINGS[0]"
"107","0.000041702","tanvi-HP-Notebook.local","accounts.google.com","TCP","86","40472  >  443 [ACK] Seq=518 Ack=1209 Win=31232 Len=0 TSval=3134758323 TSecr=2839341843"
"109","0.000026538","tanvi-HP-Notebook.local","accounts.google.com","TCP","86","40472  >  443 [ACK] Seq=518 Ack=2417 Win=33664 Len=0 TSval=3134758323 TSecr=2839341843"
"111","0.000054318","www.gstatic.com","tanvi-HP-Notebook.local","TCP","86","443  >  44754 [ACK] Seq=5136 Ack=1020 Win=67840 Len=0 TSval=3165464060 TSecr=173347715"
"112","0.000003140","tanvi-HP-Notebook.local","accounts.google.com","TCP","86","40472  >  443 [ACK] Seq=518 Ack=3049 Win=36096 Len=0 TSval=3134758323 TSecr=2839341843"
"113","0.001198145","update.googleapis.com","tanvi-HP-Notebook.local","TCP","86","443  >  49888 [ACK] Seq=3649 Ack=957 Win=67840 Len=0 TSval=3607321356 TSecr=4058282149"
"118","0.024953446","tanvi-HP-Notebook.local","update.googleapis.com","TCP","86","49888  >  443 [ACK] Seq=988 Ack=3680 Win=38528 Len=0 TSval=4058282326 TSecr=3607321357"
"127","0.025725831","update.googleapis.com","tanvi-HP-Notebook.local","TCP","86","443  >  49888 [ACK] Seq=3680 Ack=988 Win=67840 Len=0 TSval=3607321450 TSecr=4058282275"
"128","0.009855619","accounts.google.com","tanvi-HP-Notebook.local","TCP","86","443  >  40472 [ACK] Seq=3049 Ack=582 Win=66816 Len=0 TSval=2839341963 TSecr=3134758329"
"134","0.001704755","tanvi-HP-Notebook.local","accounts.google.com","TCP","86","40472  >  443 [ACK] Seq=582 Ack=3629 Win=38528 Len=0 TSval=3134758476 TSecr=2839341963"
"158","0.000024628","tanvi-HP-Notebook.local","update.googleapis.com","TCP","86","49888  >  443 [ACK] Seq=988 Ack=3949 Win=40960 Len=0 TSval=4058282503 TSecr=3607321580"
"164","0.000015218","tanvi-HP-Notebook.local","update.googleapis.com","TCP","86","49888  >  443 [ACK] Seq=988 Ack=3980 Win=40960 Len=0 TSval=4058282516 TSecr=3607321582"
"167","0.000018025","tanvi-HP-Notebook.local","update.googleapis.com","TCP","86","49888  >  443 [ACK] Seq=988 Ack=4019 Win=40960 Len=0 TSval=4058282516 TSecr=3607321582"
"203","0.025797326","update.googleapis.com","tanvi-HP-Notebook.local","TCP","86","443  >  49888 [ACK] Seq=4019 Ack=1027 Win=67840 Len=0 TSval=3607321701 TSecr=4058282517"
"269","0.060008368","oauthaccountmanager.googleapis.com","tanvi-HP-Notebook.local","TCP","94","443  >  41720 [SYN, ACK] Seq=0 Ack=1 Win=65535 Len=0 MSS=1360 SACK_PERM=1 TSval=3981557599 TSecr=798092986 WS=256"
"270","0.000063237","tanvi-HP-Notebook.local","oauthaccountmanager.googleapis.com","TCP","86","41720  >  443 [ACK] Seq=1 Ack=1 Win=28800 Len=0 TSval=798093062 TSecr=3981557599"
"273","0.008720476","oauthaccountmanager.googleapis.com","tanvi-HP-Notebook.local","TCP","86","443  >  41720 [ACK] Seq=1 Ack=518 Win=66816 Len=0 TSval=3981557689 TSecr=798093062"
"282","0.000040372","tanvi-HP-Notebook.local","oauthaccountmanager.googleapis.com","TCP","86","41720  >  443 [ACK] Seq=518 Ack=1209 Win=31232 Len=0 TSval=798093215 TSecr=3981557756"
"284","0.000024837","tanvi-HP-Notebook.local","oauthaccountmanager.googleapis.com","TCP","86","41720  >  443 [ACK] Seq=518 Ack=2417 Win=33664 Len=0 TSval=798093215 TSecr=3981557756"
"286","0.000047955","tanvi-HP-Notebook.local","oauthaccountmanager.googleapis.com","TCP","86","41720  >  443 [ACK] Seq=518 Ack=3068 Win=36096 Len=0 TSval=798093215 TSecr=3981557756"
"288","0.083022074","oauthaccountmanager.googleapis.com","tanvi-HP-Notebook.local","TCP","86","443  >  41720 [ACK] Seq=3068 Ack=582 Win=66816 Len=0 TSval=3981557843 TSecr=798093219"
"292","0.017195046","tanvi-HP-Notebook.local","oauthaccountmanager.googleapis.com","TCP","86","41720  >  443 [ACK] Seq=582 Ack=3648 Win=38528 Len=0 TSval=798093343 TSecr=3981557844"
"333","0.192150243","twitch.map.fastly.net","tanvi-HP-Notebook-d18b","TCP","74","443  >  56720 [SYN, ACK] Seq=0 Ack=1 Win=28160 Len=0 MSS=1400 SACK_PERM=1 TSval=872402071 TSecr=1790665145 WS=512"
"334","0.000057492","tanvi-HP-Notebook-d18b","twitch.map.fastly.net","TCP","66","56720  >  443 [ACK] Seq=1 Ack=1 Win=29312 Len=0 TSval=1790665340 TSecr=872402071"
"336","0.008341489","twitch.map.fastly.net","tanvi-HP-Notebook-d18b","TCP","74","443  >  56722 [SYN, ACK] Seq=0 Ack=1 Win=28160 Len=0 MSS=1400 SACK_PERM=1 TSval=960296504 TSecr=1790665145 WS=512"
"337","0.000056015","tanvi-HP-Notebook-d18b","twitch.map.fastly.net","TCP","66","56722  >  443 [ACK] Seq=1 Ack=1 Win=29312 Len=0 TSval=1790665349 TSecr=960296504"
"339","0.028198495","twitch.map.fastly.net","tanvi-HP-Notebook-d18b","TCP","74","443  >  56724 [SYN, ACK] Seq=0 Ack=1 Win=28160 Len=0 MSS=1400 SACK_PERM=1 TSval=1932635116 TSecr=1790665148 WS=512"
"340","0.000047582","tanvi-HP-Notebook-d18b","twitch.map.fastly.net","TCP","66","56724  >  443 [ACK] Seq=1 Ack=1 Win=29312 Len=0 TSval=1790665378 TSecr=1932635116"
"342","0.169901689","twitch.map.fastly.net","tanvi-HP-Notebook-d18b","TCP","66","443  >  56720 [ACK] Seq=1 Ack=518 Win=29696 Len=0 TSval=872402122 TSecr=1790665341"
"344","0.000064757","tanvi-HP-Notebook-d18b","twitch.map.fastly.net","TCP","66","56720  >  443 [ACK] Seq=518 Ack=1389 Win=32128 Len=0 TSval=1790665548 TSecr=872402123"
"346","0.000162095","tanvi-HP-Notebook-d18b","twitch.map.fastly.net","TCP","66","56720  >  443 [ACK] Seq=518 Ack=2777 Win=35072 Len=0 TSval=1790665548 TSecr=872402123"
"348","0.000017678","tanvi-HP-Notebook-d18b","twitch.map.fastly.net","TCP","66","56720  >  443 [ACK] Seq=518 Ack=4165 Win=37888 Len=0 TSval=1790665549 TSecr=872402123"
"350","0.000012623","tanvi-HP-Notebook-d18b","twitch.map.fastly.net","TCP","66","56720  >  443 [ACK] Seq=518 Ack=4928 Win=40704 Len=0 TSval=1790665549 TSecr=872402123"
"353","0.014024732","twitch.map.fastly.net","tanvi-HP-Notebook-d18b","TCP","66","443  >  56722 [ACK] Seq=1 Ack=518 Win=29696 Len=0 TSval=960296559 TSecr=1790665350"
"355","0.000010817","tanvi-HP-Notebook-d18b","twitch.map.fastly.net","TCP","66","56722  >  443 [ACK] Seq=518 Ack=1389 Win=32128 Len=0 TSval=1790665569 TSecr=960296559"
"357","0.000006512","tanvi-HP-Notebook-d18b","twitch.map.fastly.net","TCP","66","56722  >  443 [ACK] Seq=518 Ack=2777 Win=35072 Len=0 TSval=1790665569 TSecr=960296559"
"359","0.000006267","tanvi-HP-Notebook-d18b","twitch.map.fastly.net","TCP","66","56722  >  443 [ACK] Seq=518 Ack=4165 Win=37888 Len=0 TSval=1790665570 TSecr=960296559"
"361","0.000006680","tanvi-HP-Notebook-d18b","twitch.map.fastly.net","TCP","66","56722  >  443 [ACK] Seq=518 Ack=4928 Win=40704 Len=0 TSval=1790665570 TSecr=960296559"
"363","0.027928750","twitch.map.fastly.net","tanvi-HP-Notebook-d18b","TCP","66","443  >  56724 [ACK] Seq=1 Ack=518 Win=29696 Len=0 TSval=1932635171 TSecr=1790665378"
"365","0.000016214","tanvi-HP-Notebook-d18b","twitch.map.fastly.net","TCP","66","56724  >  443 [ACK] Seq=518 Ack=1389 Win=32128 Len=0 TSval=1790665600 TSecr=1932635172"
"367","0.000014754","tanvi-HP-Notebook-d18b","twitch.map.fastly.net","TCP","66","56724  >  443 [ACK] Seq=518 Ack=2777 Win=35072 Len=0 TSval=1790665600 TSecr=1932635172"
"369","0.000030620","tanvi-HP-Notebook-d18b","twitch.map.fastly.net","TCP","66","56724  >  443 [ACK] Seq=518 Ack=4165 Win=37888 Len=0 TSval=1790665605 TSecr=1932635172"
"371","0.000006481","tanvi-HP-Notebook-d18b","twitch.map.fastly.net","TCP","66","56724  >  443 [ACK] Seq=518 Ack=4928 Win=40704 Len=0 TSval=1790665605 TSecr=1932635172"
"373","0.153294298","twitch.map.fastly.net","tanvi-HP-Notebook-d18b","TCP","66","443  >  56720 [ACK] Seq=4928 Ack=1345 Win=30720 Len=0 TSval=872402176 TSecr=1790665555"
"375","0.024472795","twitch.map.fastly.net","tanvi-HP-Notebook-d18b","TLSv1.2","324","New Session Ticket, Change Cipher Spec, Finished"
"377","0.000028513","tanvi-HP-Notebook-d18b","twitch.map.fastly.net","TCP","66","56720  >  443 [ACK] Seq=1345 Ack=6574 Win=46336 Len=0 TSval=1790665787 TSecr=872402176"
"380","0.000017563","tanvi-HP-Notebook-d18b","twitch.map.fastly.net","TCP","66","56720  >  443 [ACK] Seq=1345 Ack=7974 Win=49280 Len=0 TSval=1790665787 TSecr=872402183"
"383","0.000021048","tanvi-HP-Notebook-d18b","twitch.map.fastly.net","TCP","66","56720  >  443 [ACK] Seq=1345 Ack=10750 Win=55040 Len=0 TSval=1790665790 TSecr=872402183"
"386","0.000012930","tanvi-HP-Notebook-d18b","twitch.map.fastly.net","TCP","66","56720  >  443 [ACK] Seq=1345 Ack=13526 Win=60928 Len=0 TSval=1790665790 TSecr=872402183"
"389","0.000010895","tanvi-HP-Notebook-d18b","twitch.map.fastly.net","TCP","66","56720  >  443 [ACK] Seq=1345 Ack=16302 Win=66688 Len=0 TSval=1790665790 TSecr=872402183"
"392","0.002135534","tanvi-HP-Notebook-d18b","twitch.map.fastly.net","TCP","66","56722  >  443 [ACK] Seq=611 Ack=5186 Win=43520 Len=0 TSval=1790665825 TSecr=960296613"
"402","0.005058020","twitch.map.fastly.net","tanvi-HP-Notebook-d18b","TLSv1.2","324","New Session Ticket, Change Cipher Spec, Finished"
"403","0.043738127","tanvi-HP-Notebook-d18b","twitch.map.fastly.net","TCP","66","56724  >  443 [ACK] Seq=611 Ack=5186 Win=43520 Len=0 TSval=1790665877 TSecr=1932635228"
"426","0.010739248","safebrowsing.googleapis.com","tanvi-HP-Notebook.local","TCP","94","443  >  57464 [SYN, ACK] Seq=0 Ack=1 Win=65535 Len=0 MSS=1360 SACK_PERM=1 TSval=811467153 TSecr=282289703 WS=256"
"427","0.000033622","tanvi-HP-Notebook.local","safebrowsing.googleapis.com","TCP","86","57464  >  443 [ACK] Seq=1 Ack=1 Win=28800 Len=0 TSval=282289814 TSecr=811467153"
"431","0.000025515","tanvi-HP-Notebook-d18b","twitch.map.fastly.net","TCP","66","56720  >  443 [ACK] Seq=1345 Ack=19078 Win=72448 Len=0 TSval=1790665984 TSecr=872402232"
"434","0.000009776","tanvi-HP-Notebook-d18b","twitch.map.fastly.net","TCP","66","56720  >  443 [ACK] Seq=1345 Ack=21854 Win=78208 Len=0 TSval=1790665984 TSecr=872402232"
"437","0.000008142","tanvi-HP-Notebook-d18b","twitch.map.fastly.net","TCP","66","56720  >  443 [ACK] Seq=1345 Ack=24630 Win=84096 Len=0 TSval=1790665984 TSecr=872402232"
"440","0.000013116","tanvi-HP-Notebook-d18b","twitch.map.fastly.net","TCP","66","56720  >  443 [ACK] Seq=1345 Ack=27406 Win=89856 Len=0 TSval=1790665984 TSecr=872402232"
"443","0.000010384","tanvi-HP-Notebook-d18b","twitch.map.fastly.net","TCP","66","56720  >  443 [ACK] Seq=1345 Ack=30182 Win=95616 Len=0 TSval=1790665990 TSecr=872402234"
"446","0.000007229","tanvi-HP-Notebook-d18b","twitch.map.fastly.net","TCP","66","56720  >  443 [ACK] Seq=1345 Ack=32958 Win=101376 Len=0 TSval=1790665990 TSecr=872402234"
"470","0.002806136","safebrowsing.googleapis.com","tanvi-HP-Notebook.local","TCP","86","443  >  57464 [ACK] Seq=1 Ack=518 Win=66816 Len=0 TSval=811467257 TSecr=282289815"
"471","0.002562974","tanvi-HP-Notebook-d18b","twitch.map.fastly.net","TCP","66","56720  >  443 [ACK] Seq=1345 Ack=33468 Win=104192 Len=0 TSval=1790666045 TSecr=872402234"
"477","0.000022148","tanvi-HP-Notebook.local","safebrowsing.googleapis.com","TCP","86","57464  >  443 [ACK] Seq=518 Ack=1209 Win=31232 Len=0 TSval=282289982 TSecr=811467322"
"479","0.000009339","tanvi-HP-Notebook.local","safebrowsing.googleapis.com","TCP","86","57464  >  443 [ACK] Seq=518 Ack=2417 Win=33664 Len=0 TSval=282289982 TSecr=811467322"
"481","0.000007503","tanvi-HP-Notebook.local","safebrowsing.googleapis.com","TCP","86","57464  >  443 [ACK] Seq=518 Ack=3069 Win=36096 Len=0 TSval=282289982 TSecr=811467322"
"486","0.000577401","h2.twitch.map.fastly.net","tanvi-HP-Notebook-d18b","TCP","74","443  >  49560 [SYN, ACK] Seq=0 Ack=1 Win=28160 Len=0 MSS=1400 SACK_PERM=1 TSval=874472775 TSecr=3998228890 WS=512"
"487","0.000043430","tanvi-HP-Notebook-d18b","h2.twitch.map.fastly.net","TCP","66","49560  >  443 [ACK] Seq=1 Ack=1 Win=29312 Len=0 TSval=3998229079 TSecr=874472775"
"491","0.003338679","h2.twitch.map.fastly.net","tanvi-HP-Notebook-d18b","TCP","74","443  >  49558 [SYN, ACK] Seq=0 Ack=1 Win=28160 Len=0 MSS=1400 SACK_PERM=1 TSval=828451166 TSecr=3998228878 WS=512"
"492","0.000040420","tanvi-HP-Notebook-d18b","h2.twitch.map.fastly.net","TCP","66","49558  >  443 [ACK] Seq=1 Ack=1 Win=29312 Len=0 TSval=3998229085 TSecr=828451166"
"494","0.002494002","h2.twitch.map.fastly.net","tanvi-HP-Notebook-d18b","TCP","74","443  >  49556 [SYN, ACK] Seq=0 Ack=1 Win=28160 Len=0 MSS=1400 SACK_PERM=1 TSval=1954263958 TSecr=3998228878 WS=512"
"495","0.000017171","tanvi-HP-Notebook-d18b","h2.twitch.map.fastly.net","TCP","66","49556  >  443 [ACK] Seq=1 Ack=1 Win=29312 Len=0 TSval=3998229087 TSecr=1954263958"
"497","0.004732203","twitch.map.fastly.net","tanvi-HP-Notebook-d18b","TCP","74","443  >  56734 [SYN, ACK] Seq=0 Ack=1 Win=28160 Len=0 MSS=1400 SACK_PERM=1 TSval=1951923429 TSecr=1790665928 WS=512"
"498","0.000034230","tanvi-HP-Notebook-d18b","twitch.map.fastly.net","TCP","66","56734  >  443 [ACK] Seq=1 Ack=1 Win=29312 Len=0 TSval=1790666126 TSecr=1951923429"
"500","0.006592723","e9221.i.akamaiedge.net","tanvi-HP-Notebook-d18b","TCP","74","443  >  54018 [SYN, ACK] Seq=0 Ack=1 Win=28960 Len=0 MSS=1400 SACK_PERM=1 TSval=1919256038 TSecr=338030961 WS=128"
"501","0.000034030","tanvi-HP-Notebook-d18b","e9221.i.akamaiedge.net","TCP","66","54018  >  443 [ACK] Seq=1 Ack=1 Win=29312 Len=0 TSval=338031054 TSecr=1919256038"
"504","0.045350541","safebrowsing.googleapis.com","tanvi-HP-Notebook.local","TCP","86","443  >  57464 [ACK] Seq=3069 Ack=582 Win=66816 Len=0 TSval=811467432 TSecr=282289987"
"505","0.000067174","safebrowsing.googleapis.com","tanvi-HP-Notebook.local","TCP","86","443  >  57464 [ACK] Seq=3069 Ack=668 Win=66816 Len=0 TSval=811467432 TSecr=282289987"
"508","0.000084295","tanvi-HP-Notebook.local","safebrowsing.googleapis.com","TCP","86","57464  >  443 [ACK] Seq=1481 Ack=3680 Win=38528 Len=0 TSval=282290098 TSecr=811467432"
"510","0.050858249","e9221.i.akamaiedge.net","tanvi-HP-Notebook-d18b","TCP","66","443  >  54018 [ACK] Seq=1 Ack=518 Win=30080 Len=0 TSval=1919256178 TSecr=338031055"
"512","0.000011680","tanvi-HP-Notebook-d18b","e9221.i.akamaiedge.net","TCP","66","54018  >  443 [ACK] Seq=518 Ack=1389 Win=32128 Len=0 TSval=338031195 TSecr=1919256179"
"514","0.000006642","tanvi-HP-Notebook-d18b","e9221.i.akamaiedge.net","TCP","66","54018  >  443 [ACK] Seq=518 Ack=2777 Win=35072 Len=0 TSval=338031195 TSecr=1919256179"
"516","0.000005156","tanvi-HP-Notebook-d18b","e9221.i.akamaiedge.net","TCP","66","54018  >  443 [ACK] Seq=518 Ack=4038 Win=37888 Len=0 TSval=338031195 TSecr=1919256179"
"520","0.000244404","safebrowsing.googleapis.com","tanvi-HP-Notebook.local","TCP","86","443  >  57464 [ACK] Seq=3680 Ack=1481 Win=68352 Len=0 TSval=811467497 TSecr=282289988"
"522","0.006319108","safebrowsing.googleapis.com","tanvi-HP-Notebook.local","TCP","86","443  >  57464 [ACK] Seq=3680 Ack=1512 Win=68352 Len=0 TSval=811467537 TSecr=282290098"
"525","0.000018137","tanvi-HP-Notebook.local","safebrowsing.googleapis.com","TCP","86","57464  >  443 [ACK] Seq=1512 Ack=4341 Win=43392 Len=0 TSval=282290228 TSecr=811467570"
"529","0.000163315","tanvi-HP-Notebook.local","safebrowsing.googleapis.com","TCP","86","57464  >  443 [ACK] Seq=1512 Ack=4609 Win=45824 Len=0 TSval=282290229 TSecr=811467570"
"531","0.002443943","science-edge-external-prod-73889260.us-west-2.elb.amazonaws.com","tanvi-HP-Notebook-d18b","TCP","74","443  >  46418 [SYN, ACK] Seq=0 Ack=1 Win=26847 Len=0 MSS=1400 SACK_PERM=1 TSval=1128607213 TSecr=4231421334 WS=256"
"532","0.000030133","tanvi-HP-Notebook-d18b","science-edge-external-prod-73889260.us-west-2.elb.amazonaws.com","TCP","66","46418  >  443 [ACK] Seq=1 Ack=1 Win=29312 Len=0 TSval=4231421658 TSecr=1128607213"
"536","0.012772053","h2.twitch.map.fastly.net","tanvi-HP-Notebook-d18b","TCP","66","443  >  49560 [ACK] Seq=1 Ack=518 Win=29696 Len=0 TSval=874472838 TSecr=3998229080"
"538","0.000011583","tanvi-HP-Notebook-d18b","h2.twitch.map.fastly.net","TCP","66","49560  >  443 [ACK] Seq=518 Ack=1389 Win=32128 Len=0 TSval=3998229336 TSecr=874472839"
"540","0.000004798","tanvi-HP-Notebook-d18b","h2.twitch.map.fastly.net","TCP","66","49560  >  443 [ACK] Seq=518 Ack=2777 Win=35072 Len=0 TSval=3998229336 TSecr=874472839"
"542","0.000004844","tanvi-HP-Notebook-d18b","h2.twitch.map.fastly.net","TCP","66","49560  >  443 [ACK] Seq=518 Ack=4165 Win=37888 Len=0 TSval=3998229336 TSecr=874472839"
"544","0.000004086","tanvi-HP-Notebook-d18b","h2.twitch.map.fastly.net","TCP","66","49560  >  443 [ACK] Seq=518 Ack=4922 Win=40704 Len=0 TSval=3998229336 TSecr=874472839"
"548","0.002223800","e9221.i.akamaiedge.net","tanvi-HP-Notebook-d18b","TLSv1.3","337","New Session Ticket"
"550","0.000021369","tanvi-HP-Notebook-d18b","e9221.i.akamaiedge.net","TCP","66","54018  >  443 [ACK] Seq=598 Ack=4580 Win=43392 Len=0 TSval=338031296 TSecr=1919256278"
"551","0.006957618","twitch.map.fastly.net","tanvi-HP-Notebook-d18b","TCP","66","443  >  56734 [ACK] Seq=1 Ack=518 Win=29696 Len=0 TSval=1951923493 TSecr=1790666127"
"553","0.000011394","tanvi-HP-Notebook-d18b","twitch.map.fastly.net","TCP","66","56734  >  443 [ACK] Seq=518 Ack=1389 Win=32128 Len=0 TSval=1790666382 TSecr=1951923493"
"555","0.000019139","tanvi-HP-Notebook-d18b","twitch.map.fastly.net","TCP","66","56734  >  443 [ACK] Seq=518 Ack=2777 Win=35072 Len=0 TSval=1790666384 TSecr=1951923493"
"557","0.000007411","tanvi-HP-Notebook-d18b","twitch.map.fastly.net","TCP","66","56734  >  443 [ACK] Seq=518 Ack=4165 Win=37888 Len=0 TSval=1790666384 TSecr=1951923493"
"559","0.000005750","tanvi-HP-Notebook-d18b","twitch.map.fastly.net","TCP","66","56734  >  443 [ACK] Seq=518 Ack=4928 Win=40704 Len=0 TSval=1790666384 TSecr=1951923493"
"561","0.002756876","static.twitchcdn.net","tanvi-HP-Notebook-d18b","TCP","74","443  >  53322 [SYN, ACK] Seq=0 Ack=1 Win=28160 Len=0 MSS=1400 SACK_PERM=1 TSval=216132944 TSecr=2783642916 WS=512"
"562","0.000025865","tanvi-HP-Notebook-d18b","static.twitchcdn.net","TCP","66","53322  >  443 [ACK] Seq=1 Ack=1 Win=29312 Len=0 TSval=2783643192 TSecr=216132944"
"563","0.000102257","h2.twitch.map.fastly.net","tanvi-HP-Notebook-d18b","TCP","66","443  >  49558 [ACK] Seq=1 Ack=518 Win=29696 Len=0 TSval=828451234 TSecr=3998229085"
"566","0.000008485","tanvi-HP-Notebook-d18b","h2.twitch.map.fastly.net","TCP","66","49558  >  443 [ACK] Seq=518 Ack=1389 Win=32128 Len=0 TSval=3998229360 TSecr=828451235"
"568","0.000004402","tanvi-HP-Notebook-d18b","h2.twitch.map.fastly.net","TCP","66","49558  >  443 [ACK] Seq=518 Ack=2777 Win=35072 Len=0 TSval=3998229360 TSecr=828451235"
"570","0.000004507","tanvi-HP-Notebook-d18b","h2.twitch.map.fastly.net","TCP","66","49558  >  443 [ACK] Seq=518 Ack=4165 Win=37888 Len=0 TSval=3998229360 TSecr=828451235"
"572","0.000004759","tanvi-HP-Notebook-d18b","h2.twitch.map.fastly.net","TCP","66","49558  >  443 [ACK] Seq=518 Ack=4922 Win=40704 Len=0 TSval=3998229360 TSecr=828451235"
"574","0.001046887","h2.twitch.map.fastly.net","tanvi-HP-Notebook-d18b","TCP","66","443  >  49556 [ACK] Seq=1 Ack=518 Win=29696 Len=0 TSval=1954264027 TSecr=3998229088"
"576","0.000022750","tanvi-HP-Notebook-d18b","h2.twitch.map.fastly.net","TCP","66","49556  >  443 [ACK] Seq=518 Ack=1389 Win=32128 Len=0 TSval=3998229365 TSecr=1954264027"
"578","0.000006891","tanvi-HP-Notebook-d18b","h2.twitch.map.fastly.net","TCP","66","49556  >  443 [ACK] Seq=518 Ack=2777 Win=35072 Len=0 TSval=3998229365 TSecr=1954264027"
"580","0.000005693","tanvi-HP-Notebook-d18b","h2.twitch.map.fastly.net","TCP","66","49556  >  443 [ACK] Seq=518 Ack=4165 Win=37888 Len=0 TSval=3998229365 TSecr=1954264027"
"582","0.000005354","tanvi-HP-Notebook-d18b","h2.twitch.map.fastly.net","TCP","66","49556  >  443 [ACK] Seq=518 Ack=4922 Win=40704 Len=0 TSval=3998229365 TSecr=1954264027"
"584","0.038204049","dxtkri2c61io4.cloudfront.net","tanvi-HP-Notebook-d18b","TCP","74","443  >  33650 [SYN, ACK] Seq=0 Ack=1 Win=28960 Len=0 MSS=1400 SACK_PERM=1 TSval=1177962571 TSecr=3920636888 WS=256"
"585","0.000036324","tanvi-HP-Notebook-d18b","dxtkri2c61io4.cloudfront.net","TCP","66","33650  >  443 [ACK] Seq=1 Ack=1 Win=29312 Len=0 TSval=3920636975 TSecr=1177962571"
"587","0.026615557","safebrowsing.googleapis.com","tanvi-HP-Notebook.local","TCP","86","443  >  57464 [ACK] Seq=4609 Ack=1551 Win=68352 Len=0 TSval=811467687 TSecr=282290229"
"589","0.037557968","science-edge-external-prod-73889260.us-west-2.elb.amazonaws.com","tanvi-HP-Notebook-d18b","TCP","74","443  >  46424 [SYN, ACK] Seq=0 Ack=1 Win=26847 Len=0 MSS=1400 SACK_PERM=1 TSval=1128607252 TSecr=4231421479 WS=256"
"590","0.000035747","tanvi-HP-Notebook-d18b","science-edge-external-prod-73889260.us-west-2.elb.amazonaws.com","TCP","66","46424  >  443 [ACK] Seq=1 Ack=1 Win=29312 Len=0 TSval=4231421817 TSecr=1128607252"
"592","0.005056353","dxtkri2c61io4.cloudfront.net","tanvi-HP-Notebook-d18b","TCP","66","443  >  33650 [ACK] Seq=1 Ack=518 Win=30208 Len=0 TSval=1177962579 TSecr=3920636976"
"594","0.000009709","tanvi-HP-Notebook-d18b","dxtkri2c61io4.cloudfront.net","TCP","66","33650  >  443 [ACK] Seq=518 Ack=1389 Win=32128 Len=0 TSval=3920637052 TSecr=1177962579"
"596","0.000005957","tanvi-HP-Notebook-d18b","dxtkri2c61io4.cloudfront.net","TCP","66","33650  >  443 [ACK] Seq=518 Ack=2777 Win=35072 Len=0 TSval=3920637052 TSecr=1177962579"
"598","0.000004330","tanvi-HP-Notebook-d18b","dxtkri2c61io4.cloudfront.net","TCP","66","33650  >  443 [ACK] Seq=518 Ack=4165 Win=37888 Len=0 TSval=3920637052 TSecr=1177962579"
"600","0.000023215","tanvi-HP-Notebook-d18b","dxtkri2c61io4.cloudfront.net","TCP","66","33650  >  443 [ACK] Seq=518 Ack=4785 Win=40704 Len=0 TSval=3920637054 TSecr=1177962579"
"602","0.048268045","h2.twitch.map.fastly.net","tanvi-HP-Notebook-d18b","TLSv1.2","324","New Session Ticket, Change Cipher Spec, Finished"
"604","0.000049016","tanvi-HP-Notebook-d18b","h2.twitch.map.fastly.net","TCP","66","49560  >  443 [ACK] Seq=1172 Ack=5246 Win=43520 Len=0 TSval=3998229540 TSecr=874472890"
"606","0.022287354","twitch.map.fastly.net","tanvi-HP-Notebook-d18b","TLSv1.2","324","New Session Ticket, Change Cipher Spec, Finished"
"607","0.007128223","dxtkri2c61io4.cloudfront.net","tanvi-HP-Notebook-d18b","TCP","66","443  >  33650 [ACK] Seq=4785 Ack=644 Win=30208 Len=0 TSval=1177962587 TSecr=3920637057"
"609","0.000294070","tanvi-HP-Notebook-d18b","dxtkri2c61io4.cloudfront.net","HTTP","593","GET /branch-2.50.2.min.js HTTP/1.1 "
"610","0.007665632","static.twitchcdn.net","tanvi-HP-Notebook-d18b","TCP","66","443  >  53322 [ACK] Seq=1 Ack=518 Win=29696 Len=0 TSval=216132999 TSecr=2783643192"
"612","0.000014204","tanvi-HP-Notebook-d18b","static.twitchcdn.net","TCP","66","53322  >  443 [ACK] Seq=518 Ack=1389 Win=32128 Len=0 TSval=2783643413 TSecr=216132999"
"614","0.000010431","tanvi-HP-Notebook-d18b","static.twitchcdn.net","TCP","66","53322  >  443 [ACK] Seq=518 Ack=2777 Win=35072 Len=0 TSval=2783643413 TSecr=216132999"
"616","0.000009159","tanvi-HP-Notebook-d18b","static.twitchcdn.net","TCP","66","53322  >  443 [ACK] Seq=518 Ack=4165 Win=37888 Len=0 TSval=2783643413 TSecr=216132999"
"618","0.000006946","tanvi-HP-Notebook-d18b","static.twitchcdn.net","TCP","66","53322  >  443 [ACK] Seq=518 Ack=4928 Win=40704 Len=0 TSval=2783643413 TSecr=216132999"
"619","0.003119551","h2.twitch.map.fastly.net","tanvi-HP-Notebook-d18b","TLSv1.2","324","New Session Ticket, Change Cipher Spec, Finished"
"620","0.001409994","h2.twitch.map.fastly.net","tanvi-HP-Notebook-d18b","TLSv1.2","324","New Session Ticket, Change Cipher Spec, Finished"
"622","0.005822125","h2.twitch.map.fastly.net","tanvi-HP-Notebook-d18b","TCP","66","443  >  49560 [ACK] Seq=5246 Ack=1172 Win=30720 Len=0 TSval=874472903 TSecr=3998229339"
"623","0.005741732","pubsub-edge.chat.twitch.tv","tanvi-HP-Notebook-d18b","TCP","74","443  >  51368 [SYN, ACK] Seq=0 Ack=1 Win=26847 Len=0 MSS=1400 SACK_PERM=1 TSval=2649658733 TSecr=1953944496 WS=256"
"624","0.000218025","tanvi-HP-Notebook-d18b","pubsub-edge.chat.twitch.tv","TCP","66","51368  >  443 [ACK] Seq=1 Ack=1 Win=29312 Len=0 TSval=1953944812 TSecr=2649658733"
"626","0.005060452","tanvi-HP-Notebook-d18b","twitch.map.fastly.net","TCP","66","56734  >  443 [ACK] Seq=611 Ack=5186 Win=43520 Len=0 TSval=1790666637 TSecr=1951923546"
"627","0.020001887","tanvi-HP-Notebook-d18b","h2.twitch.map.fastly.net","TCP","66","49556  >  443 [ACK] Seq=611 Ack=5180 Win=43520 Len=0 TSval=3998229623 TSecr=1954264082"
"628","0.000018053","tanvi-HP-Notebook-d18b","h2.twitch.map.fastly.net","TCP","66","49558  >  443 [ACK] Seq=611 Ack=5180 Win=43520 Len=0 TSval=3998229623 TSecr=828451290"
"629","0.023129157","dxtkri2c61io4.cloudfront.net","tanvi-HP-Notebook-d18b","HTTP","530","HTTP/1.1 304 Not Modified "
"630","0.012086545","science-edge-external-prod-73889260.us-west-2.elb.amazonaws.com","tanvi-HP-Notebook-d18b","TCP","66","443  >  46418 [ACK] Seq=1 Ack=518 Win=28160 Len=0 TSval=1128607296 TSecr=4231421659"
"632","0.000015308","tanvi-HP-Notebook-d18b","science-edge-external-prod-73889260.us-west-2.elb.amazonaws.com","TCP","66","46418  >  443 [ACK] Seq=518 Ack=1389 Win=32128 Len=0 TSval=4231421997 TSecr=1128607297"
"634","0.000017257","tanvi-HP-Notebook-d18b","science-edge-external-prod-73889260.us-west-2.elb.amazonaws.com","TCP","66","46418  >  443 [ACK] Seq=518 Ack=2777 Win=35072 Len=0 TSval=4231422009 TSecr=1128607297"
"636","0.000007764","tanvi-HP-Notebook-d18b","science-edge-external-prod-73889260.us-west-2.elb.amazonaws.com","TCP","66","46418  >  443 [ACK] Seq=518 Ack=4165 Win=37888 Len=0 TSval=4231422009 TSecr=1128607297"
"638","0.000006565","tanvi-HP-Notebook-d18b","science-edge-external-prod-73889260.us-west-2.elb.amazonaws.com","TCP","66","46418  >  443 [ACK] Seq=518 Ack=5296 Win=40704 Len=0 TSval=4231422009 TSecr=1128607297"
"644","0.007864961","tanvi-HP-Notebook-d18b","dxtkri2c61io4.cloudfront.net","TCP","66","33650  >  443 [ACK] Seq=1171 Ack=5300 Win=43520 Len=0 TSval=3920637256 TSecr=1177962595"
"648","0.009252545","h2.twitch.map.fastly.net","tanvi-HP-Notebook-d18b","TCP","66","443  >  49560 [ACK] Seq=5676 Ack=1210 Win=30720 Len=0 TSval=874472937 TSecr=3998229540"
"649","0.030263831","tanvi-HP-Notebook-d18b","h2.twitch.map.fastly.net","TCP","66","49560  >  443 [ACK] Seq=1210 Ack=5676 Win=46336 Len=0 TSval=3998229763 TSecr=874472935"
"650","0.039494681","static.twitchcdn.net","tanvi-HP-Notebook-d18b","TLSv1.2","324","New Session Ticket, Change Cipher Spec, Finished"
"651","0.016631647","science-edge-external-prod-73889260.us-west-2.elb.amazonaws.com","tanvi-HP-Notebook-d18b","TCP","66","443  >  46424 [ACK] Seq=1 Ack=518 Win=28160 Len=0 TSval=1128607336 TSecr=4231421818"
"653","0.000016698","tanvi-HP-Notebook-d18b","science-edge-external-prod-73889260.us-west-2.elb.amazonaws.com","TCP","66","46424  >  443 [ACK] Seq=518 Ack=1389 Win=32128 Len=0 TSval=4231422155 TSecr=1128607337"
"655","0.000038879","tanvi-HP-Notebook-d18b","science-edge-external-prod-73889260.us-west-2.elb.amazonaws.com","TCP","66","46424  >  443 [ACK] Seq=518 Ack=2777 Win=35072 Len=0 TSval=4231422155 TSecr=1128607337"
"657","0.000005998","tanvi-HP-Notebook-d18b","science-edge-external-prod-73889260.us-west-2.elb.amazonaws.com","TCP","66","46424  >  443 [ACK] Seq=518 Ack=4165 Win=37888 Len=0 TSval=4231422156 TSecr=1128607337"
"659","0.000011348","tanvi-HP-Notebook-d18b","science-edge-external-prod-73889260.us-west-2.elb.amazonaws.com","TCP","66","46424  >  443 [ACK] Seq=518 Ack=5296 Win=40704 Len=0 TSval=4231422159 TSecr=1128607337"
"661","0.017515697","tanvi-HP-Notebook-d18b","static.twitchcdn.net","TCP","66","53322  >  443 [ACK] Seq=611 Ack=5186 Win=43520 Len=0 TSval=2783643678 TSecr=216133055"
"665","0.023776744","pubsub-edge.chat.twitch.tv","tanvi-HP-Notebook-d18b","TCP","66","443  >  51368 [ACK] Seq=1 Ack=518 Win=28160 Len=0 TSval=2649659053 TSecr=1953944812"
"667","0.000037422","tanvi-HP-Notebook-d18b","pubsub-edge.chat.twitch.tv","TCP","66","51368  >  443 [ACK] Seq=518 Ack=1389 Win=32128 Len=0 TSval=1953945131 TSecr=2649659053"
"669","0.000022552","tanvi-HP-Notebook-d18b","pubsub-edge.chat.twitch.tv","TCP","66","51368  >  443 [ACK] Seq=518 Ack=2777 Win=35072 Len=0 TSval=1953945131 TSecr=2649659053"
"671","0.000010894","tanvi-HP-Notebook-d18b","pubsub-edge.chat.twitch.tv","TCP","66","51368  >  443 [ACK] Seq=518 Ack=4097 Win=37888 Len=0 TSval=1953945131 TSecr=2649659053"
"673","0.000024357","tanvi-HP-Notebook-d18b","pubsub-edge.chat.twitch.tv","TCP","66","51368  >  443 [ACK] Seq=518 Ack=5265 Win=40576 Len=0 TSval=1953945133 TSecr=2649659054"
"675","0.014971946","h2.twitch.map.fastly.net","tanvi-HP-Notebook-d18b","HTTP2","132","SETTINGS[0], WINDOW_UPDATE[0], SETTINGS[0]"
"676","0.000023737","tanvi-HP-Notebook-d18b","h2.twitch.map.fastly.net","TCP","66","49558  >  443 [ACK] Seq=1357 Ack=5246 Win=43520 Len=0 TSval=3998229938 TSecr=828451379"
"732","0.001619707","h2.twitch.map.fastly.net","tanvi-HP-Notebook-d18b","TCP","66","443  >  49558 [ACK] Seq=5246 Ack=1357 Win=30720 Len=0 TSval=828451392 TSecr=3998229724"
"766","0.000001010","science-edge-external-prod-73889260.us-west-2.elb.amazonaws.com","tanvi-HP-Notebook-d18b","TCP","66","443  >  46418 [ACK] Seq=5296 Ack=737 Win=28160 Len=0 TSval=1128607382 TSecr=4231422013"
"773","0.000012165","tanvi-HP-Notebook-d18b","science-edge-external-prod-73889260.us-west-2.elb.amazonaws.com","TCP","66","46418  >  443 [ACK] Seq=2151 Ack=5664 Win=43520 Len=0 TSval=4231422340 TSecr=1128607383"
"841","0.000052341","science-edge-external-prod-73889260.us-west-2.elb.amazonaws.com","tanvi-HP-Notebook-d18b","TCP","66","443  >  46418 [ACK] Seq=5664 Ack=2151 Win=32000 Len=0 TSval=1128607386 TSecr=4231422014"
"850","0.000104501","irc-ws-edge.chat.twitch.tv","tanvi-HP-Notebook-d18b","TCP","74","443  >  44326 [SYN, ACK] Seq=0 Ack=1 Win=26847 Len=0 MSS=1400 SACK_PERM=1 TSval=1973717575 TSecr=1595475556 WS=256"
"851","0.000020943","tanvi-HP-Notebook-d18b","irc-ws-edge.chat.twitch.tv","TCP","66","44326  >  443 [ACK] Seq=1 Ack=1 Win=29312 Len=0 TSval=1595475893 TSecr=1973717575"
"881","0.015807209","twitch.map.fastly.net","tanvi-HP-Notebook-d18b","TCP","74","443  >  56750 [SYN, ACK] Seq=0 Ack=1 Win=28160 Len=0 MSS=1400 SACK_PERM=1 TSval=872402508 TSecr=1790666891 WS=512"
"882","0.000056242","tanvi-HP-Notebook-d18b","twitch.map.fastly.net","TCP","66","56750  >  443 [ACK] Seq=1 Ack=1 Win=29312 Len=0 TSval=1790667085 TSecr=872402508"
"884","0.011908443","tanvi-HP-Notebook-d18b","science-edge-external-prod-73889260.us-west-2.elb.amazonaws.com","TCP","66","46418  >  443 [ACK] Seq=2189 Ack=5801 Win=46336 Len=0 TSval=4231422399 TSecr=1128607386"
"888","0.071600293","science-edge-external-prod-73889260.us-west-2.elb.amazonaws.com","tanvi-HP-Notebook-d18b","TLSv1.2","356","New Session Ticket, Change Cipher Spec, Finished"
"890","0.000075393","tanvi-HP-Notebook-d18b","science-edge-external-prod-73889260.us-west-2.elb.amazonaws.com","TCP","66","46424  >  443 [ACK] Seq=644 Ack=5655 Win=43520 Len=0 TSval=4231422493 TSecr=1128607420"
"891","0.009302600","h2.twitch.map.fastly.net","tanvi-HP-Notebook-d18b","TCP","66","443  >  49558 [ACK] Seq=5246 Ack=1395 Win=30720 Len=0 TSval=828451436 TSecr=3998229939"
"892","0.000277661","clients.l.google.com","tanvi-HP-Notebook.local","TCP","94","443  >  32808 [SYN, ACK] Seq=0 Ack=1 Win=65535 Len=0 MSS=1360 SACK_PERM=1 TSval=683531548 TSecr=3521060611 WS=256"
"893","0.000039444","tanvi-HP-Notebook.local","clients.l.google.com","TCP","86","32808  >  443 [ACK] Seq=1 Ack=1 Win=28800 Len=0 TSval=3521060692 TSecr=683531548"
"896","0.042895898","tanvi-HP-Notebook-d18b","h2.twitch.map.fastly.net","TCP","66","49558  >  443 [ACK] Seq=1395 Ack=6428 Win=46336 Len=0 TSval=3998230219 TSecr=828451438"
"897","0.036402850","clients.l.google.com","tanvi-HP-Notebook.local","TCP","86","443  >  32808 [ACK] Seq=1 Ack=518 Win=66816 Len=0 TSval=683531638 TSecr=3521060692"
"898","0.005615263","twitch.map.fastly.net","tanvi-HP-Notebook-d18b","TCP","66","443  >  56750 [ACK] Seq=1 Ack=518 Win=29696 Len=0 TSval=872402560 TSecr=1790667085"
"900","0.000019443","tanvi-HP-Notebook-d18b","twitch.map.fastly.net","TCP","66","56750  >  443 [ACK] Seq=518 Ack=1389 Win=32128 Len=0 TSval=1790667295 TSecr=872402561"
"902","0.000011795","tanvi-HP-Notebook-d18b","twitch.map.fastly.net","TCP","66","56750  >  443 [ACK] Seq=518 Ack=2777 Win=35072 Len=0 TSval=1790667295 TSecr=872402561"
"904","0.000010352","tanvi-HP-Notebook-d18b","twitch.map.fastly.net","TCP","66","56750  >  443 [ACK] Seq=518 Ack=4165 Win=37888 Len=0 TSval=1790667295 TSecr=872402561"
"906","0.000023005","tanvi-HP-Notebook-d18b","twitch.map.fastly.net","TCP","66","56750  >  443 [ACK] Seq=518 Ack=4928 Win=40704 Len=0 TSval=1790667295 TSecr=872402561"
"907","0.000794187","pubsub-edge.chat.twitch.tv","tanvi-HP-Notebook-d18b","TLSv1.2","117","Change Cipher Spec, Finished"
"910","0.000155148","tanvi-HP-Notebook-d18b","pubsub-edge.chat.twitch.tv","HTTP","848","GET /v1 HTTP/1.1 "
"912","0.000029695","tanvi-HP-Notebook.local","clients.l.google.com","TCP","86","32808  >  443 [ACK] Seq=518 Ack=1209 Win=31232 Len=0 TSval=3521060858 TSecr=683531712"
"914","0.000011901","tanvi-HP-Notebook.local","clients.l.google.com","TCP","86","32808  >  443 [ACK] Seq=518 Ack=2417 Win=33664 Len=0 TSval=3521060858 TSecr=683531712"
"916","0.000010474","tanvi-HP-Notebook.local","clients.l.google.com","TCP","86","32808  >  443 [ACK] Seq=518 Ack=3625 Win=36096 Len=0 TSval=3521060858 TSecr=683531712"
"918","0.000006516","tanvi-HP-Notebook.local","clients.l.google.com","TCP","86","32808  >  443 [ACK] Seq=518 Ack=3781 Win=38528 Len=0 TSval=3521060858 TSecr=683531712"
"922","0.012959320","irc-ws-edge.chat.twitch.tv","tanvi-HP-Notebook-d18b","TCP","66","443  >  44326 [ACK] Seq=1 Ack=518 Win=28160 Len=0 TSval=1973717905 TSecr=1595475894"
"924","0.000014962","tanvi-HP-Notebook-d18b","irc-ws-edge.chat.twitch.tv","TCP","66","44326  >  443 [ACK] Seq=518 Ack=1389 Win=32128 Len=0 TSval=1595476225 TSecr=1973717905"
"926","0.000009746","tanvi-HP-Notebook-d18b","irc-ws-edge.chat.twitch.tv","TCP","66","44326  >  443 [ACK] Seq=518 Ack=2777 Win=35072 Len=0 TSval=1595476225 TSecr=1973717905"
"928","0.000007358","tanvi-HP-Notebook-d18b","irc-ws-edge.chat.twitch.tv","TCP","66","44326  >  443 [ACK] Seq=518 Ack=4097 Win=37888 Len=0 TSval=1595476225 TSecr=1973717905"
"930","0.000007277","tanvi-HP-Notebook-d18b","irc-ws-edge.chat.twitch.tv","TCP","66","44326  >  443 [ACK] Seq=518 Ack=5275 Win=40576 Len=0 TSval=1595476225 TSecr=1973717906"
"932","0.011976582","science-edge-external-prod-73889260.us-west-2.elb.amazonaws.com","tanvi-HP-Notebook-d18b","TCP","66","443  >  46418 [ACK] Seq=5801 Ack=2189 Win=32000 Len=0 TSval=1128607474 TSecr=4231422340"
"933","0.058534419","clients.l.google.com","tanvi-HP-Notebook.local","TCP","86","443  >  32808 [ACK] Seq=3781 Ack=582 Win=66816 Len=0 TSval=683531808 TSecr=3521060864"
"935","0.000202911","tanvi-HP-Notebook.local","clients.l.google.com","HTTP2","117","SETTINGS[0]"
"936","0.005583751","clients.l.google.com","tanvi-HP-Notebook.local","HTTP2","117","SETTINGS[0]"
