"No.","Time","Source","Destination","Protocol","Length","Info"
"17","0.068117144","clientservices.googleapis.com","tanvi-HP-Notebook.local","TCP","94","443  >  54504 [SYN, ACK] Seq=0 Ack=1 Win=65535 Len=0 MSS=1360 SACK_PERM=1 TSval=2806456661 TSecr=732919158 WS=256"
"18","0.000046904","tanvi-HP-Notebook.local","clientservices.googleapis.com","TCP","86","54504  >  443 [ACK] Seq=1 Ack=1 Win=28800 Len=0 TSval=732919245 TSecr=2806456661"
"26","0.002662256","www.gstatic.com","tanvi-HP-Notebook.local","TCP","94","443  >  54882 [SYN, ACK] Seq=0 Ack=1 Win=65535 Len=0 MSS=1360 SACK_PERM=1 TSval=568462768 TSecr=2554615539 WS=256"
"27","0.000048035","tanvi-HP-Notebook.local","www.gstatic.com","TCP","86","54882  >  443 [ACK] Seq=1 Ack=1 Win=28800 Len=0 TSval=2554615652 TSecr=568462768"
"29","0.012609479","www.gstatic.com","tanvi-HP-Notebook.local","TCP","94","443  >  54880 [SYN, ACK] Seq=0 Ack=1 Win=65535 Len=0 MSS=1360 SACK_PERM=1 TSval=2247672800 TSecr=2554615539 WS=256"
"30","0.000166896","tanvi-HP-Notebook.local","www.gstatic.com","TCP","86","54880  >  443 [ACK] Seq=1 Ack=1 Win=28800 Len=0 TSval=2554615665 TSecr=2247672800"
"32","0.054236076","clientservices.googleapis.com","tanvi-HP-Notebook.local","TCP","86","443  >  54504 [ACK] Seq=1 Ack=518 Win=66816 Len=0 TSval=2806456756 TSecr=732919246"
"33","0.038645393","www.google.com","tanvi-HP-Notebook.local","TCP","94","443  >  46026 [SYN, ACK] Seq=0 Ack=1 Win=65535 Len=0 MSS=1360 SACK_PERM=1 TSval=343353303 TSecr=43234553 WS=256"
"34","0.000113033","tanvi-HP-Notebook.local","www.google.com","TCP","86","46026  >  443 [ACK] Seq=1 Ack=1 Win=28800 Len=0 TSval=43234662 TSecr=343353303"
"36","0.015238800","www.gstatic.com","tanvi-HP-Notebook.local","TCP","86","443  >  54882 [ACK] Seq=1 Ack=518 Win=66816 Len=0 TSval=568462888 TSecr=2554615652"
"38","0.000040371","tanvi-HP-Notebook.local","clientservices.googleapis.com","TCP","86","54504  >  443 [ACK] Seq=518 Ack=1209 Win=31232 Len=0 TSval=732919399 TSecr=2806456816"
"40","0.000015663","tanvi-HP-Notebook.local","clientservices.googleapis.com","TCP","86","54504  >  443 [ACK] Seq=518 Ack=2417 Win=33664 Len=0 TSval=732919399 TSecr=2806456816"
"42","0.000036288","tanvi-HP-Notebook.local","clientservices.googleapis.com","TCP","86","54504  >  443 [ACK] Seq=518 Ack=3070 Win=36096 Len=0 TSval=732919399 TSecr=2806456816"
"47","0.004609420","www.gstatic.com","tanvi-HP-Notebook.local","TCP","86","443  >  54880 [ACK] Seq=1 Ack=518 Win=66816 Len=0 TSval=2247672930 TSecr=2554615665"
"54","0.000021785","tanvi-HP-Notebook.local","www.gstatic.com","TCP","86","54882  >  443 [ACK] Seq=518 Ack=1209 Win=31232 Len=0 TSval=2554615850 TSecr=568462964"
"56","0.000006828","tanvi-HP-Notebook.local","www.gstatic.com","TCP","86","54882  >  443 [ACK] Seq=518 Ack=2417 Win=33664 Len=0 TSval=2554615850 TSecr=568462964"
"58","0.000004415","tanvi-HP-Notebook.local","www.gstatic.com","TCP","86","54882  >  443 [ACK] Seq=518 Ack=3625 Win=36096 Len=0 TSval=2554615850 TSecr=568462964"
"60","0.000003458","tanvi-HP-Notebook.local","www.gstatic.com","TCP","86","54882  >  443 [ACK] Seq=518 Ack=3781 Win=38528 Len=0 TSval=2554615850 TSecr=568462964"
"68","0.000134412","www.google.com","tanvi-HP-Notebook.local","TCP","86","443  >  46026 [ACK] Seq=1 Ack=518 Win=66816 Len=0 TSval=343353413 TSecr=43234663"
"77","0.020112774","clientservices.googleapis.com","tanvi-HP-Notebook.local","TCP","86","443  >  54504 [ACK] Seq=3070 Ack=582 Win=66816 Len=0 TSval=2806456926 TSecr=732919415"
"79","0.000183797","tanvi-HP-Notebook.local","clientservices.googleapis.com","HTTP2","117","SETTINGS[0]"
"80","0.006604120","clientservices.googleapis.com","tanvi-HP-Notebook.local","TCP","86","443  >  54504 [ACK] Seq=3650 Ack=957 Win=67840 Len=0 TSval=2806456931 TSecr=732919415"
"82","0.040172238","tanvi-HP-Notebook.local","clientservices.googleapis.com","TCP","86","54504  >  443 [ACK] Seq=988 Ack=3681 Win=38528 Len=0 TSval=732919554 TSecr=2806456931"
"84","0.000024510","tanvi-HP-Notebook.local","www.google.com","TCP","86","46026  >  443 [ACK] Seq=518 Ack=1209 Win=31232 Len=0 TSval=43234846 TSecr=343353488"
"86","0.000007177","tanvi-HP-Notebook.local","www.google.com","TCP","86","46026  >  443 [ACK] Seq=518 Ack=2417 Win=33664 Len=0 TSval=43234846 TSecr=343353488"
"88","0.000050670","tanvi-HP-Notebook.local","www.google.com","TCP","86","46026  >  443 [ACK] Seq=518 Ack=2625 Win=36096 Len=0 TSval=43234847 TSecr=343353488"
"94","0.026673793","www.gstatic.com","tanvi-HP-Notebook.local","TCP","86","443  >  54882 [ACK] Seq=3781 Ack=582 Win=66816 Len=0 TSval=568463079 TSecr=2554615855"
"96","0.000275069","tanvi-HP-Notebook.local","www.gstatic.com","HTTP2","117","SETTINGS[0]"
"97","0.002099246","www.google.com","tanvi-HP-Notebook.local","TCP","94","443  >  46030 [SYN, ACK] Seq=0 Ack=1 Win=65535 Len=0 MSS=1360 SACK_PERM=1 TSval=3113107658 TSecr=43234771 WS=256"
"99","0.000010086","www.gstatic.com","tanvi-HP-Notebook.local","TCP","86","443  >  54882 [ACK] Seq=4361 Ack=877 Win=67840 Len=0 TSval=568463089 TSecr=2554615856"
"100","0.000058994","www.gstatic.com","tanvi-HP-Notebook.local","HTTP2","460","SETTINGS[0], HEADERS[3]: 200 OK"
"105","0.000120706","www.google.com","tanvi-HP-Notebook.local","TCP","94","443  >  46028 [SYN, ACK] Seq=0 Ack=1 Win=65535 Len=0 MSS=1360 SACK_PERM=1 TSval=3113107657 TSecr=43234761 WS=256"
"107","0.000392399","tanvi-HP-Notebook.local","www.gstatic.com","TCP","86","54882  >  443 [ACK] Seq=981 Ack=5136 Win=45824 Len=0 TSval=2554615978 TSecr=568463089"
"109","0.008928831","www.gstatic.com","tanvi-HP-Notebook.local","TCP","86","443  >  54880 [FIN, ACK] Seq=3781 Ack=519 Win=66816 Len=0 TSval=2247673121 TSecr=2554615856"
"111","-0.000131009","clientservices.googleapis.com","tanvi-HP-Notebook.local","TCP","86","443  >  54504 [ACK] Seq=3681 Ack=988 Win=67840 Len=0 TSval=2806457021 TSecr=732919507"
"118","0.023946865","www.google.com","tanvi-HP-Notebook.local","TCP","86","443  >  46026 [ACK] Seq=2625 Ack=582 Win=66816 Len=0 TSval=343353603 TSecr=43234852"
"119","0.000075821","www.google.com","tanvi-HP-Notebook.local","TCP","86","443  >  46026 [ACK] Seq=2625 Ack=668 Win=66816 Len=0 TSval=343353608 TSecr=43234852"
"122","0.000042641","tanvi-HP-Notebook.local","www.google.com","TCP","86","46026  >  443 [ACK] Seq=1891 Ack=3236 Win=38528 Len=0 TSval=43234974 TSecr=343353608"
"124","0.009731066","www.google.com","tanvi-HP-Notebook.local","TCP","86","443  >  46026 [ACK] Seq=3236 Ack=1801 Win=70656 Len=0 TSval=343353613 TSecr=43234852"
"125","0.002187326","www.google.com","tanvi-HP-Notebook.local","TCP","86","443  >  46026 [ACK] Seq=3236 Ack=1891 Win=70656 Len=0 TSval=343353618 TSecr=43234852"
"126","0.000068790","www.gstatic.com","tanvi-HP-Notebook.local","TCP","86","443  >  54882 [ACK] Seq=5136 Ack=981 Win=67840 Len=0 TSval=568463198 TSecr=2554615975"
"127","0.014037888","www.gstatic.com","tanvi-HP-Notebook.local","TCP","86","443  >  54882 [ACK] Seq=5136 Ack=1020 Win=67840 Len=0 TSval=568463213 TSecr=2554615980"
"129","0.000047483","tanvi-HP-Notebook.local","clientservices.googleapis.com","TCP","86","54504  >  443 [ACK] Seq=988 Ack=3950 Win=40960 Len=0 TSval=732919740 TSecr=2806457157"
"131","0.000018347","tanvi-HP-Notebook.local","clientservices.googleapis.com","TCP","86","54504  >  443 [ACK] Seq=988 Ack=3981 Win=40960 Len=0 TSval=732919740 TSecr=2806457158"
"133","0.000011190","tanvi-HP-Notebook.local","clientservices.googleapis.com","TCP","86","54504  >  443 [ACK] Seq=988 Ack=4020 Win=40960 Len=0 TSval=732919740 TSecr=2806457158"
"138","0.000143144","tanvi-HP-Notebook.local","www.google.com","TCP","86","46026  >  443 [ACK] Seq=1922 Ack=3810 Win=40960 Len=0 TSval=43235083 TSecr=343353716"
"139","0.000581710","www.google.com","tanvi-HP-Notebook.local","TCP","86","443  >  46026 [ACK] Seq=3810 Ack=1922 Win=70656 Len=0 TSval=343353718 TSecr=43234975"
"143","0.000063187","tanvi-HP-Notebook.local","www.google.com","TCP","86","46026  >  443 [ACK] Seq=1922 Ack=4105 Win=43392 Len=0 TSval=43235099 TSecr=343353720"
"146","0.000011614","tanvi-HP-Notebook.local","www.google.com","TCP","86","46026  >  443 [ACK] Seq=1922 Ack=6521 Win=48128 Len=0 TSval=43235099 TSecr=343353723"
"149","0.000022619","tanvi-HP-Notebook.local","www.google.com","TCP","86","46026  >  443 [ACK] Seq=1922 Ack=8937 Win=52992 Len=0 TSval=43235100 TSecr=343353726"
"151","0.001482483","tanvi-HP-Notebook.local","www.google.com","HTTP2","125","PING[0]"
"154","0.000028620","tanvi-HP-Notebook.local","www.google.com","TCP","86","46026  >  443 [ACK] Seq=1961 Ack=12561 Win=60288 Len=0 TSval=43235103 TSecr=343353736"
"157","0.000055639","tanvi-HP-Notebook.local","www.google.com","TCP","86","46026  >  443 [ACK] Seq=1961 Ack=13180 Win=65152 Len=0 TSval=43235108 TSecr=343353742"
"160","0.000019877","tanvi-HP-Notebook.local","www.google.com","TCP","86","46026  >  443 [ACK] Seq=1961 Ack=15596 Win=69888 Len=0 TSval=43235110 TSecr=343353743"
"163","0.000021872","tanvi-HP-Notebook.local","www.google.com","TCP","86","46026  >  443 [ACK] Seq=1961 Ack=18012 Win=74752 Len=0 TSval=43235119 TSecr=343353746"
"164","0.000019335","clientservices.googleapis.com","tanvi-HP-Notebook.local","TCP","86","443  >  54504 [ACK] Seq=4020 Ack=1027 Win=67840 Len=0 TSval=2806457251 TSecr=732919741"
"167","0.000008905","tanvi-HP-Notebook.local","www.google.com","TCP","86","46026  >  443 [ACK] Seq=1961 Ack=20428 Win=79616 Len=0 TSval=43235121 TSecr=343353751"
"170","0.000023402","tanvi-HP-Notebook.local","www.google.com","TCP","86","46026  >  443 [ACK] Seq=1961 Ack=22844 Win=84480 Len=0 TSval=43235126 TSecr=343353756"
"173","0.000061703","tanvi-HP-Notebook.local","www.google.com","TCP","86","46026  >  443 [ACK] Seq=1961 Ack=25260 Win=89216 Len=0 TSval=43235194 TSecr=343353828"
"176","0.000056881","tanvi-HP-Notebook.local","www.google.com","TCP","86","46026  >  443 [ACK] Seq=1961 Ack=27676 Win=94080 Len=0 TSval=43235196 TSecr=343353830"
"179","0.000059642","tanvi-HP-Notebook.local","www.google.com","TCP","86","46026  >  443 [ACK] Seq=1961 Ack=30092 Win=98944 Len=0 TSval=43235203 TSecr=343353838"
"183","0.000030150","tanvi-HP-Notebook.local","www.google.com","TCP","86","46026  >  443 [ACK] Seq=1961 Ack=32508 Win=103808 Len=0 TSval=43235206 TSecr=343353841"
"188","0.000022439","tanvi-HP-Notebook.local","www.google.com","TCP","86","46026  >  443 [ACK] Seq=1961 Ack=34924 Win=108544 Len=0 TSval=43235214 TSecr=343353846"
"193","0.000018699","tanvi-HP-Notebook.local","www.google.com","TCP","86","46026  >  443 [ACK] Seq=1996 Ack=37340 Win=113408 Len=0 TSval=43235217 TSecr=343353851"
"198","0.000058974","tanvi-HP-Notebook.local","www.google.com","TCP","86","46026  >  443 [ACK] Seq=1996 Ack=39756 Win=118272 Len=0 TSval=43235224 TSecr=343353856"
"201","0.000024307","tanvi-HP-Notebook.local","www.google.com","TCP","86","46026  >  443 [ACK] Seq=1996 Ack=42172 Win=123136 Len=0 TSval=43235237 TSecr=343353861"
"204","0.000013617","tanvi-HP-Notebook.local","www.google.com","TCP","86","46026  >  443 [ACK] Seq=1996 Ack=44588 Win=127872 Len=0 TSval=43235238 TSecr=343353864"
"207","0.001608719","www.google.com","tanvi-HP-Notebook.local","TLSv1.3","1294","[SSL segment of a reassembled PDU] [TCP segment of a reassembled PDU]"
"208","0.000028076","tanvi-HP-Notebook.local","www.google.com","TCP","86","46026  >  443 [ACK] Seq=1996 Ack=47004 Win=132736 Len=0 TSval=43235241 TSecr=343353869"
"211","0.000031691","tanvi-HP-Notebook.local","www.google.com","TCP","86","46026  >  443 [ACK] Seq=1996 Ack=49420 Win=137600 Len=0 TSval=43235246 TSecr=343353874"
"214","0.000025477","tanvi-HP-Notebook.local","www.google.com","TCP","86","46026  >  443 [ACK] Seq=1996 Ack=51836 Win=142464 Len=0 TSval=43235251 TSecr=343353879"
"217","0.000028874","tanvi-HP-Notebook.local","www.google.com","TCP","86","46026  >  443 [ACK] Seq=1996 Ack=54252 Win=147200 Len=0 TSval=43235258 TSecr=343353885"
"220","0.000035107","tanvi-HP-Notebook.local","www.google.com","TCP","86","46026  >  443 [ACK] Seq=1996 Ack=56668 Win=152064 Len=0 TSval=43235263 TSecr=343353890"
"224","0.000022921","tanvi-HP-Notebook.local","www.google.com","TCP","86","46026  >  443 [ACK] Seq=1996 Ack=59084 Win=156928 Len=0 TSval=43235267 TSecr=343353895"
"227","0.000014482","tanvi-HP-Notebook.local","www.google.com","TCP","86","46026  >  443 [ACK] Seq=1996 Ack=61500 Win=161792 Len=0 TSval=43235269 TSecr=343353903"
"230","0.000024240","tanvi-HP-Notebook.local","www.google.com","TCP","86","46026  >  443 [ACK] Seq=1996 Ack=63916 Win=166528 Len=0 TSval=43235274 TSecr=343353908"
"233","0.000007459","tanvi-HP-Notebook.local","www.google.com","TCP","86","46026  >  443 [ACK] Seq=1996 Ack=66332 Win=171392 Len=0 TSval=43235279 TSecr=343353913"
"236","0.000006938","tanvi-HP-Notebook.local","www.google.com","TCP","86","46026  >  443 [ACK] Seq=1996 Ack=68748 Win=176256 Len=0 TSval=43235284 TSecr=343353918"
"239","0.000011956","tanvi-HP-Notebook.local","www.google.com","TCP","86","46026  >  443 [ACK] Seq=1996 Ack=71164 Win=181120 Len=0 TSval=43235289 TSecr=343353923"
"242","0.000009445","tanvi-HP-Notebook.local","www.google.com","TCP","86","46026  >  443 [ACK] Seq=1996 Ack=73580 Win=183296 Len=0 TSval=43235294 TSecr=343353928"
"246","0.000019514","tanvi-HP-Notebook.local","www.google.com","TCP","86","46026  >  443 [ACK] Seq=1996 Ack=75996 Win=183296 Len=0 TSval=43235300 TSecr=343353933"
"249","0.000025651","tanvi-HP-Notebook.local","www.google.com","TCP","86","46026  >  443 [ACK] Seq=1996 Ack=77822 Win=183296 Len=0 TSval=43235306 TSecr=343353939"
"252","0.059516994","www.google.com","tanvi-HP-Notebook.local","TCP","86","443  >  46026 [ACK] Seq=77822 Ack=1996 Win=70656 Len=0 TSval=343353973 TSecr=43235214"
"315","0.086075449","oauthaccountmanager.googleapis.com","tanvi-HP-Notebook.local","TCP","94","443  >  56550 [SYN, ACK] Seq=0 Ack=1 Win=65535 Len=0 MSS=1360 SACK_PERM=1 TSval=3567397262 TSecr=905505041 WS=256"
"316","0.000043904","tanvi-HP-Notebook.local","oauthaccountmanager.googleapis.com","TCP","86","56550  >  443 [ACK] Seq=1 Ack=1 Win=28800 Len=0 TSval=905505186 TSecr=3567397262"
"323","0.034513931","oauthaccountmanager.googleapis.com","tanvi-HP-Notebook.local","TCP","86","443  >  56550 [ACK] Seq=1 Ack=518 Win=66816 Len=0 TSval=3567397367 TSecr=905505186"
"328","0.000021786","tanvi-HP-Notebook.local","oauthaccountmanager.googleapis.com","TCP","86","56550  >  443 [ACK] Seq=518 Ack=1209 Win=31232 Len=0 TSval=905505348 TSecr=3567397427"
"330","0.000023591","tanvi-HP-Notebook.local","oauthaccountmanager.googleapis.com","TCP","86","56550  >  443 [ACK] Seq=518 Ack=2417 Win=33664 Len=0 TSval=905505360 TSecr=3567397427"
"332","0.000054527","tanvi-HP-Notebook.local","oauthaccountmanager.googleapis.com","TCP","86","56550  >  443 [ACK] Seq=518 Ack=3070 Win=36096 Len=0 TSval=905505360 TSecr=3567397427"
"338","0.027827199","oauthaccountmanager.googleapis.com","tanvi-HP-Notebook.local","TCP","86","443  >  56550 [ACK] Seq=3070 Ack=582 Win=66816 Len=0 TSval=3567397546 TSecr=905505362"
"341","0.042636181","tanvi-HP-Notebook.local","oauthaccountmanager.googleapis.com","TCP","86","56550  >  443 [ACK] Seq=582 Ack=3650 Win=38528 Len=0 TSval=905505511 TSecr=3567397547"
"360","0.047999442","twitch.map.fastly.net","tanvi-HP-Notebook-d585","TCP","74","443  >  48138 [SYN, ACK] Seq=0 Ack=1 Win=28160 Len=0 MSS=1400 SACK_PERM=1 TSval=944260827 TSecr=957199241 WS=512"
"361","0.000060888","tanvi-HP-Notebook-d585","twitch.map.fastly.net","TCP","66","48138  >  443 [ACK] Seq=1 Ack=1 Win=29312 Len=0 TSval=957199442 TSecr=944260827"
"363","0.003047175","twitch.map.fastly.net","tanvi-HP-Notebook-d585","TCP","74","443  >  48140 [SYN, ACK] Seq=0 Ack=1 Win=28160 Len=0 MSS=1400 SACK_PERM=1 TSval=2067061433 TSecr=957199242 WS=512"
"364","0.000048783","tanvi-HP-Notebook-d585","twitch.map.fastly.net","TCP","66","48140  >  443 [ACK] Seq=1 Ack=1 Win=29312 Len=0 TSval=957199446 TSecr=2067061433"
"366","0.199926305","twitch.map.fastly.net","tanvi-HP-Notebook-d585","TCP","74","443  >  48142 [SYN, ACK] Seq=0 Ack=1 Win=28160 Len=0 MSS=1400 SACK_PERM=1 TSval=1936676897 TSecr=957199394 WS=512"
"367","0.000036422","tanvi-HP-Notebook-d585","twitch.map.fastly.net","TCP","66","48142  >  443 [ACK] Seq=1 Ack=1 Win=29312 Len=0 TSval=957199646 TSecr=1936676897"
"369","0.002210828","twitch.map.fastly.net","tanvi-HP-Notebook-d585","TCP","66","443  >  48138 [ACK] Seq=1 Ack=518 Win=29696 Len=0 TSval=944260878 TSecr=957199443"
"371","0.000028009","tanvi-HP-Notebook-d585","twitch.map.fastly.net","TCP","66","48138  >  443 [ACK] Seq=518 Ack=1389 Win=32128 Len=0 TSval=957199662 TSecr=944260879"
"373","0.000017123","tanvi-HP-Notebook-d585","twitch.map.fastly.net","TCP","66","48138  >  443 [ACK] Seq=518 Ack=2777 Win=35072 Len=0 TSval=957199662 TSecr=944260879"
"375","0.000008960","tanvi-HP-Notebook-d585","twitch.map.fastly.net","TCP","66","48138  >  443 [ACK] Seq=518 Ack=4165 Win=37888 Len=0 TSval=957199662 TSecr=944260879"
"377","0.000008195","tanvi-HP-Notebook-d585","twitch.map.fastly.net","TCP","66","48138  >  443 [ACK] Seq=518 Ack=4928 Win=40704 Len=0 TSval=957199662 TSecr=944260879"
"380","0.008404231","twitch.map.fastly.net","tanvi-HP-Notebook-d585","TCP","66","443  >  48140 [ACK] Seq=1 Ack=518 Win=29696 Len=0 TSval=2067061487 TSecr=957199446"
"382","0.000101817","tanvi-HP-Notebook-d585","twitch.map.fastly.net","TCP","66","48140  >  443 [ACK] Seq=518 Ack=1389 Win=32128 Len=0 TSval=957199677 TSecr=2067061487"
"384","0.000032133","tanvi-HP-Notebook-d585","twitch.map.fastly.net","TCP","66","48140  >  443 [ACK] Seq=518 Ack=2777 Win=35072 Len=0 TSval=957199677 TSecr=2067061487"
"386","0.000057281","tanvi-HP-Notebook-d585","twitch.map.fastly.net","TCP","66","48140  >  443 [ACK] Seq=518 Ack=4165 Win=37888 Len=0 TSval=957199677 TSecr=2067061487"
"388","0.000071908","tanvi-HP-Notebook-d585","twitch.map.fastly.net","TCP","66","48140  >  443 [ACK] Seq=518 Ack=4928 Win=40704 Len=0 TSval=957199678 TSecr=2067061487"
"391","0.147519676","twitch.map.fastly.net","tanvi-HP-Notebook-d585","TCP","66","443  >  48138 [ACK] Seq=4928 Ack=1315 Win=30720 Len=0 TSval=944260936 TSecr=957199668"
"392","0.000000686","twitch.map.fastly.net","tanvi-HP-Notebook-d585","TCP","66","443  >  48142 [ACK] Seq=1 Ack=518 Win=29696 Len=0 TSval=1936676961 TSecr=957199647"
"394","0.000013992","tanvi-HP-Notebook-d585","twitch.map.fastly.net","TCP","66","48142  >  443 [ACK] Seq=518 Ack=1389 Win=32128 Len=0 TSval=957199886 TSecr=1936676961"
"396","0.000007288","tanvi-HP-Notebook-d585","twitch.map.fastly.net","TCP","66","48142  >  443 [ACK] Seq=518 Ack=2777 Win=35072 Len=0 TSval=957199886 TSecr=1936676961"
"398","0.000004545","tanvi-HP-Notebook-d585","twitch.map.fastly.net","TCP","66","48142  >  443 [ACK] Seq=518 Ack=4165 Win=37888 Len=0 TSval=957199886 TSecr=1936676961"
"400","0.000004372","tanvi-HP-Notebook-d585","twitch.map.fastly.net","TCP","66","48142  >  443 [ACK] Seq=518 Ack=4928 Win=40704 Len=0 TSval=957199886 TSecr=1936676961"
"403","0.005980518","twitch.map.fastly.net","tanvi-HP-Notebook-d585","TLSv1.2","324","New Session Ticket, Change Cipher Spec, Finished"
"405","0.000022208","tanvi-HP-Notebook-d585","twitch.map.fastly.net","TCP","66","48138  >  443 [ACK] Seq=1315 Ack=6574 Win=46336 Len=0 TSval=957199909 TSecr=944260936"
"408","0.000008249","tanvi-HP-Notebook-d585","twitch.map.fastly.net","TCP","66","48138  >  443 [ACK] Seq=1315 Ack=9350 Win=52224 Len=0 TSval=957199909 TSecr=944260941"
"411","0.000004554","tanvi-HP-Notebook-d585","twitch.map.fastly.net","TCP","66","48138  >  443 [ACK] Seq=1315 Ack=12126 Win=57984 Len=0 TSval=957199909 TSecr=944260941"
"414","0.000031321","tanvi-HP-Notebook-d585","twitch.map.fastly.net","TCP","66","48138  >  443 [ACK] Seq=1315 Ack=14902 Win=63744 Len=0 TSval=957199910 TSecr=944260941"
"417","0.000022151","tanvi-HP-Notebook-d585","twitch.map.fastly.net","TCP","66","48138  >  443 [ACK] Seq=1315 Ack=17678 Win=69504 Len=0 TSval=957199911 TSecr=944260941"
"418","0.024335585","tanvi-HP-Notebook-d585","twitch.map.fastly.net","TCP","66","48140  >  443 [ACK] Seq=611 Ack=5186 Win=43520 Len=0 TSval=957199935 TSecr=2067061542"
"444","0.000015984","tanvi-HP-Notebook-d585","twitch.map.fastly.net","TCP","66","48138  >  443 [ACK] Seq=1315 Ack=20454 Win=75392 Len=0 TSval=957200097 TSecr=944260991"
"447","0.000008503","tanvi-HP-Notebook-d585","twitch.map.fastly.net","TCP","66","48138  >  443 [ACK] Seq=1315 Ack=23230 Win=81152 Len=0 TSval=957200097 TSecr=944260991"
"450","0.000010939","tanvi-HP-Notebook-d585","twitch.map.fastly.net","TCP","66","48138  >  443 [ACK] Seq=1315 Ack=26006 Win=86912 Len=0 TSval=957200097 TSecr=944260991"
"453","0.000008122","tanvi-HP-Notebook-d585","twitch.map.fastly.net","TCP","66","48138  >  443 [ACK] Seq=1315 Ack=28782 Win=92672 Len=0 TSval=957200097 TSecr=944260991"
"456","0.000025962","tanvi-HP-Notebook-d585","twitch.map.fastly.net","TCP","66","48138  >  443 [ACK] Seq=1315 Ack=31558 Win=98560 Len=0 TSval=957200116 TSecr=944260992"
"457","0.012358817","twitch.map.fastly.net","tanvi-HP-Notebook-d585","TLSv1.2","324","New Session Ticket, Change Cipher Spec, Finished"
"460","0.000011832","tanvi-HP-Notebook-d585","twitch.map.fastly.net","TCP","66","48138  >  443 [ACK] Seq=1315 Ack=33461 Win=104192 Len=0 TSval=957200130 TSecr=944260992"
"461","0.004929065","safebrowsing.googleapis.com","tanvi-HP-Notebook.local","TCP","94","443  >  60820 [SYN, ACK] Seq=0 Ack=1 Win=65535 Len=0 MSS=1360 SACK_PERM=1 TSval=2039644091 TSecr=3282580515 WS=256"
"462","0.000079934","tanvi-HP-Notebook.local","safebrowsing.googleapis.com","TCP","86","60820  >  443 [ACK] Seq=1 Ack=1 Win=28800 Len=0 TSval=3282580628 TSecr=2039644091"
"468","0.008771785","tanvi-HP-Notebook-d585","twitch.map.fastly.net","TCP","66","48142  >  443 [ACK] Seq=611 Ack=5186 Win=43520 Len=0 TSval=957200171 TSecr=1936677020"
"493","0.002278602","safebrowsing.googleapis.com","tanvi-HP-Notebook.local","TCP","86","443  >  60820 [ACK] Seq=1 Ack=518 Win=66816 Len=0 TSval=2039644221 TSecr=3282580629"
"506","0.000174385","tanvi-HP-Notebook.local","safebrowsing.googleapis.com","TCP","86","60820  >  443 [ACK] Seq=518 Ack=1209 Win=31232 Len=0 TSval=3282580819 TSecr=2039644288"
"508","0.000039298","tanvi-HP-Notebook.local","safebrowsing.googleapis.com","TCP","86","60820  >  443 [ACK] Seq=518 Ack=2417 Win=33664 Len=0 TSval=3282580819 TSecr=2039644288"
"510","0.000064228","tanvi-HP-Notebook.local","safebrowsing.googleapis.com","TCP","86","60820  >  443 [ACK] Seq=518 Ack=3070 Win=36096 Len=0 TSval=3282580819 TSecr=2039644288"
"517","0.011732797","twitch.map.fastly.net","tanvi-HP-Notebook-d585","TCP","74","443  >  48148 [SYN, ACK] Seq=0 Ack=1 Win=28160 Len=0 MSS=1400 SACK_PERM=1 TSval=811727048 TSecr=957200162 WS=512"
"518","0.000033025","tanvi-HP-Notebook-d585","twitch.map.fastly.net","TCP","66","48148  >  443 [ACK] Seq=1 Ack=1 Win=29312 Len=0 TSval=957200357 TSecr=811727048"
"520","0.005712881","h2.twitch.map.fastly.net","tanvi-HP-Notebook-d585","TCP","74","443  >  54768 [SYN, ACK] Seq=0 Ack=1 Win=28160 Len=0 MSS=1400 SACK_PERM=1 TSval=966807903 TSecr=2744318267 WS=512"
"521","0.000037694","tanvi-HP-Notebook-d585","h2.twitch.map.fastly.net","TCP","66","54768  >  443 [ACK] Seq=1 Ack=1 Win=29312 Len=0 TSval=2744318456 TSecr=966807903"
"522","0.000005996","h2.twitch.map.fastly.net","tanvi-HP-Notebook-d585","TCP","74","443  >  54766 [SYN, ACK] Seq=0 Ack=1 Win=28160 Len=0 MSS=1400 SACK_PERM=1 TSval=812415527 TSecr=2744318267 WS=512"
"523","0.000006757","tanvi-HP-Notebook-d585","h2.twitch.map.fastly.net","TCP","66","54766  >  443 [ACK] Seq=1 Ack=1 Win=29312 Len=0 TSval=2744318456 TSecr=812415527"
"528","0.001355148","e9221.i.akamaiedge.net","tanvi-HP-Notebook-d585","TCP","74","443  >  45144 [SYN, ACK] Seq=0 Ack=1 Win=28960 Len=0 MSS=1400 SACK_PERM=1 TSval=3869218554 TSecr=2770401832 WS=128"
"529","0.000020633","tanvi-HP-Notebook-d585","e9221.i.akamaiedge.net","TCP","66","45144  >  443 [ACK] Seq=1 Ack=1 Win=29312 Len=0 TSval=2770401927 TSecr=3869218554"
"532","0.010025671","h2.twitch.map.fastly.net","tanvi-HP-Notebook-d585","TCP","74","443  >  54770 [SYN, ACK] Seq=0 Ack=1 Win=28160 Len=0 MSS=1400 SACK_PERM=1 TSval=200097242 TSecr=2744318287 WS=512"
"533","0.000037921","tanvi-HP-Notebook-d585","h2.twitch.map.fastly.net","TCP","66","54770  >  443 [ACK] Seq=1 Ack=1 Win=29312 Len=0 TSval=2744318472 TSecr=200097242"
"535","0.008851315","science-edge-external-prod-73889260.us-west-2.elb.amazonaws.com","tanvi-HP-Notebook-d585","TCP","74","443  >  59926 [SYN, ACK] Seq=0 Ack=1 Win=26847 Len=0 MSS=1400 SACK_PERM=1 TSval=1161167378 TSecr=1602076986 WS=256"
"536","0.000031410","tanvi-HP-Notebook-d585","science-edge-external-prod-73889260.us-west-2.elb.amazonaws.com","TCP","66","59926  >  443 [ACK] Seq=1 Ack=1 Win=29312 Len=0 TSval=1602077299 TSecr=1161167378"
"542","0.027780189","h2.twitch.map.fastly.net","tanvi-HP-Notebook-d585","TCP","74","443  >  54772 [SYN, ACK] Seq=0 Ack=1 Win=28160 Len=0 MSS=1400 SACK_PERM=1 TSval=200097257 TSecr=2744318334 WS=512"
"543","0.000212133","tanvi-HP-Notebook-d585","h2.twitch.map.fastly.net","TCP","66","54772  >  443 [ACK] Seq=1 Ack=1 Win=29312 Len=0 TSval=2744318536 TSecr=200097257"
"545","0.004916435","safebrowsing.googleapis.com","tanvi-HP-Notebook.local","TCP","86","443  >  60820 [ACK] Seq=3070 Ack=582 Win=66816 Len=0 TSval=2039644411 TSecr=3282580825"
"546","0.000002036","safebrowsing.googleapis.com","tanvi-HP-Notebook.local","TCP","86","443  >  60820 [ACK] Seq=3070 Ack=668 Win=66816 Len=0 TSval=2039644411 TSecr=3282580825"
"549","0.000138814","tanvi-HP-Notebook.local","safebrowsing.googleapis.com","TCP","86","60820  >  443 [ACK] Seq=1480 Ack=3681 Win=38528 Len=0 TSval=3282580943 TSecr=2039644411"
"551","0.011756233","safebrowsing.googleapis.com","tanvi-HP-Notebook.local","TCP","86","443  >  60820 [ACK] Seq=3681 Ack=1480 Win=68352 Len=0 TSval=2039644421 TSecr=3282580826"
"552","0.002356096","e9221.i.akamaiedge.net","tanvi-HP-Notebook-d585","TCP","66","443  >  45144 [ACK] Seq=1 Ack=518 Win=30080 Len=0 TSval=3869218649 TSecr=2770401927"
"554","0.000040062","tanvi-HP-Notebook-d585","e9221.i.akamaiedge.net","TCP","66","45144  >  443 [ACK] Seq=518 Ack=1389 Win=32128 Len=0 TSval=2770402023 TSecr=3869218650"
"556","0.000015456","tanvi-HP-Notebook-d585","e9221.i.akamaiedge.net","TCP","66","45144  >  443 [ACK] Seq=518 Ack=2777 Win=35072 Len=0 TSval=2770402023 TSecr=3869218650"
"558","0.000142506","tanvi-HP-Notebook-d585","e9221.i.akamaiedge.net","TCP","66","45144  >  443 [ACK] Seq=518 Ack=4038 Win=37888 Len=0 TSval=2770402036 TSecr=3869218650"
"559","-0.000140376","static.twitchcdn.net","tanvi-HP-Notebook-d585","TCP","74","443  >  33324 [SYN, ACK] Seq=0 Ack=1 Win=28160 Len=0 MSS=1400 SACK_PERM=1 TSval=858437164 TSecr=3063548033 WS=512"
"560","0.000304554","tanvi-HP-Notebook-d585","static.twitchcdn.net","TCP","66","33324  >  443 [ACK] Seq=1 Ack=1 Win=29312 Len=0 TSval=3063548236 TSecr=858437164"
"567","0.000272710","tanvi-HP-Notebook.local","safebrowsing.googleapis.com","TCP","86","60820  >  443 [ACK] Seq=1511 Ack=4398 Win=45824 Len=0 TSval=3282581019 TSecr=2039644486"
"568","0.001799121","cdn.branch.io","tanvi-HP-Notebook-d585","TCP","74","443  >  40598 [SYN, ACK] Seq=0 Ack=1 Win=28960 Len=0 MSS=1400 SACK_PERM=1 TSval=1071765994 TSecr=3424685272 WS=256"
"569","0.000034504","tanvi-HP-Notebook-d585","cdn.branch.io","TCP","66","40598  >  443 [ACK] Seq=1 Ack=1 Win=29312 Len=0 TSval=3424685385 TSecr=1071765994"
"572","0.024088300","h2.twitch.map.fastly.net","tanvi-HP-Notebook-d585","TCP","66","443  >  54768 [ACK] Seq=1 Ack=518 Win=29696 Len=0 TSval=966807951 TSecr=2744318456"
"574","0.000016518","tanvi-HP-Notebook-d585","h2.twitch.map.fastly.net","TCP","66","54768  >  443 [ACK] Seq=518 Ack=1389 Win=32128 Len=0 TSval=2744318649 TSecr=966807951"
"576","0.000005106","tanvi-HP-Notebook-d585","h2.twitch.map.fastly.net","TCP","66","54768  >  443 [ACK] Seq=518 Ack=2777 Win=35072 Len=0 TSval=2744318649 TSecr=966807951"
"578","0.000008655","tanvi-HP-Notebook-d585","h2.twitch.map.fastly.net","TCP","66","54768  >  443 [ACK] Seq=518 Ack=4165 Win=37888 Len=0 TSval=2744318650 TSecr=966807951"
"580","0.000004833","tanvi-HP-Notebook-d585","h2.twitch.map.fastly.net","TCP","66","54768  >  443 [ACK] Seq=518 Ack=4922 Win=40704 Len=0 TSval=2744318650 TSecr=966807951"
"581","0.001635799","twitch.map.fastly.net","tanvi-HP-Notebook-d585","TCP","66","443  >  48148 [ACK] Seq=1 Ack=518 Win=29696 Len=0 TSval=811727099 TSecr=957200357"
"583","0.000153759","tanvi-HP-Notebook-d585","twitch.map.fastly.net","TCP","66","48148  >  443 [ACK] Seq=518 Ack=1389 Win=32128 Len=0 TSval=957200561 TSecr=811727099"
"585","0.000044009","tanvi-HP-Notebook-d585","twitch.map.fastly.net","TCP","66","48148  >  443 [ACK] Seq=518 Ack=2777 Win=35072 Len=0 TSval=957200561 TSecr=811727099"
"587","0.000059208","tanvi-HP-Notebook-d585","twitch.map.fastly.net","TCP","66","48148  >  443 [ACK] Seq=518 Ack=4165 Win=37888 Len=0 TSval=957200561 TSecr=811727099"
"589","0.000083598","tanvi-HP-Notebook-d585","twitch.map.fastly.net","TCP","66","48148  >  443 [ACK] Seq=518 Ack=4928 Win=40704 Len=0 TSval=957200561 TSecr=811727099"
"590","0.000005842","h2.twitch.map.fastly.net","tanvi-HP-Notebook-d585","TCP","66","443  >  54766 [ACK] Seq=1 Ack=518 Win=29696 Len=0 TSval=812415577 TSecr=2744318456"
"592","0.000021919","tanvi-HP-Notebook-d585","h2.twitch.map.fastly.net","TCP","66","54766  >  443 [ACK] Seq=518 Ack=1389 Win=32128 Len=0 TSval=2744318656 TSecr=812415577"
"594","0.000009737","tanvi-HP-Notebook-d585","h2.twitch.map.fastly.net","TCP","66","54766  >  443 [ACK] Seq=518 Ack=2777 Win=35072 Len=0 TSval=2744318656 TSecr=812415577"
"596","0.000005882","tanvi-HP-Notebook-d585","h2.twitch.map.fastly.net","TCP","66","54766  >  443 [ACK] Seq=518 Ack=4165 Win=37888 Len=0 TSval=2744318656 TSecr=812415577"
"598","0.000007574","tanvi-HP-Notebook-d585","h2.twitch.map.fastly.net","TCP","66","54766  >  443 [ACK] Seq=518 Ack=4922 Win=40704 Len=0 TSval=2744318656 TSecr=812415577"
"600","0.003703307","science-edge-external-prod-73889260.us-west-2.elb.amazonaws.com","tanvi-HP-Notebook-d585","TCP","74","443  >  59938 [SYN, ACK] Seq=0 Ack=1 Win=26847 Len=0 MSS=1400 SACK_PERM=1 TSval=1161167423 TSecr=1602077153 WS=256"
"601","0.000034071","tanvi-HP-Notebook-d585","science-edge-external-prod-73889260.us-west-2.elb.amazonaws.com","TCP","66","59938  >  443 [ACK] Seq=1 Ack=1 Win=29312 Len=0 TSval=1602077478 TSecr=1161167423"
"605","0.000336717","safebrowsing.googleapis.com","tanvi-HP-Notebook.local","TCP","86","443  >  60820 [ACK] Seq=4398 Ack=1511 Win=68352 Len=0 TSval=2039644530 TSecr=3282580943"
"608","0.001126280","h2.twitch.map.fastly.net","tanvi-HP-Notebook-d585","TCP","66","443  >  54770 [ACK] Seq=1 Ack=518 Win=29696 Len=0 TSval=200097290 TSecr=2744318472"
"610","0.000016321","tanvi-HP-Notebook-d585","h2.twitch.map.fastly.net","TCP","66","54770  >  443 [ACK] Seq=518 Ack=1389 Win=32128 Len=0 TSval=2744318668 TSecr=200097291"
"612","0.000006928","tanvi-HP-Notebook-d585","h2.twitch.map.fastly.net","TCP","66","54770  >  443 [ACK] Seq=518 Ack=2777 Win=35072 Len=0 TSval=2744318668 TSecr=200097291"
"614","0.000098532","tanvi-HP-Notebook-d585","h2.twitch.map.fastly.net","TCP","66","54770  >  443 [ACK] Seq=518 Ack=4165 Win=37888 Len=0 TSval=2744318669 TSecr=200097291"
"616","0.000013968","tanvi-HP-Notebook-d585","h2.twitch.map.fastly.net","TCP","66","54770  >  443 [ACK] Seq=518 Ack=4922 Win=40704 Len=0 TSval=2744318671 TSecr=200097291"
"617","0.000057976","e9221.i.akamaiedge.net","tanvi-HP-Notebook-d585","TLSv1.3","337","New Session Ticket"
"619","0.001471509","tanvi-HP-Notebook-d585","e9221.i.akamaiedge.net","TCP","66","45144  >  443 [ACK] Seq=598 Ack=4580 Win=43392 Len=0 TSval=2770402139 TSecr=3869218763"
"621","0.044984364","cdn.branch.io","tanvi-HP-Notebook-d585","TCP","66","443  >  40598 [ACK] Seq=1 Ack=518 Win=30208 Len=0 TSval=1071766004 TSecr=3424685386"
"623","0.000071801","tanvi-HP-Notebook-d585","cdn.branch.io","TCP","66","40598  >  443 [ACK] Seq=518 Ack=1389 Win=32128 Len=0 TSval=3424685485 TSecr=1071766004"
"625","0.000139685","tanvi-HP-Notebook-d585","cdn.branch.io","TCP","66","40598  >  443 [ACK] Seq=518 Ack=2777 Win=35072 Len=0 TSval=3424685485 TSecr=1071766004"
"627","0.000047684","tanvi-HP-Notebook-d585","cdn.branch.io","TCP","66","40598  >  443 [ACK] Seq=518 Ack=4165 Win=37888 Len=0 TSval=3424685491 TSecr=1071766004"
"629","0.000018047","tanvi-HP-Notebook-d585","cdn.branch.io","TCP","66","40598  >  443 [ACK] Seq=518 Ack=4785 Win=40704 Len=0 TSval=3424685492 TSecr=1071766004"
"631","0.002604554","h2.twitch.map.fastly.net","tanvi-HP-Notebook-d585","TCP","66","443  >  54772 [ACK] Seq=1 Ack=518 Win=29696 Len=0 TSval=200097307 TSecr=2744318537"
"633","0.000071733","tanvi-HP-Notebook-d585","h2.twitch.map.fastly.net","TCP","66","54772  >  443 [ACK] Seq=518 Ack=1389 Win=32128 Len=0 TSval=2744318738 TSecr=200097308"
"635","0.000026739","tanvi-HP-Notebook-d585","h2.twitch.map.fastly.net","TCP","66","54772  >  443 [ACK] Seq=518 Ack=2777 Win=35072 Len=0 TSval=2744318738 TSecr=200097308"
"637","0.000040482","tanvi-HP-Notebook-d585","h2.twitch.map.fastly.net","TCP","66","54772  >  443 [ACK] Seq=518 Ack=4165 Win=37888 Len=0 TSval=2744318738 TSecr=200097308"
"638","0.012413688","safebrowsing.googleapis.com","tanvi-HP-Notebook.local","TCP","86","443  >  60820 [ACK] Seq=4398 Ack=1550 Win=68352 Len=0 TSval=2039644610 TSecr=3282581023"
"640","0.000156955","tanvi-HP-Notebook-d585","h2.twitch.map.fastly.net","TCP","66","54772  >  443 [ACK] Seq=518 Ack=4922 Win=40704 Len=0 TSval=2744318752 TSecr=200097308"
"642","0.011097300","static.twitchcdn.net","tanvi-HP-Notebook-d585","TCP","66","443  >  33324 [ACK] Seq=1 Ack=518 Win=29696 Len=0 TSval=858437214 TSecr=3063548237"
"644","0.000021921","tanvi-HP-Notebook-d585","static.twitchcdn.net","TCP","66","33324  >  443 [ACK] Seq=518 Ack=1389 Win=32128 Len=0 TSval=3063548434 TSecr=858437215"
"646","0.000005621","tanvi-HP-Notebook-d585","static.twitchcdn.net","TCP","66","33324  >  443 [ACK] Seq=518 Ack=2777 Win=35072 Len=0 TSval=3063548434 TSecr=858437215"
"648","0.000005860","tanvi-HP-Notebook-d585","static.twitchcdn.net","TCP","66","33324  >  443 [ACK] Seq=518 Ack=4165 Win=37888 Len=0 TSval=3063548434 TSecr=858437215"
"650","0.000005311","tanvi-HP-Notebook-d585","static.twitchcdn.net","TCP","66","33324  >  443 [ACK] Seq=518 Ack=4928 Win=40704 Len=0 TSval=3063548435 TSecr=858437215"
"652","0.017327717","pubsub-edge.chat.twitch.tv","tanvi-HP-Notebook-d585","TCP","74","443  >  38804 [SYN, ACK] Seq=0 Ack=1 Win=26847 Len=0 MSS=1400 SACK_PERM=1 TSval=4079716177 TSecr=3651730198 WS=256"
"653","0.000109920","tanvi-HP-Notebook-d585","pubsub-edge.chat.twitch.tv","TCP","66","38804  >  443 [ACK] Seq=1 Ack=1 Win=29312 Len=0 TSval=3651730501 TSecr=4079716177"
"655","0.023463895","science-edge-external-prod-73889260.us-west-2.elb.amazonaws.com","tanvi-HP-Notebook-d585","TCP","66","443  >  59926 [ACK] Seq=1 Ack=518 Win=28160 Len=0 TSval=1161167459 TSecr=1602077299"
"657","0.000018767","tanvi-HP-Notebook-d585","science-edge-external-prod-73889260.us-west-2.elb.amazonaws.com","TCP","66","59926  >  443 [ACK] Seq=518 Ack=1389 Win=32128 Len=0 TSval=1602077634 TSecr=1161167460"
"659","0.000013059","tanvi-HP-Notebook-d585","science-edge-external-prod-73889260.us-west-2.elb.amazonaws.com","TCP","66","59926  >  443 [ACK] Seq=518 Ack=2777 Win=35072 Len=0 TSval=1602077634 TSecr=1161167460"
"661","0.000006746","tanvi-HP-Notebook-d585","science-edge-external-prod-73889260.us-west-2.elb.amazonaws.com","TCP","66","59926  >  443 [ACK] Seq=518 Ack=4165 Win=37888 Len=0 TSval=1602077634 TSecr=1161167460"
"663","0.000007258","tanvi-HP-Notebook-d585","science-edge-external-prod-73889260.us-west-2.elb.amazonaws.com","TCP","66","59926  >  443 [ACK] Seq=518 Ack=5296 Win=40704 Len=0 TSval=1602077634 TSecr=1161167460"
"664","0.004661679","cdn.branch.io","tanvi-HP-Notebook-d585","TCP","66","443  >  40598 [ACK] Seq=4785 Ack=644 Win=30208 Len=0 TSval=1071766014 TSecr=3424685497"
"668","0.000334044","tanvi-HP-Notebook-d585","cdn.branch.io","HTTP","583","GET /branch-2.50.2.min.js HTTP/1.1 "
"671","0.026262697","h2.twitch.map.fastly.net","tanvi-HP-Notebook-d585","TLSv1.2","324","New Session Ticket, Change Cipher Spec, Finished"
"672","0.011000600","h2.twitch.map.fastly.net","tanvi-HP-Notebook-d585","TLSv1.2","324","New Session Ticket, Change Cipher Spec, Finished"
"673","0.002256398","h2.twitch.map.fastly.net","tanvi-HP-Notebook-d585","TLSv1.2","324","New Session Ticket, Change Cipher Spec, Finished"
"674","0.002323539","h2.twitch.map.fastly.net","tanvi-HP-Notebook-d585","HTTP2","132","SETTINGS[0], WINDOW_UPDATE[0], SETTINGS[0]"
"675","0.000083383","tanvi-HP-Notebook-d585","h2.twitch.map.fastly.net","TCP","66","54766  >  443 [ACK] Seq=1158 Ack=5246 Win=43520 Len=0 TSval=2744318871 TSecr=812415629"
"677","0.012172510","twitch.map.fastly.net","tanvi-HP-Notebook-d585","TLSv1.2","324","New Session Ticket, Change Cipher Spec, Finished"
"678","0.012544424","tanvi-HP-Notebook-d585","h2.twitch.map.fastly.net","TCP","66","54768  >  443 [ACK] Seq=611 Ack=5180 Win=43520 Len=0 TSval=2744318896 TSecr=966808003"
"679","0.015048238","h2.twitch.map.fastly.net","tanvi-HP-Notebook-d585","TCP","66","443  >  54766 [ACK] Seq=5246 Ack=1158 Win=30720 Len=0 TSval=812415641 TSecr=2744318664"
"680","0.004953100","tanvi-HP-Notebook-d585","h2.twitch.map.fastly.net","TCP","66","54770  >  443 [ACK] Seq=611 Ack=5180 Win=43520 Len=0 TSval=2744318916 TSecr=200097341"
"681","0.008062657","tanvi-HP-Notebook-d585","twitch.map.fastly.net","TCP","66","48148  >  443 [ACK] Seq=611 Ack=5186 Win=43520 Len=0 TSval=957200831 TSecr=811727154"
"682","0.032529752","cdn.branch.io","tanvi-HP-Notebook-d585","HTTP","531","HTTP/1.1 304 Not Modified "
"683","0.032914242","h2.twitch.map.fastly.net","tanvi-HP-Notebook-d585","TLSv1.2","324","New Session Ticket, Change Cipher Spec, Finished"
"684","0.000058115","static.twitchcdn.net","tanvi-HP-Notebook-d585","TLSv1.2","324","New Session Ticket, Change Cipher Spec, Finished"
"685","0.001059305","science-edge-external-prod-73889260.us-west-2.elb.amazonaws.com","tanvi-HP-Notebook-d585","TCP","66","443  >  59938 [ACK] Seq=1 Ack=518 Win=28160 Len=0 TSval=1161167506 TSecr=1602077479"
"687","0.000048757","tanvi-HP-Notebook-d585","science-edge-external-prod-73889260.us-west-2.elb.amazonaws.com","TCP","66","59938  >  443 [ACK] Seq=518 Ack=1389 Win=32128 Len=0 TSval=1602077809 TSecr=1161167506"
"688","0.013264342","tanvi-HP-Notebook-d585","cdn.branch.io","TCP","66","40598  >  443 [ACK] Seq=1161 Ack=5301 Win=43520 Len=0 TSval=3424685768 TSecr=1071766026"
"690","0.000026111","tanvi-HP-Notebook-d585","science-edge-external-prod-73889260.us-west-2.elb.amazonaws.com","TCP","66","59938  >  443 [ACK] Seq=518 Ack=2777 Win=35072 Len=0 TSval=1602077823 TSecr=1161167506"
"692","0.000009835","tanvi-HP-Notebook-d585","science-edge-external-prod-73889260.us-west-2.elb.amazonaws.com","TCP","66","59938  >  443 [ACK] Seq=518 Ack=4165 Win=37888 Len=0 TSval=1602077823 TSecr=1161167506"
"694","0.000005270","tanvi-HP-Notebook-d585","science-edge-external-prod-73889260.us-west-2.elb.amazonaws.com","TCP","66","59938  >  443 [ACK] Seq=518 Ack=5296 Win=40704 Len=0 TSval=1602077823 TSecr=1161167506"
"697","0.014421573","tanvi-HP-Notebook-d585","static.twitchcdn.net","TCP","66","33324  >  443 [ACK] Seq=611 Ack=5186 Win=43520 Len=0 TSval=3063548698 TSecr=858437266"
"698","0.000023535","tanvi-HP-Notebook-d585","h2.twitch.map.fastly.net","TCP","66","54772  >  443 [ACK] Seq=611 Ack=5180 Win=43520 Len=0 TSval=2744319032 TSecr=200097361"
"702","0.014261163","h2.twitch.map.fastly.net","tanvi-HP-Notebook-d585","TCP","66","443  >  54766 [ACK] Seq=5676 Ack=1196 Win=30720 Len=0 TSval=812415679 TSecr=2744318871"
"705","0.022168256","tanvi-HP-Notebook-d585","h2.twitch.map.fastly.net","TCP","66","54766  >  443 [ACK] Seq=1196 Ack=5676 Win=46336 Len=0 TSval=2744319096 TSecr=812415675"
"706","0.010282442","pubsub-edge.chat.twitch.tv","tanvi-HP-Notebook-d585","TCP","66","443  >  38804 [ACK] Seq=1 Ack=518 Win=28160 Len=0 TSval=4079716491 TSecr=3651730501"
