"No.","Time","Source","Destination","Protocol","Length","Info"
"9","0.013002927","www.gstatic.com","tanvi-HP-Notebook.local","TCP","94","443  >  55582 [SYN, ACK] Seq=0 Ack=1 Win=65535 Len=0 MSS=1360 SACK_PERM=1 TSval=340396720 TSecr=1211625596 WS=256"
"10","0.000048187","tanvi-HP-Notebook.local","www.gstatic.com","TCP","86","55582  >  443 [ACK] Seq=1 Ack=1 Win=28800 Len=0 TSval=1211625697 TSecr=340396720"
"12","0.017878728","www.gstatic.com","tanvi-HP-Notebook.local","TCP","94","443  >  55584 [SYN, ACK] Seq=0 Ack=1 Win=65535 Len=0 MSS=1360 SACK_PERM=1 TSval=93056059 TSecr=1211625596 WS=256"
"13","0.000041893","tanvi-HP-Notebook.local","www.gstatic.com","TCP","86","55584  >  443 [ACK] Seq=1 Ack=1 Win=28800 Len=0 TSval=1211625715 TSecr=93056059"
"16","0.032547744","www.gstatic.com","tanvi-HP-Notebook.local","TCP","86","443  >  55582 [ACK] Seq=1 Ack=518 Win=66816 Len=0 TSval=340396820 TSecr=1211625697"
"19","0.011595975","www.gstatic.com","tanvi-HP-Notebook.local","TCP","86","443  >  55584 [ACK] Seq=1 Ack=518 Win=66816 Len=0 TSval=93056160 TSecr=1211625715"
"21","0.000027351","tanvi-HP-Notebook.local","www.gstatic.com","TCP","86","55582  >  443 [ACK] Seq=518 Ack=1209 Win=31232 Len=0 TSval=1211625830 TSecr=340396854"
"23","0.000014431","tanvi-HP-Notebook.local","www.gstatic.com","TCP","86","55582  >  443 [ACK] Seq=518 Ack=2417 Win=33664 Len=0 TSval=1211625830 TSecr=340396854"
"25","0.000084086","tanvi-HP-Notebook.local","www.gstatic.com","TCP","86","55582  >  443 [ACK] Seq=518 Ack=3625 Win=36096 Len=0 TSval=1211625832 TSecr=340396854"
"27","0.000157434","tanvi-HP-Notebook.local","www.gstatic.com","TCP","86","55582  >  443 [ACK] Seq=518 Ack=3781 Win=38528 Len=0 TSval=1211625832 TSecr=340396854"
"30","0.000024508","tanvi-HP-Notebook.local","www.gstatic.com","TCP","86","55584  >  443 [ACK] Seq=518 Ack=1209 Win=31232 Len=0 TSval=1211625860 TSecr=93056193"
"32","0.000016840","tanvi-HP-Notebook.local","www.gstatic.com","TCP","86","55584  >  443 [ACK] Seq=518 Ack=2417 Win=33664 Len=0 TSval=1211625860 TSecr=93056193"
"34","0.000006845","tanvi-HP-Notebook.local","www.gstatic.com","TCP","86","55584  >  443 [ACK] Seq=518 Ack=3625 Win=36096 Len=0 TSval=1211625860 TSecr=93056193"
"36","0.000009676","tanvi-HP-Notebook.local","www.gstatic.com","TCP","86","55584  >  443 [ACK] Seq=518 Ack=3781 Win=38528 Len=0 TSval=1211625860 TSecr=93056193"
"43","0.053045325","update.googleapis.com","tanvi-HP-Notebook.local","TCP","94","443  >  44944 [SYN, ACK] Seq=0 Ack=1 Win=65535 Len=0 MSS=1360 SACK_PERM=1 TSval=1952678543 TSecr=1541801704 WS=256"
"44","0.000048297","tanvi-HP-Notebook.local","update.googleapis.com","TCP","86","44944  >  443 [ACK] Seq=1 Ack=1 Win=28800 Len=0 TSval=1541801822 TSecr=1952678543"
"46","0.019781167","www.gstatic.com","tanvi-HP-Notebook.local","HTTP2","666","SETTINGS[0], WINDOW_UPDATE[0]"
"47","0.000200164","tanvi-HP-Notebook.local","www.gstatic.com","HTTP2","117","SETTINGS[0]"
"48","0.007778397","www.gstatic.com","tanvi-HP-Notebook.local","HTTP2","117","SETTINGS[0]"
"49","0.002157239","www.gstatic.com","tanvi-HP-Notebook.local","TCP","86","443  >  55582 [ACK] Seq=4392 Ack=950 Win=67840 Len=0 TSval=340396975 TSecr=1211625868"
"52","0.000002055","tanvi-HP-Notebook.local","www.gstatic.com","TCP","86","55582  >  443 [ACK] Seq=981 Ack=4757 Win=43392 Len=0 TSval=1211625951 TSecr=340396974"
"56","0.000510003","tanvi-HP-Notebook.local","www.gstatic.com","TCP","86","55582  >  443 [ACK] Seq=981 Ack=5158 Win=45824 Len=0 TSval=1211625952 TSecr=340396976"
"58","0.001306180","www.gstatic.com","tanvi-HP-Notebook.local","HTTP2","666","SETTINGS[0], WINDOW_UPDATE[0]"
"60","0.003726186","www.gstatic.com","tanvi-HP-Notebook.local","TCP","86","443  >  55584 [FIN, ACK] Seq=4361 Ack=583 Win=66816 Len=0 TSval=93056304 TSecr=1211625867"
"66","0.038897713","www.gstatic.com","tanvi-HP-Notebook.local","TCP","86","443  >  55582 [ACK] Seq=5158 Ack=981 Win=67840 Len=0 TSval=340397044 TSecr=1211625941"
"67","0.010551407","www.gstatic.com","tanvi-HP-Notebook.local","TCP","86","443  >  55582 [ACK] Seq=5158 Ack=1020 Win=67840 Len=0 TSval=340397054 TSecr=1211625953"
"68","0.014612910","update.googleapis.com","tanvi-HP-Notebook.local","TCP","86","443  >  44944 [ACK] Seq=1 Ack=518 Win=66816 Len=0 TSval=1952678669 TSecr=1541801822"
"78","0.000024386","tanvi-HP-Notebook.local","update.googleapis.com","TCP","86","44944  >  443 [ACK] Seq=518 Ack=1209 Win=31232 Len=0 TSval=1541802016 TSecr=1952678738"
"80","0.000007054","tanvi-HP-Notebook.local","update.googleapis.com","TCP","86","44944  >  443 [ACK] Seq=518 Ack=2417 Win=33664 Len=0 TSval=1541802016 TSecr=1952678738"
"82","0.000007331","tanvi-HP-Notebook.local","update.googleapis.com","TCP","86","44944  >  443 [ACK] Seq=518 Ack=3069 Win=36096 Len=0 TSval=1541802016 TSecr=1952678738"
"86","0.094537913","accounts.google.com","tanvi-HP-Notebook.local","TCP","94","443  >  55406 [SYN, ACK] Seq=0 Ack=1 Win=65535 Len=0 MSS=1360 SACK_PERM=1 TSval=546096595 TSecr=101173870 WS=256"
"87","0.000031091","tanvi-HP-Notebook.local","accounts.google.com","TCP","86","55406  >  443 [ACK] Seq=1 Ack=1 Win=28800 Len=0 TSval=101174013 TSecr=546096595"
"89","0.004712066","www.google.com","tanvi-HP-Notebook.local","TCP","94","443  >  44880 [SYN, ACK] Seq=0 Ack=1 Win=65535 Len=0 MSS=1360 SACK_PERM=1 TSval=2392754548 TSecr=624013767 WS=256"
"90","0.000041666","tanvi-HP-Notebook.local","www.google.com","TCP","86","44880  >  443 [ACK] Seq=1 Ack=1 Win=28800 Len=0 TSval=624013909 TSecr=2392754548"
"93","0.007864575","update.googleapis.com","tanvi-HP-Notebook.local","TCP","86","443  >  44944 [ACK] Seq=3069 Ack=582 Win=66816 Len=0 TSval=1952678853 TSecr=1541802020"
"95","0.000161100","tanvi-HP-Notebook.local","update.googleapis.com","HTTP2","117","SETTINGS[0]"
"97","0.000154172","update.googleapis.com","tanvi-HP-Notebook.local","TCP","86","443  >  44944 [ACK] Seq=3649 Ack=957 Win=67840 Len=0 TSval=1952678873 TSecr=1541802021"
"105","0.007237975","tanvi-HP-Notebook.local","update.googleapis.com","TCP","86","44944  >  443 [ACK] Seq=988 Ack=3680 Win=38528 Len=0 TSval=1541802200 TSecr=1952678874"
"114","0.010552421","accounts.google.com","tanvi-HP-Notebook.local","TCP","86","443  >  55406 [ACK] Seq=1 Ack=518 Win=66816 Len=0 TSval=546096710 TSecr=101174014"
"115","0.004215915","www.google.com","tanvi-HP-Notebook.local","TCP","86","443  >  44880 [ACK] Seq=1 Ack=518 Win=66816 Len=0 TSval=2392754663 TSecr=624013910"
"116","0.018909365","update.googleapis.com","tanvi-HP-Notebook.local","TCP","86","443  >  44944 [ACK] Seq=3680 Ack=988 Win=67840 Len=0 TSval=1952678972 TSecr=1541802130"
"119","0.000029135","tanvi-HP-Notebook.local","accounts.google.com","TCP","86","55406  >  443 [ACK] Seq=518 Ack=1209 Win=31232 Len=0 TSval=101174202 TSecr=546096783"
"121","0.000006290","tanvi-HP-Notebook.local","www.google.com","TCP","86","44880  >  443 [ACK] Seq=518 Ack=1209 Win=31232 Len=0 TSval=624014093 TSecr=2392754730"
"123","0.000007661","tanvi-HP-Notebook.local","www.google.com","TCP","86","44880  >  443 [ACK] Seq=518 Ack=2417 Win=33664 Len=0 TSval=624014093 TSecr=2392754730"
"125","0.000005739","tanvi-HP-Notebook.local","www.google.com","TCP","86","44880  >  443 [ACK] Seq=518 Ack=2624 Win=36096 Len=0 TSval=624014093 TSecr=2392754730"
"127","0.000005189","tanvi-HP-Notebook.local","accounts.google.com","TCP","86","55406  >  443 [ACK] Seq=518 Ack=2417 Win=33664 Len=0 TSval=101174202 TSecr=546096783"
"129","0.000004718","tanvi-HP-Notebook.local","accounts.google.com","TCP","86","55406  >  443 [ACK] Seq=518 Ack=3049 Win=36096 Len=0 TSval=101174202 TSecr=546096783"
"136","0.000101526","tanvi-HP-Notebook.local","update.googleapis.com","TCP","86","44944  >  443 [ACK] Seq=988 Ack=3949 Win=40960 Len=0 TSval=1541802397 TSecr=1952679108"
"138","0.000030019","tanvi-HP-Notebook.local","update.googleapis.com","TCP","86","44944  >  443 [ACK] Seq=988 Ack=3980 Win=40960 Len=0 TSval=1541802397 TSecr=1952679109"
"140","0.000058307","tanvi-HP-Notebook.local","update.googleapis.com","TCP","86","44944  >  443 [ACK] Seq=988 Ack=4019 Win=40960 Len=0 TSval=1541802397 TSecr=1952679109"
"147","0.007663727","accounts.google.com","tanvi-HP-Notebook.local","TCP","86","443  >  55406 [ACK] Seq=3049 Ack=582 Win=66816 Len=0 TSval=546096900 TSecr=101174205"
"148","0.000000508","www.google.com","tanvi-HP-Notebook.local","TCP","86","443  >  44880 [ACK] Seq=2624 Ack=582 Win=66816 Len=0 TSval=2392754848 TSecr=624014097"
"152","0.038636016","tanvi-HP-Notebook.local","accounts.google.com","TCP","86","55406  >  443 [ACK] Seq=582 Ack=3629 Win=38528 Len=0 TSval=101174362 TSecr=546096900"
"160","0.000025962","update.googleapis.com","tanvi-HP-Notebook.local","TCP","86","443  >  44944 [ACK] Seq=4019 Ack=1027 Win=67840 Len=0 TSval=1952679243 TSecr=1541802400"
"273","0.099989103","oauthaccountmanager.googleapis.com","tanvi-HP-Notebook.local","TCP","94","443  >  47638 [SYN, ACK] Seq=0 Ack=1 Win=65535 Len=0 MSS=1360 SACK_PERM=1 TSval=2930416913 TSecr=2993555509 WS=256"
"274","0.000044430","tanvi-HP-Notebook.local","oauthaccountmanager.googleapis.com","TCP","86","47638  >  443 [ACK] Seq=1 Ack=1 Win=28800 Len=0 TSval=2993555609 TSecr=2930416913"
"288","0.014363373","oauthaccountmanager.googleapis.com","tanvi-HP-Notebook.local","TCP","86","443  >  47638 [ACK] Seq=1 Ack=518 Win=66816 Len=0 TSval=2930417018 TSecr=2993555609"
"290","0.000024693","tanvi-HP-Notebook.local","oauthaccountmanager.googleapis.com","TCP","86","47638  >  443 [ACK] Seq=518 Ack=1209 Win=31232 Len=0 TSval=2993555775 TSecr=2930417078"
"292","0.000007139","tanvi-HP-Notebook.local","oauthaccountmanager.googleapis.com","TCP","86","47638  >  443 [ACK] Seq=518 Ack=2417 Win=33664 Len=0 TSval=2993555775 TSecr=2930417078"
"294","0.000007925","tanvi-HP-Notebook.local","oauthaccountmanager.googleapis.com","TCP","86","47638  >  443 [ACK] Seq=518 Ack=3068 Win=36096 Len=0 TSval=2993555775 TSecr=2930417078"
"304","0.038788649","oauthaccountmanager.googleapis.com","tanvi-HP-Notebook.local","TCP","86","443  >  47638 [ACK] Seq=3068 Ack=582 Win=66816 Len=0 TSval=2930417183 TSecr=2993555777"
"307","0.030873846","tanvi-HP-Notebook.local","oauthaccountmanager.googleapis.com","TCP","86","47638  >  443 [ACK] Seq=582 Ack=3648 Win=38528 Len=0 TSval=2993555924 TSecr=2930417183"
"331","0.003415607","twitch.map.fastly.net","tanvi-HP-Notebook-d18b","TCP","74","443  >  48898 [SYN, ACK] Seq=0 Ack=1 Win=28160 Len=0 MSS=1400 SACK_PERM=1 TSval=1925155950 TSecr=1099549661 WS=512"
"332","0.000036214","tanvi-HP-Notebook-d18b","twitch.map.fastly.net","TCP","66","48898  >  443 [ACK] Seq=1 Ack=1 Win=29312 Len=0 TSval=1099549888 TSecr=1925155950"
"334","0.032483485","twitch.map.fastly.net","tanvi-HP-Notebook-d18b","TCP","74","443  >  48900 [SYN, ACK] Seq=0 Ack=1 Win=28160 Len=0 MSS=1400 SACK_PERM=1 TSval=970739692 TSecr=1099549661 WS=512"
"335","0.000100134","tanvi-HP-Notebook-d18b","twitch.map.fastly.net","TCP","66","48900  >  443 [ACK] Seq=1 Ack=1 Win=29312 Len=0 TSval=1099549921 TSecr=970739692"
"337","0.016105051","twitch.map.fastly.net","tanvi-HP-Notebook-d18b","TCP","74","443  >  48902 [SYN, ACK] Seq=0 Ack=1 Win=28160 Len=0 MSS=1400 SACK_PERM=1 TSval=863461503 TSecr=1099549714 WS=512"
"338","0.000046543","tanvi-HP-Notebook-d18b","twitch.map.fastly.net","TCP","66","48902  >  443 [ACK] Seq=1 Ack=1 Win=29312 Len=0 TSval=1099549938 TSecr=863461503"
"340","0.159133339","twitch.map.fastly.net","tanvi-HP-Notebook-d18b","TCP","66","443  >  48898 [ACK] Seq=1 Ack=518 Win=29696 Len=0 TSval=1925156002 TSecr=1099549889"
"342","0.000020673","tanvi-HP-Notebook-d18b","twitch.map.fastly.net","TCP","66","48898  >  443 [ACK] Seq=518 Ack=1389 Win=32128 Len=0 TSval=1099550102 TSecr=1925156002"
"344","0.000010787","tanvi-HP-Notebook-d18b","twitch.map.fastly.net","TCP","66","48898  >  443 [ACK] Seq=518 Ack=2777 Win=35072 Len=0 TSval=1099550102 TSecr=1925156002"
"346","0.000008884","tanvi-HP-Notebook-d18b","twitch.map.fastly.net","TCP","66","48898  >  443 [ACK] Seq=518 Ack=4165 Win=37888 Len=0 TSval=1099550102 TSecr=1925156002"
"348","0.000005748","tanvi-HP-Notebook-d18b","twitch.map.fastly.net","TCP","66","48898  >  443 [ACK] Seq=518 Ack=4928 Win=40704 Len=0 TSval=1099550102 TSecr=1925156002"
"351","0.046442424","twitch.map.fastly.net","tanvi-HP-Notebook-d18b","TCP","66","443  >  48900 [ACK] Seq=1 Ack=518 Win=29696 Len=0 TSval=970739749 TSecr=1099549921"
"353","0.000013066","tanvi-HP-Notebook-d18b","twitch.map.fastly.net","TCP","66","48900  >  443 [ACK] Seq=518 Ack=1389 Win=32128 Len=0 TSval=1099550152 TSecr=970739750"
"355","0.000008738","tanvi-HP-Notebook-d18b","twitch.map.fastly.net","TCP","66","48900  >  443 [ACK] Seq=518 Ack=2777 Win=35072 Len=0 TSval=1099550152 TSecr=970739750"
"357","0.000007065","tanvi-HP-Notebook-d18b","twitch.map.fastly.net","TCP","66","48900  >  443 [ACK] Seq=518 Ack=4165 Win=37888 Len=0 TSval=1099550154 TSecr=970739750"
"359","0.000005936","tanvi-HP-Notebook-d18b","twitch.map.fastly.net","TCP","66","48900  >  443 [ACK] Seq=518 Ack=4928 Win=40704 Len=0 TSval=1099550154 TSecr=970739750"
"361","0.006656155","twitch.map.fastly.net","tanvi-HP-Notebook-d18b","TCP","66","443  >  48902 [ACK] Seq=1 Ack=518 Win=29696 Len=0 TSval=863461559 TSecr=1099549938"
"363","0.000061473","tanvi-HP-Notebook-d18b","twitch.map.fastly.net","TCP","66","48902  >  443 [ACK] Seq=518 Ack=1389 Win=32128 Len=0 TSval=1099550176 TSecr=863461559"
"365","0.000018703","tanvi-HP-Notebook-d18b","twitch.map.fastly.net","TCP","66","48902  >  443 [ACK] Seq=518 Ack=2777 Win=35072 Len=0 TSval=1099550176 TSecr=863461559"
"368","0.000011251","tanvi-HP-Notebook-d18b","twitch.map.fastly.net","TCP","66","48902  >  443 [ACK] Seq=518 Ack=4165 Win=37888 Len=0 TSval=1099550176 TSecr=863461559"
"369","0.000014880","tanvi-HP-Notebook-d18b","twitch.map.fastly.net","TCP","66","48902  >  443 [ACK] Seq=518 Ack=4928 Win=40704 Len=0 TSval=1099550176 TSecr=863461559"
"371","0.130616770","twitch.map.fastly.net","tanvi-HP-Notebook-d18b","TCP","66","443  >  48898 [ACK] Seq=4928 Ack=1325 Win=30720 Len=0 TSval=1925156055 TSecr=1099550105"
"375","0.000048363","tanvi-HP-Notebook-d18b","twitch.map.fastly.net","TCP","66","48898  >  443 [ACK] Seq=1325 Ack=6087 Win=46336 Len=0 TSval=1099550332 TSecr=1925156055"
"378","0.000009985","tanvi-HP-Notebook-d18b","twitch.map.fastly.net","TCP","66","48898  >  443 [ACK] Seq=1325 Ack=8863 Win=52096 Len=0 TSval=1099550332 TSecr=1925156062"
"381","0.000008464","tanvi-HP-Notebook-d18b","twitch.map.fastly.net","TCP","66","48898  >  443 [ACK] Seq=1325 Ack=10263 Win=54912 Len=0 TSval=1099550333 TSecr=1925156062"
"384","0.000005484","tanvi-HP-Notebook-d18b","twitch.map.fastly.net","TCP","66","48898  >  443 [ACK] Seq=1325 Ack=11663 Win=57856 Len=0 TSval=1099550333 TSecr=1925156062"
"386","0.046244200","tanvi-HP-Notebook-d18b","twitch.map.fastly.net","TCP","66","48898  >  443 [ACK] Seq=1325 Ack=13051 Win=60800 Len=0 TSval=1099550379 TSecr=1925156062"
"395","0.006537141","twitch.map.fastly.net","tanvi-HP-Notebook-d18b","TLSv1.2","324","New Session Ticket, Change Cipher Spec, Finished"
"396","0.018298936","twitch.map.fastly.net","tanvi-HP-Notebook-d18b","TLSv1.2","324","New Session Ticket, Change Cipher Spec, Finished"
"400","0.001990671","tanvi-HP-Notebook-d18b","twitch.map.fastly.net","TCP","66","48900  >  443 [ACK] Seq=611 Ack=5186 Win=43520 Len=0 TSval=1099550431 TSecr=970739808"
"401","0.019952327","tanvi-HP-Notebook-d18b","twitch.map.fastly.net","TCP","66","48902  >  443 [ACK] Seq=611 Ack=5186 Win=43520 Len=0 TSval=1099550451 TSecr=863461620"
"418","0.000022238","tanvi-HP-Notebook-d18b","twitch.map.fastly.net","TCP","66","48898  >  443 [ACK] Seq=1325 Ack=14439 Win=63616 Len=0 TSval=1099550533 TSecr=1925156109"
"420","0.000008984","tanvi-HP-Notebook-d18b","twitch.map.fastly.net","TCP","66","48898  >  443 [ACK] Seq=1325 Ack=15827 Win=66560 Len=0 TSval=1099550533 TSecr=1925156109"
"422","0.000008317","tanvi-HP-Notebook-d18b","twitch.map.fastly.net","TCP","66","48898  >  443 [ACK] Seq=1325 Ack=17215 Win=69504 Len=0 TSval=1099550533 TSecr=1925156109"
"424","0.000009788","tanvi-HP-Notebook-d18b","twitch.map.fastly.net","TCP","66","48898  >  443 [ACK] Seq=1325 Ack=18603 Win=72320 Len=0 TSval=1099550533 TSecr=1925156109"
"426","0.000006686","tanvi-HP-Notebook-d18b","twitch.map.fastly.net","TCP","66","48898  >  443 [ACK] Seq=1325 Ack=19991 Win=75264 Len=0 TSval=1099550533 TSecr=1925156109"
"428","0.000009239","tanvi-HP-Notebook-d18b","twitch.map.fastly.net","TCP","66","48898  >  443 [ACK] Seq=1325 Ack=21379 Win=78080 Len=0 TSval=1099550534 TSecr=1925156109"
"430","0.000005503","tanvi-HP-Notebook-d18b","twitch.map.fastly.net","TCP","66","48898  >  443 [ACK] Seq=1325 Ack=22767 Win=81024 Len=0 TSval=1099550534 TSecr=1925156109"
"432","0.000007207","tanvi-HP-Notebook-d18b","twitch.map.fastly.net","TCP","66","48898  >  443 [ACK] Seq=1325 Ack=24155 Win=83968 Len=0 TSval=1099550535 TSecr=1925156109"
"434","0.000005393","tanvi-HP-Notebook-d18b","twitch.map.fastly.net","TCP","66","48898  >  443 [ACK] Seq=1325 Ack=25543 Win=86784 Len=0 TSval=1099550535 TSecr=1925156109"
"436","0.000008615","tanvi-HP-Notebook-d18b","twitch.map.fastly.net","TCP","66","48898  >  443 [ACK] Seq=1325 Ack=26931 Win=89728 Len=0 TSval=1099550535 TSecr=1925156109"
"438","0.000004791","tanvi-HP-Notebook-d18b","twitch.map.fastly.net","TCP","66","48898  >  443 [ACK] Seq=1325 Ack=28319 Win=92672 Len=0 TSval=1099550535 TSecr=1925156110"
"440","0.000004390","tanvi-HP-Notebook-d18b","twitch.map.fastly.net","TCP","66","48898  >  443 [ACK] Seq=1325 Ack=29707 Win=95488 Len=0 TSval=1099550535 TSecr=1925156110"
"442","0.000005992","tanvi-HP-Notebook-d18b","twitch.map.fastly.net","TCP","66","48898  >  443 [ACK] Seq=1325 Ack=31095 Win=98432 Len=0 TSval=1099550535 TSecr=1925156110"
"444","0.000005670","tanvi-HP-Notebook-d18b","twitch.map.fastly.net","TCP","66","48898  >  443 [ACK] Seq=1325 Ack=32483 Win=101248 Len=0 TSval=1099550536 TSecr=1925156110"
"446","0.000021959","tanvi-HP-Notebook-d18b","twitch.map.fastly.net","TCP","66","48898  >  443 [ACK] Seq=1325 Ack=33497 Win=104064 Len=0 TSval=1099550548 TSecr=1925156116"
"447","0.016035801","safebrowsing.googleapis.com","tanvi-HP-Notebook.local","TCP","94","443  >  42560 [SYN, ACK] Seq=0 Ack=1 Win=65535 Len=0 MSS=1360 SACK_PERM=1 TSval=104410477 TSecr=3814050097 WS=256"
"448","0.000127465","tanvi-HP-Notebook.local","safebrowsing.googleapis.com","TCP","86","42560  >  443 [ACK] Seq=1 Ack=1 Win=28800 Len=0 TSval=3814050182 TSecr=104410477"
"468","0.045960524","safebrowsing.googleapis.com","tanvi-HP-Notebook.local","TCP","86","443  >  42560 [ACK] Seq=1 Ack=518 Win=66816 Len=0 TSval=104410578 TSecr=3814050182"
"486","0.000030742","tanvi-HP-Notebook.local","safebrowsing.googleapis.com","TCP","86","42560  >  443 [ACK] Seq=518 Ack=1209 Win=31232 Len=0 TSval=3814050342 TSecr=104410637"
"488","0.000011857","tanvi-HP-Notebook.local","safebrowsing.googleapis.com","TCP","86","42560  >  443 [ACK] Seq=518 Ack=2417 Win=33664 Len=0 TSval=3814050342 TSecr=104410637"
"490","0.000006314","tanvi-HP-Notebook.local","safebrowsing.googleapis.com","TCP","86","42560  >  443 [ACK] Seq=518 Ack=3068 Win=36096 Len=0 TSval=3814050342 TSecr=104410637"
"500","0.008542895","twitch.map.fastly.net","tanvi-HP-Notebook-d18b","TCP","74","443  >  48912 [SYN, ACK] Seq=0 Ack=1 Win=28160 Len=0 MSS=1400 SACK_PERM=1 TSval=864146235 TSecr=1099550599 WS=512"
"501","0.000041052","tanvi-HP-Notebook-d18b","twitch.map.fastly.net","TCP","66","48912  >  443 [ACK] Seq=1 Ack=1 Win=29312 Len=0 TSval=1099550795 TSecr=864146235"
"502","0.000063086","h2.twitch.map.fastly.net","tanvi-HP-Notebook-d18b","TCP","74","443  >  46574 [SYN, ACK] Seq=0 Ack=1 Win=28160 Len=0 MSS=1400 SACK_PERM=1 TSval=862758658 TSecr=4253825805 WS=512"
"503","0.000012465","tanvi-HP-Notebook-d18b","h2.twitch.map.fastly.net","TCP","66","46574  >  443 [ACK] Seq=1 Ack=1 Win=29312 Len=0 TSval=4253826003 TSecr=862758658"
"508","0.001409973","h2.twitch.map.fastly.net","tanvi-HP-Notebook-d18b","TCP","74","443  >  46580 [SYN, ACK] Seq=0 Ack=1 Win=28160 Len=0 MSS=1400 SACK_PERM=1 TSval=865528792 TSecr=4253825823 WS=512"
"509","0.000040881","tanvi-HP-Notebook-d18b","h2.twitch.map.fastly.net","TCP","66","46580  >  443 [ACK] Seq=1 Ack=1 Win=29312 Len=0 TSval=4253826020 TSecr=865528792"
"511","0.000120922","h2.twitch.map.fastly.net","tanvi-HP-Notebook-d18b","TCP","74","443  >  46576 [SYN, ACK] Seq=0 Ack=1 Win=28160 Len=0 MSS=1400 SACK_PERM=1 TSval=972277657 TSecr=4253825805 WS=512"
"512","0.000070980","tanvi-HP-Notebook-d18b","h2.twitch.map.fastly.net","TCP","66","46576  >  443 [ACK] Seq=1 Ack=1 Win=29312 Len=0 TSval=4253826021 TSecr=972277657"
"517","0.007547844","safebrowsing.googleapis.com","tanvi-HP-Notebook.local","TCP","86","443  >  42560 [ACK] Seq=3068 Ack=582 Win=66816 Len=0 TSval=104410747 TSecr=3814050352"
"518","0.000027706","e9221.i.akamaiedge.net","tanvi-HP-Notebook-d18b","TCP","74","443  >  36184 [SYN, ACK] Seq=0 Ack=1 Win=28960 Len=0 MSS=1400 SACK_PERM=1 TSval=16622432 TSecr=1735075105 WS=128"
"519","0.000030254","tanvi-HP-Notebook-d18b","e9221.i.akamaiedge.net","TCP","66","36184  >  443 [ACK] Seq=1 Ack=1 Win=29312 Len=0 TSval=1735075198 TSecr=16622432"
"522","0.000125066","tanvi-HP-Notebook.local","safebrowsing.googleapis.com","HTTP2","117","SETTINGS[0]"
"523","0.003751122","safebrowsing.googleapis.com","tanvi-HP-Notebook.local","HTTP2","117","SETTINGS[0]"
"525","0.001951638","safebrowsing.googleapis.com","tanvi-HP-Notebook.local","TCP","86","443  >  42560 [ACK] Seq=3679 Ack=1481 Win=68352 Len=0 TSval=104410756 TSecr=3814050352"
"526","0.000122606","science-edge-external-prod-73889260.us-west-2.elb.amazonaws.com","tanvi-HP-Notebook-d18b","TCP","74","443  >  51202 [SYN, ACK] Seq=0 Ack=1 Win=26847 Len=0 MSS=1400 SACK_PERM=1 TSval=490562146 TSecr=4092053851 WS=256"
"527","0.000105939","tanvi-HP-Notebook-d18b","science-edge-external-prod-73889260.us-west-2.elb.amazonaws.com","TCP","66","51202  >  443 [ACK] Seq=1 Ack=1 Win=29312 Len=0 TSval=4092054177 TSecr=490562146"
"530","0.010512262","cdn.branch.io","tanvi-HP-Notebook-d18b","TCP","74","443  >  60922 [SYN, ACK] Seq=0 Ack=1 Win=28960 Len=0 MSS=1400 SACK_PERM=1 TSval=1174659531 TSecr=2890185380 WS=256"
"531","0.000040545","tanvi-HP-Notebook-d18b","cdn.branch.io","TCP","66","60922  >  443 [ACK] Seq=1 Ack=1 Win=29312 Len=0 TSval=2890185465 TSecr=1174659531"
"533","0.015972573","h2.twitch.map.fastly.net","tanvi-HP-Notebook-d18b","TCP","74","443  >  46582 [SYN, ACK] Seq=0 Ack=1 Win=28160 Len=0 MSS=1400 SACK_PERM=1 TSval=1942903449 TSecr=4253825882 WS=512"
"534","0.000038072","tanvi-HP-Notebook-d18b","h2.twitch.map.fastly.net","TCP","66","46582  >  443 [ACK] Seq=1 Ack=1 Win=29312 Len=0 TSval=4253826079 TSecr=1942903449"
"536","0.010384531","tanvi-HP-Notebook.local","safebrowsing.googleapis.com","TCP","86","42560  >  443 [ACK] Seq=1512 Ack=3679 Win=38528 Len=0 TSval=3814050501 TSecr=104410752"
"538","0.000043535","tanvi-HP-Notebook.local","safebrowsing.googleapis.com","TCP","86","42560  >  443 [ACK] Seq=1512 Ack=3996 Win=40960 Len=0 TSval=3814050520 TSecr=104410815"
"540","0.000006338","tanvi-HP-Notebook.local","safebrowsing.googleapis.com","TCP","86","42560  >  443 [ACK] Seq=1512 Ack=4544 Win=43392 Len=0 TSval=3814050520 TSecr=104410815"
"542","0.000005560","tanvi-HP-Notebook.local","safebrowsing.googleapis.com","TCP","86","42560  >  443 [ACK] Seq=1512 Ack=4583 Win=43392 Len=0 TSval=3814050520 TSecr=104410815"
"544","0.026126426","e9221.i.akamaiedge.net","tanvi-HP-Notebook-d18b","TCP","66","443  >  36184 [ACK] Seq=1 Ack=518 Win=30080 Len=0 TSval=16622527 TSecr=1735075199"
"546","0.000087628","tanvi-HP-Notebook-d18b","e9221.i.akamaiedge.net","TCP","66","36184  >  443 [ACK] Seq=518 Ack=1389 Win=32128 Len=0 TSval=1735075297 TSecr=16622528"
"548","0.000139550","tanvi-HP-Notebook-d18b","e9221.i.akamaiedge.net","TCP","66","36184  >  443 [ACK] Seq=518 Ack=2777 Win=35072 Len=0 TSval=1735075297 TSecr=16622528"
"550","0.000162392","tanvi-HP-Notebook-d18b","e9221.i.akamaiedge.net","TCP","66","36184  >  443 [ACK] Seq=518 Ack=4038 Win=37888 Len=0 TSval=1735075297 TSecr=16622528"
"551","0.001005944","safebrowsing.googleapis.com","tanvi-HP-Notebook.local","TCP","86","443  >  42560 [ACK] Seq=4583 Ack=1512 Win=68352 Len=0 TSval=104410848 TSecr=3814050453"
"553","0.005195936","cdn.branch.io","tanvi-HP-Notebook-d18b","TCP","66","443  >  60922 [ACK] Seq=1 Ack=518 Win=30208 Len=0 TSval=1174659540 TSecr=2890185465"
"555","0.000015171","tanvi-HP-Notebook-d18b","cdn.branch.io","TCP","66","60922  >  443 [ACK] Seq=518 Ack=1389 Win=32128 Len=0 TSval=2890185551 TSecr=1174659540"
"557","0.000008592","tanvi-HP-Notebook-d18b","cdn.branch.io","TCP","66","60922  >  443 [ACK] Seq=518 Ack=2777 Win=35072 Len=0 TSval=2890185551 TSecr=1174659540"
"559","0.000006426","tanvi-HP-Notebook-d18b","cdn.branch.io","TCP","66","60922  >  443 [ACK] Seq=518 Ack=4165 Win=37888 Len=0 TSval=2890185551 TSecr=1174659540"
"561","0.000028149","tanvi-HP-Notebook-d18b","cdn.branch.io","TCP","66","60922  >  443 [ACK] Seq=518 Ack=4785 Win=40704 Len=0 TSval=2890185578 TSecr=1174659540"
"563","0.023393615","safebrowsing.googleapis.com","tanvi-HP-Notebook.local","TCP","86","443  >  42560 [ACK] Seq=4583 Ack=1551 Win=68352 Len=0 TSval=104410912 TSecr=3814050521"
"564","0.000056463","twitch.map.fastly.net","tanvi-HP-Notebook-d18b","TCP","66","443  >  48912 [ACK] Seq=1 Ack=518 Win=29696 Len=0 TSval=864146286 TSecr=1099550796"
"566","0.000114412","tanvi-HP-Notebook-d18b","twitch.map.fastly.net","TCP","66","48912  >  443 [ACK] Seq=518 Ack=1389 Win=32128 Len=0 TSval=1099550998 TSecr=864146286"
"568","0.000190403","tanvi-HP-Notebook-d18b","twitch.map.fastly.net","TCP","66","48912  >  443 [ACK] Seq=518 Ack=2777 Win=35072 Len=0 TSval=1099550998 TSecr=864146286"
"570","0.000017487","tanvi-HP-Notebook-d18b","twitch.map.fastly.net","TCP","66","48912  >  443 [ACK] Seq=518 Ack=4165 Win=37888 Len=0 TSval=1099550998 TSecr=864146286"
"572","0.000053419","tanvi-HP-Notebook-d18b","twitch.map.fastly.net","TCP","66","48912  >  443 [ACK] Seq=518 Ack=4928 Win=40704 Len=0 TSval=1099550998 TSecr=864146286"
"573","0.005001034","h2.twitch.map.fastly.net","tanvi-HP-Notebook-d18b","TCP","66","443  >  46574 [ACK] Seq=1 Ack=518 Win=29696 Len=0 TSval=862758710 TSecr=4253826003"
"576","0.000015744","tanvi-HP-Notebook-d18b","h2.twitch.map.fastly.net","TCP","66","46574  >  443 [ACK] Seq=518 Ack=1389 Win=32128 Len=0 TSval=4253826213 TSecr=862758711"
"578","0.000007853","tanvi-HP-Notebook-d18b","h2.twitch.map.fastly.net","TCP","66","46574  >  443 [ACK] Seq=518 Ack=2777 Win=35072 Len=0 TSval=4253826213 TSecr=862758711"
"580","0.000006686","tanvi-HP-Notebook-d18b","h2.twitch.map.fastly.net","TCP","66","46574  >  443 [ACK] Seq=518 Ack=4165 Win=37888 Len=0 TSval=4253826213 TSecr=862758711"
"582","0.000005717","tanvi-HP-Notebook-d18b","h2.twitch.map.fastly.net","TCP","66","46574  >  443 [ACK] Seq=518 Ack=4922 Win=40704 Len=0 TSval=4253826213 TSecr=862758711"
"583","0.001502029","science-edge-external-prod-73889260.us-west-2.elb.amazonaws.com","tanvi-HP-Notebook-d18b","TCP","74","443  >  51214 [SYN, ACK] Seq=0 Ack=1 Win=26847 Len=0 MSS=1400 SACK_PERM=1 TSval=490562190 TSecr=4092054012 WS=256"
"584","0.000032784","tanvi-HP-Notebook-d18b","science-edge-external-prod-73889260.us-west-2.elb.amazonaws.com","TCP","66","51214  >  443 [ACK] Seq=1 Ack=1 Win=29312 Len=0 TSval=4092054340 TSecr=490562190"
"589","0.008900349","h2.twitch.map.fastly.net","tanvi-HP-Notebook-d18b","TCP","66","443  >  46580 [ACK] Seq=1 Ack=518 Win=29696 Len=0 TSval=865528844 TSecr=4253826022"
"591","0.000015278","tanvi-HP-Notebook-d18b","h2.twitch.map.fastly.net","TCP","66","46580  >  443 [ACK] Seq=518 Ack=1389 Win=32128 Len=0 TSval=4253826232 TSecr=865528844"
"593","0.000010366","tanvi-HP-Notebook-d18b","h2.twitch.map.fastly.net","TCP","66","46580  >  443 [ACK] Seq=518 Ack=2777 Win=35072 Len=0 TSval=4253826232 TSecr=865528844"
"595","0.000006936","tanvi-HP-Notebook-d18b","h2.twitch.map.fastly.net","TCP","66","46580  >  443 [ACK] Seq=518 Ack=4165 Win=37888 Len=0 TSval=4253826232 TSecr=865528844"
"597","0.000012582","tanvi-HP-Notebook-d18b","h2.twitch.map.fastly.net","TCP","66","46580  >  443 [ACK] Seq=518 Ack=4922 Win=40704 Len=0 TSval=4253826232 TSecr=865528844"
"599","0.009376015","h2.twitch.map.fastly.net","tanvi-HP-Notebook-d18b","TCP","66","443  >  46576 [ACK] Seq=1 Ack=518 Win=29696 Len=0 TSval=972277715 TSecr=4253826022"
"601","0.000107740","tanvi-HP-Notebook-d18b","h2.twitch.map.fastly.net","TCP","66","46576  >  443 [ACK] Seq=518 Ack=1389 Win=32128 Len=0 TSval=4253826254 TSecr=972277715"
"603","0.000026964","tanvi-HP-Notebook-d18b","h2.twitch.map.fastly.net","TCP","66","46576  >  443 [ACK] Seq=518 Ack=2777 Win=35072 Len=0 TSval=4253826255 TSecr=972277715"
"605","0.000050627","tanvi-HP-Notebook-d18b","h2.twitch.map.fastly.net","TCP","66","46576  >  443 [ACK] Seq=518 Ack=4165 Win=37888 Len=0 TSval=4253826255 TSecr=972277715"
"607","0.000070152","tanvi-HP-Notebook-d18b","h2.twitch.map.fastly.net","TCP","66","46576  >  443 [ACK] Seq=518 Ack=4922 Win=40704 Len=0 TSval=4253826255 TSecr=972277715"
"609","0.000837038","e9221.i.akamaiedge.net","tanvi-HP-Notebook-d18b","TLSv1.3","337","New Session Ticket"
"611","0.000043710","tanvi-HP-Notebook-d18b","e9221.i.akamaiedge.net","TCP","66","36184  >  443 [ACK] Seq=598 Ack=4580 Win=43392 Len=0 TSval=1735075417 TSecr=16622651"
"612","0.024130841","h2.twitch.map.fastly.net","tanvi-HP-Notebook-d18b","TCP","66","443  >  46582 [ACK] Seq=1 Ack=518 Win=29696 Len=0 TSval=1942903500 TSecr=4253826079"
"614","0.000086575","tanvi-HP-Notebook-d18b","h2.twitch.map.fastly.net","TCP","66","46582  >  443 [ACK] Seq=518 Ack=1389 Win=32128 Len=0 TSval=4253826283 TSecr=1942903501"
"615","0.000068378","cdn.branch.io","tanvi-HP-Notebook-d18b","TCP","66","443  >  60922 [ACK] Seq=4785 Ack=644 Win=30208 Len=0 TSval=1174659553 TSecr=2890185583"
"617","0.001344169","tanvi-HP-Notebook-d18b","cdn.branch.io","HTTP","593","GET /branch-2.50.2.min.js HTTP/1.1 "
"619","0.000022184","tanvi-HP-Notebook-d18b","h2.twitch.map.fastly.net","TCP","66","46582  >  443 [ACK] Seq=518 Ack=2777 Win=35072 Len=0 TSval=4253826286 TSecr=1942903501"
"621","0.000006013","tanvi-HP-Notebook-d18b","h2.twitch.map.fastly.net","TCP","66","46582  >  443 [ACK] Seq=518 Ack=4165 Win=37888 Len=0 TSval=4253826286 TSecr=1942903501"
"623","0.000005542","tanvi-HP-Notebook-d18b","h2.twitch.map.fastly.net","TCP","66","46582  >  443 [ACK] Seq=518 Ack=4922 Win=40704 Len=0 TSval=4253826286 TSecr=1942903501"
"625","0.000621616","static.twitchcdn.net","tanvi-HP-Notebook-d18b","TCP","74","443  >  47038 [SYN, ACK] Seq=0 Ack=1 Win=28160 Len=0 MSS=1400 SACK_PERM=1 TSval=14649430 TSecr=1343885936 WS=512"
"626","0.000117450","tanvi-HP-Notebook-d18b","static.twitchcdn.net","TCP","66","47038  >  443 [ACK] Seq=1 Ack=1 Win=29312 Len=0 TSval=1343886172 TSecr=14649430"
"629","0.044042149","pubsub-edge.chat.twitch.tv","tanvi-HP-Notebook-d18b","TCP","74","443  >  47836 [SYN, ACK] Seq=0 Ack=1 Win=26847 Len=0 MSS=1400 SACK_PERM=1 TSval=1684536230 TSecr=1880390236 WS=256"
"630","0.000232918","tanvi-HP-Notebook-d18b","pubsub-edge.chat.twitch.tv","TCP","66","47836  >  443 [ACK] Seq=1 Ack=1 Win=29312 Len=0 TSval=1880390581 TSecr=1684536230"
"632","0.010559826","cdn.branch.io","tanvi-HP-Notebook-d18b","HTTP","530","HTTP/1.1 304 Not Modified "
"633","0.011103919","science-edge-external-prod-73889260.us-west-2.elb.amazonaws.com","tanvi-HP-Notebook-d18b","TCP","66","443  >  51202 [ACK] Seq=1 Ack=518 Win=28160 Len=0 TSval=490562231 TSecr=4092054178"
"636","0.000022764","tanvi-HP-Notebook-d18b","science-edge-external-prod-73889260.us-west-2.elb.amazonaws.com","TCP","66","51202  >  443 [ACK] Seq=518 Ack=1389 Win=32128 Len=0 TSval=4092054518 TSecr=490562231"
"638","0.000007510","tanvi-HP-Notebook-d18b","science-edge-external-prod-73889260.us-west-2.elb.amazonaws.com","TCP","66","51202  >  443 [ACK] Seq=518 Ack=2777 Win=35072 Len=0 TSval=4092054519 TSecr=490562231"
"640","0.000006581","tanvi-HP-Notebook-d18b","science-edge-external-prod-73889260.us-west-2.elb.amazonaws.com","TCP","66","51202  >  443 [ACK] Seq=518 Ack=4165 Win=37888 Len=0 TSval=4092054519 TSecr=490562231"
"642","0.000007583","tanvi-HP-Notebook-d18b","science-edge-external-prod-73889260.us-west-2.elb.amazonaws.com","TCP","66","51202  >  443 [ACK] Seq=518 Ack=5296 Win=40704 Len=0 TSval=4092054519 TSecr=490562231"
"647","0.016217974","twitch.map.fastly.net","tanvi-HP-Notebook-d18b","TLSv1.2","324","New Session Ticket, Change Cipher Spec, Finished"
"648","0.011081145","h2.twitch.map.fastly.net","tanvi-HP-Notebook-d18b","TLSv1.2","324","New Session Ticket, Change Cipher Spec, Finished"
"649","0.004599080","h2.twitch.map.fastly.net","tanvi-HP-Notebook-d18b","TCP","66","443  >  46574 [ACK] Seq=5180 Ack=1172 Win=30720 Len=0 TSval=862758765 TSecr=4253826222"
"651","0.000054671","tanvi-HP-Notebook-d18b","h2.twitch.map.fastly.net","TCP","66","46574  >  443 [ACK] Seq=1172 Ack=5246 Win=43520 Len=0 TSval=4253826430 TSecr=862758764"
"653","0.003810792","tanvi-HP-Notebook-d18b","cdn.branch.io","TCP","66","60922  >  443 [ACK] Seq=1171 Ack=5300 Win=43520 Len=0 TSval=2890185836 TSecr=1174659563"
"654","0.015762695","h2.twitch.map.fastly.net","tanvi-HP-Notebook-d18b","TLSv1.2","324","New Session Ticket, Change Cipher Spec, Finished"
"655","0.008187305","tanvi-HP-Notebook-d18b","twitch.map.fastly.net","TCP","66","48912  >  443 [ACK] Seq=611 Ack=5186 Win=43520 Len=0 TSval=1099551251 TSecr=864146338"
"657","0.029953688","h2.twitch.map.fastly.net","tanvi-HP-Notebook-d18b","TLSv1.2","324","New Session Ticket, Change Cipher Spec, Finished"
"658","0.001067595","tanvi-HP-Notebook-d18b","h2.twitch.map.fastly.net","TCP","66","46580  >  443 [ACK] Seq=611 Ack=5180 Win=43520 Len=0 TSval=4253826490 TSecr=865528899"
"659","0.008914032","h2.twitch.map.fastly.net","tanvi-HP-Notebook-d18b","TLSv1.2","324","New Session Ticket, Change Cipher Spec, Finished"
"662","0.022160980","static.twitchcdn.net","tanvi-HP-Notebook-d18b","TCP","66","443  >  47038 [ACK] Seq=1 Ack=518 Win=29696 Len=0 TSval=14649490 TSecr=1343886173"
"664","0.000034113","tanvi-HP-Notebook-d18b","static.twitchcdn.net","TCP","66","47038  >  443 [ACK] Seq=518 Ack=1389 Win=32128 Len=0 TSval=1343886413 TSecr=14649490"
"665","0.000499829","tanvi-HP-Notebook-d18b","h2.twitch.map.fastly.net","TCP","66","46576  >  443 [ACK] Seq=611 Ack=5180 Win=43520 Len=0 TSval=4253826530 TSecr=972277773"
"667","0.000024086","tanvi-HP-Notebook-d18b","static.twitchcdn.net","TCP","66","47038  >  443 [ACK] Seq=518 Ack=2777 Win=35072 Len=0 TSval=1343886417 TSecr=14649490"
"669","0.000009686","tanvi-HP-Notebook-d18b","static.twitchcdn.net","TCP","66","47038  >  443 [ACK] Seq=518 Ack=4165 Win=37888 Len=0 TSval=1343886417 TSecr=14649490"
"671","0.000022721","tanvi-HP-Notebook-d18b","static.twitchcdn.net","TCP","66","47038  >  443 [ACK] Seq=518 Ack=4928 Win=40704 Len=0 TSval=1343886417 TSecr=14649490"
"673","0.002180645","tanvi-HP-Notebook-d18b","h2.twitch.map.fastly.net","TCP","66","46582  >  443 [ACK] Seq=611 Ack=5180 Win=43520 Len=0 TSval=4253826542 TSecr=1942903554"
"674","0.004297958","science-edge-external-prod-73889260.us-west-2.elb.amazonaws.com","tanvi-HP-Notebook-d18b","TCP","66","443  >  51214 [ACK] Seq=1 Ack=518 Win=28160 Len=0 TSval=490562272 TSecr=4092054341"
"676","0.000017988","tanvi-HP-Notebook-d18b","science-edge-external-prod-73889260.us-west-2.elb.amazonaws.com","TCP","66","51214  >  443 [ACK] Seq=518 Ack=1389 Win=32128 Len=0 TSval=4092054672 TSecr=490562272"
"678","0.000011531","tanvi-HP-Notebook-d18b","science-edge-external-prod-73889260.us-west-2.elb.amazonaws.com","TCP","66","51214  >  443 [ACK] Seq=518 Ack=2777 Win=35072 Len=0 TSval=4092054672 TSecr=490562272"
"680","0.000005570","tanvi-HP-Notebook-d18b","science-edge-external-prod-73889260.us-west-2.elb.amazonaws.com","TCP","66","51214  >  443 [ACK] Seq=518 Ack=4165 Win=37888 Len=0 TSval=4092054672 TSecr=490562272"
"682","0.000005605","tanvi-HP-Notebook-d18b","science-edge-external-prod-73889260.us-west-2.elb.amazonaws.com","TCP","66","51214  >  443 [ACK] Seq=518 Ack=5296 Win=40704 Len=0 TSval=4092054672 TSecr=490562272"
"690","0.036502246","irc-ws-edge.chat.twitch.tv","tanvi-HP-Notebook-d18b","TCP","74","443  >  43138 [SYN, ACK] Seq=0 Ack=1 Win=26847 Len=0 MSS=1400 SACK_PERM=1 TSval=2247527835 TSecr=2229879571 WS=256"
"691","0.000041250","tanvi-HP-Notebook-d18b","irc-ws-edge.chat.twitch.tv","TCP","66","43138  >  443 [ACK] Seq=1 Ack=1 Win=29312 Len=0 TSval=2229879892 TSecr=2247527835"
"693","0.005187892","tanvi-HP-Notebook-d18b","h2.twitch.map.fastly.net","TCP","66","46574  >  443 [ACK] Seq=1210 Ack=5676 Win=46336 Len=0 TSval=4253826650 TSecr=862758809"
"694","0.016935089","twitch.map.fastly.net","tanvi-HP-Notebook-d18b","TCP","74","443  >  48930 [SYN, ACK] Seq=0 Ack=1 Win=28160 Len=0 MSS=1400 SACK_PERM=1 TSval=1277226361 TSecr=1099551252 WS=512"
"695","0.000203076","tanvi-HP-Notebook-d18b","twitch.map.fastly.net","TCP","66","48930  >  443 [ACK] Seq=1 Ack=1 Win=29312 Len=0 TSval=1099551460 TSecr=1277226361"
"696","0.001094965","api2.branch.io","tanvi-HP-Notebook.local","TCP","94","443  >  34578 [SYN, ACK] Seq=0 Ack=1 Win=24160 Len=0 MSS=1220 SACK_PERM=1 TSval=1174660092 TSecr=258617950 WS=256"
"697","0.000125900","tanvi-HP-Notebook.local","api2.branch.io","TCP","86","34578  >  443 [ACK] Seq=1 Ack=1 Win=28800 Len=0 TSval=258618026 TSecr=1174660092"
"700","0.003903220","h2.twitch.map.fastly.net","tanvi-HP-Notebook-d18b","TCP","66","443  >  46574 [ACK] Seq=5676 Ack=1210 Win=30720 Len=0 TSval=862758827 TSecr=4253826430"
"701","0.031973312","pubsub-edge.chat.twitch.tv","tanvi-HP-Notebook-d18b","TCP","66","443  >  47836 [ACK] Seq=1 Ack=518 Win=28160 Len=0 TSval=1684536570 TSecr=1880390582"
"703","0.000014558","tanvi-HP-Notebook-d18b","pubsub-edge.chat.twitch.tv","TCP","66","47836  >  443 [ACK] Seq=518 Ack=1389 Win=32128 Len=0 TSval=1880390921 TSecr=1684536570"
"705","0.000008442","tanvi-HP-Notebook-d18b","pubsub-edge.chat.twitch.tv","TCP","66","47836  >  443 [ACK] Seq=518 Ack=2777 Win=35072 Len=0 TSval=1880390921 TSecr=1684536570"
"707","0.000005268","tanvi-HP-Notebook-d18b","pubsub-edge.chat.twitch.tv","TCP","66","47836  >  443 [ACK] Seq=518 Ack=4097 Win=37888 Len=0 TSval=1880390922 TSecr=1684536570"
"709","0.000005726","tanvi-HP-Notebook-d18b","pubsub-edge.chat.twitch.tv","TCP","66","47836  >  443 [ACK] Seq=518 Ack=5265 Win=40576 Len=0 TSval=1880390922 TSecr=1684536572"
"711","0.017784253","science-edge-external-prod-73889260.us-west-2.elb.amazonaws.com","tanvi-HP-Notebook-d18b","TLSv1.2","356","New Session Ticket, Change Cipher Spec, Finished"
"713","0.000057714","tanvi-HP-Notebook-d18b","science-edge-external-prod-73889260.us-west-2.elb.amazonaws.com","TCP","66","51202  >  443 [ACK] Seq=2153 Ack=5655 Win=43520 Len=0 TSval=4092054856 TSecr=490562316"
"715","0.004454353","science-edge-external-prod-73889260.us-west-2.elb.amazonaws.com","tanvi-HP-Notebook-d18b","HTTP2","104","SETTINGS[0]"
"716","0.000004761","science-edge-external-prod-73889260.us-west-2.elb.amazonaws.com","tanvi-HP-Notebook-d18b","TCP","66","443  >  51202 [ACK] Seq=5693 Ack=2153 Win=32000 Len=0 TSval=490562317 TSecr=4092054524"
"718","0.000062002","tanvi-HP-Notebook-d18b","science-edge-external-prod-73889260.us-west-2.elb.amazonaws.com","TCP","66","51202  >  443 [ACK] Seq=2191 Ack=5830 Win=46336 Len=0 TSval=4092054862 TSecr=490562317"
"719","0.020849390","api2.branch.io","tanvi-HP-Notebook.local","TCP","86","443  >  34578 [ACK] Seq=1 Ack=518 Win=25344 Len=0 TSval=1174660101 TSecr=258618029"
"721","0.000014927","tanvi-HP-Notebook.local","api2.branch.io","TCP","86","34578  >  443 [ACK] Seq=518 Ack=1209 Win=31232 Len=0 TSval=258618115 TSecr=1174660101"
"723","0.000009751","tanvi-HP-Notebook.local","api2.branch.io","TCP","86","34578  >  443 [ACK] Seq=518 Ack=2417 Win=33664 Len=0 TSval=258618115 TSecr=1174660101"
"725","0.000007358","tanvi-HP-Notebook.local","api2.branch.io","TCP","86","34578  >  443 [ACK] Seq=518 Ack=3625 Win=36096 Len=0 TSval=258618115 TSecr=1174660101"
