"No.","Time","Source","Destination","Protocol","Length","Info"
"19","0.043787067","www.gstatic.com","tanvi-HP-Notebook.local","TCP","94","443  >  44908 [SYN, ACK] Seq=0 Ack=1 Win=65535 Len=0 MSS=1360 SACK_PERM=1 TSval=1844396584 TSecr=173443137 WS=256"
"20","0.000049267","tanvi-HP-Notebook.local","www.gstatic.com","TCP","86","44908  >  443 [ACK] Seq=1 Ack=1 Win=28800 Len=0 TSval=173443258 TSecr=1844396584"
"22","0.024789385","www.gstatic.com","tanvi-HP-Notebook.local","TCP","94","443  >  44910 [SYN, ACK] Seq=0 Ack=1 Win=65535 Len=0 MSS=1360 SACK_PERM=1 TSval=1893501444 TSecr=173443137 WS=256"
"23","0.000044183","tanvi-HP-Notebook.local","www.gstatic.com","TCP","86","44910  >  443 [ACK] Seq=1 Ack=1 Win=28800 Len=0 TSval=173443283 TSecr=1893501444"
"29","0.014365207","www.gstatic.com","tanvi-HP-Notebook.local","TCP","86","443  >  44908 [ACK] Seq=1 Ack=518 Win=66816 Len=0 TSval=1844396679 TSecr=173443258"
"30","0.037622866","www.gstatic.com","tanvi-HP-Notebook.local","TCP","86","443  >  44910 [ACK] Seq=1 Ack=518 Win=66816 Len=0 TSval=1893501550 TSecr=173443284"
"32","0.000025312","tanvi-HP-Notebook.local","www.gstatic.com","TCP","86","44908  >  443 [ACK] Seq=518 Ack=1209 Win=31232 Len=0 TSval=173443412 TSecr=1844396740"
"34","0.000010050","tanvi-HP-Notebook.local","www.gstatic.com","TCP","86","44908  >  443 [ACK] Seq=518 Ack=2417 Win=33664 Len=0 TSval=173443412 TSecr=1844396740"
"36","0.000009564","tanvi-HP-Notebook.local","www.gstatic.com","TCP","86","44908  >  443 [ACK] Seq=518 Ack=3625 Win=36096 Len=0 TSval=173443412 TSecr=1844396740"
"38","0.000005735","tanvi-HP-Notebook.local","www.gstatic.com","TCP","86","44908  >  443 [ACK] Seq=518 Ack=3781 Win=38528 Len=0 TSval=173443412 TSecr=1844396740"
"39","0.003722748","clientservices.googleapis.com","tanvi-HP-Notebook.local","TCP","94","443  >  58196 [SYN, ACK] Seq=0 Ack=1 Win=65535 Len=0 MSS=1360 SACK_PERM=1 TSval=2462081944 TSecr=1725728434 WS=256"
"40","0.000055660","tanvi-HP-Notebook.local","clientservices.googleapis.com","TCP","86","58196  >  443 [ACK] Seq=1 Ack=1 Win=28800 Len=0 TSval=1725728514 TSecr=2462081944"
"61","0.024952148","www.gstatic.com","tanvi-HP-Notebook.local","TCP","86","443  >  44908 [ACK] Seq=3781 Ack=582 Win=66816 Len=0 TSval=1844396834 TSecr=173443422"
"63","0.000204495","tanvi-HP-Notebook.local","www.gstatic.com","HTTP2","117","SETTINGS[0]"
"64","0.003162147","clientservices.googleapis.com","tanvi-HP-Notebook.local","TCP","86","443  >  58196 [ACK] Seq=1 Ack=518 Win=66816 Len=0 TSval=2462082039 TSecr=1725728514"
"65","0.001855600","www.gstatic.com","tanvi-HP-Notebook.local","HTTP2","117","SETTINGS[0]"
"66","0.000079323","www.gstatic.com","tanvi-HP-Notebook.local","TCP","86","443  >  44908 [ACK] Seq=4392 Ack=950 Win=67840 Len=0 TSval=1844396839 TSecr=173443423"
"68","0.000036840","tanvi-HP-Notebook.local","www.gstatic.com","TCP","86","44908  >  443 [ACK] Seq=981 Ack=4757 Win=43392 Len=0 TSval=173443510 TSecr=1844396839"
"73","0.001743960","tanvi-HP-Notebook.local","www.gstatic.com","TCP","86","44908  >  443 [ACK] Seq=981 Ack=5158 Win=45824 Len=0 TSval=173443512 TSecr=1844396840"
"75","0.011998530","www.gstatic.com","tanvi-HP-Notebook.local","TCP","86","443  >  44910 [FIN, ACK] Seq=3781 Ack=519 Win=66816 Len=0 TSval=1893501690 TSecr=173443423"
"78","0.000030427","tanvi-HP-Notebook.local","clientservices.googleapis.com","TCP","86","58196  >  443 [ACK] Seq=518 Ack=1209 Win=31232 Len=0 TSval=1725728639 TSecr=2462082072"
"80","0.000012551","tanvi-HP-Notebook.local","clientservices.googleapis.com","TCP","86","58196  >  443 [ACK] Seq=518 Ack=2417 Win=33664 Len=0 TSval=1725728639 TSecr=2462082072"
"82","0.000005598","tanvi-HP-Notebook.local","clientservices.googleapis.com","TCP","86","58196  >  443 [ACK] Seq=518 Ack=3069 Win=36096 Len=0 TSval=1725728639 TSecr=2462082072"
"92","0.015609797","www.gstatic.com","tanvi-HP-Notebook.local","TCP","86","443  >  44908 [ACK] Seq=5158 Ack=981 Win=67840 Len=0 TSval=1844396918 TSecr=173443423"
"93","0.001832299","www.gstatic.com","tanvi-HP-Notebook.local","TCP","86","443  >  44908 [ACK] Seq=5158 Ack=1020 Win=67840 Len=0 TSval=1844396919 TSecr=173443514"
"97","0.000268275","clientservices.googleapis.com","tanvi-HP-Notebook.local","HTTP2","666","SETTINGS[0], WINDOW_UPDATE[0]"
"99","0.000064304","tanvi-HP-Notebook.local","clientservices.googleapis.com","TCP","86","58196  >  443 [ACK] Seq=957 Ack=3680 Win=38528 Len=0 TSval=1725728743 TSecr=2462082174"
"112","0.002025655","clientservices.googleapis.com","tanvi-HP-Notebook.local","TCP","86","443  >  58196 [ACK] Seq=3680 Ack=988 Win=67840 Len=0 TSval=2462082264 TSecr=1725728743"
"121","0.000062970","tanvi-HP-Notebook.local","clientservices.googleapis.com","TCP","86","58196  >  443 [ACK] Seq=988 Ack=3980 Win=40960 Len=0 TSval=1725728931 TSecr=2462082362"
"123","0.001363913","tanvi-HP-Notebook.local","clientservices.googleapis.com","HTTP2","125","PING[0]"
"124","0.010827753","accounts.google.com","tanvi-HP-Notebook.local","TCP","94","443  >  40628 [SYN, ACK] Seq=0 Ack=1 Win=65535 Len=0 MSS=1360 SACK_PERM=1 TSval=173535496 TSecr=3134854270 WS=256"
"125","0.000156539","tanvi-HP-Notebook.local","accounts.google.com","TCP","86","40628  >  443 [ACK] Seq=1 Ack=1 Win=28800 Len=0 TSval=3134854366 TSecr=173535496"
"132","0.024381055","clientservices.googleapis.com","tanvi-HP-Notebook.local","TCP","86","443  >  58196 [ACK] Seq=4019 Ack=1027 Win=67840 Len=0 TSval=2462082449 TSecr=1725728932"
"138","0.003138323","accounts.google.com","tanvi-HP-Notebook.local","TCP","86","443  >  40628 [ACK] Seq=1 Ack=518 Win=66816 Len=0 TSval=173535591 TSecr=3134854367"
"146","0.000036922","tanvi-HP-Notebook.local","accounts.google.com","TCP","86","40628  >  443 [ACK] Seq=518 Ack=1209 Win=31232 Len=0 TSval=3134854531 TSecr=173535661"
"148","0.000015650","tanvi-HP-Notebook.local","accounts.google.com","TCP","86","40628  >  443 [ACK] Seq=518 Ack=2417 Win=33664 Len=0 TSval=3134854531 TSecr=173535661"
"150","0.000031980","tanvi-HP-Notebook.local","accounts.google.com","TCP","86","40628  >  443 [ACK] Seq=518 Ack=3049 Win=36096 Len=0 TSval=3134854531 TSecr=173535661"
"205","0.022142199","accounts.google.com","tanvi-HP-Notebook.local","TCP","86","443  >  40628 [ACK] Seq=3049 Ack=582 Win=66816 Len=0 TSval=173535756 TSecr=3134854537"
"208","0.039729131","tanvi-HP-Notebook.local","accounts.google.com","TCP","86","40628  >  443 [ACK] Seq=582 Ack=3629 Win=38528 Len=0 TSval=3134854669 TSecr=173535756"
"315","0.017289767","twitch.map.fastly.net","tanvi-HP-Notebook-d18b","TCP","74","443  >  56876 [SYN, ACK] Seq=0 Ack=1 Win=28160 Len=0 MSS=1400 SACK_PERM=1 TSval=1952736347 TSecr=1790760433 WS=512"
"316","0.000039631","tanvi-HP-Notebook-d18b","twitch.map.fastly.net","TCP","66","56876  >  443 [ACK] Seq=1 Ack=1 Win=29312 Len=0 TSval=1790760621 TSecr=1952736347"
"318","0.020324254","twitch.map.fastly.net","tanvi-HP-Notebook-d18b","TCP","74","443  >  56874 [SYN, ACK] Seq=0 Ack=1 Win=28160 Len=0 MSS=1400 SACK_PERM=1 TSval=979785580 TSecr=1790760433 WS=512"
"319","0.000070679","tanvi-HP-Notebook-d18b","twitch.map.fastly.net","TCP","66","56874  >  443 [ACK] Seq=1 Ack=1 Win=29312 Len=0 TSval=1790760642 TSecr=979785580"
"321","0.164408235","twitch.map.fastly.net","tanvi-HP-Notebook-d18b","TCP","74","443  >  56878 [SYN, ACK] Seq=0 Ack=1 Win=28160 Len=0 MSS=1400 SACK_PERM=1 TSval=2040498505 TSecr=1790760604 WS=512"
"322","0.000065620","tanvi-HP-Notebook-d18b","twitch.map.fastly.net","TCP","66","56878  >  443 [ACK] Seq=1 Ack=1 Win=29312 Len=0 TSval=1790760807 TSecr=2040498505"
"324","0.008575486","twitch.map.fastly.net","tanvi-HP-Notebook-d18b","TCP","66","443  >  56876 [ACK] Seq=1 Ack=518 Win=29696 Len=0 TSval=1952736396 TSecr=1790760621"
"326","0.000024118","tanvi-HP-Notebook-d18b","twitch.map.fastly.net","TCP","66","56876  >  443 [ACK] Seq=518 Ack=1389 Win=32128 Len=0 TSval=1790760817 TSecr=1952736396"
"328","0.000010926","tanvi-HP-Notebook-d18b","twitch.map.fastly.net","TCP","66","56876  >  443 [ACK] Seq=518 Ack=2777 Win=35072 Len=0 TSval=1790760817 TSecr=1952736396"
"330","0.000028025","tanvi-HP-Notebook-d18b","twitch.map.fastly.net","TCP","66","56876  >  443 [ACK] Seq=518 Ack=4165 Win=37888 Len=0 TSval=1790760817 TSecr=1952736396"
"332","0.000008763","tanvi-HP-Notebook-d18b","twitch.map.fastly.net","TCP","66","56876  >  443 [ACK] Seq=518 Ack=4928 Win=40704 Len=0 TSval=1790760817 TSecr=1952736396"
"335","0.042968125","twitch.map.fastly.net","tanvi-HP-Notebook-d18b","TCP","66","443  >  56874 [ACK] Seq=1 Ack=518 Win=29696 Len=0 TSval=979785637 TSecr=1790760642"
"337","0.000024005","tanvi-HP-Notebook-d18b","twitch.map.fastly.net","TCP","66","56874  >  443 [ACK] Seq=518 Ack=1389 Win=32128 Len=0 TSval=1790760867 TSecr=979785638"
"339","0.000052333","tanvi-HP-Notebook-d18b","twitch.map.fastly.net","TCP","66","56874  >  443 [ACK] Seq=518 Ack=2777 Win=35072 Len=0 TSval=1790760867 TSecr=979785638"
"341","0.000011390","tanvi-HP-Notebook-d18b","twitch.map.fastly.net","TCP","66","56874  >  443 [ACK] Seq=518 Ack=4165 Win=37888 Len=0 TSval=1790760867 TSecr=979785638"
"343","0.000008877","tanvi-HP-Notebook-d18b","twitch.map.fastly.net","TCP","66","56874  >  443 [ACK] Seq=518 Ack=4928 Win=40704 Len=0 TSval=1790760867 TSecr=979785638"
"345","0.160859202","twitch.map.fastly.net","tanvi-HP-Notebook-d18b","TLSv1.2","324","New Session Ticket, Change Cipher Spec, Finished"
"346","0.000040204","twitch.map.fastly.net","tanvi-HP-Notebook-d18b","TCP","66","443  >  56878 [ACK] Seq=1 Ack=518 Win=29696 Len=0 TSval=2040498561 TSecr=1790760807"
"348","0.000046493","tanvi-HP-Notebook-d18b","twitch.map.fastly.net","TCP","66","56878  >  443 [ACK] Seq=518 Ack=1389 Win=32128 Len=0 TSval=1790761032 TSecr=2040498562"
"350","0.000007625","tanvi-HP-Notebook-d18b","twitch.map.fastly.net","TCP","66","56878  >  443 [ACK] Seq=518 Ack=2777 Win=35072 Len=0 TSval=1790761032 TSecr=2040498562"
"352","0.000006120","tanvi-HP-Notebook-d18b","twitch.map.fastly.net","TCP","66","56878  >  443 [ACK] Seq=518 Ack=4165 Win=37888 Len=0 TSval=1790761032 TSecr=2040498562"
"354","0.000004821","tanvi-HP-Notebook-d18b","twitch.map.fastly.net","TCP","66","56878  >  443 [ACK] Seq=518 Ack=4928 Win=40704 Len=0 TSval=1790761032 TSecr=2040498562"
"356","0.037807210","twitch.map.fastly.net","tanvi-HP-Notebook-d18b","TCP","66","443  >  56876 [ACK] Seq=5186 Ack=1345 Win=30720 Len=0 TSval=1952736460 TSecr=1790760824"
"357","0.000024760","tanvi-HP-Notebook-d18b","twitch.map.fastly.net","TCP","66","56876  >  443 [ACK] Seq=1345 Ack=5186 Win=43520 Len=0 TSval=1790761071 TSecr=1952736446"
"358","0.020990317","twitch.map.fastly.net","tanvi-HP-Notebook-d18b","TLSv1.2","324","New Session Ticket, Change Cipher Spec, Finished"
"359","0.041793589","tanvi-HP-Notebook-d18b","twitch.map.fastly.net","TCP","66","56874  >  443 [ACK] Seq=611 Ack=5186 Win=43520 Len=0 TSval=1790761134 TSecr=979785694"
"362","0.000051653","tanvi-HP-Notebook-d18b","twitch.map.fastly.net","TCP","66","56876  >  443 [ACK] Seq=1345 Ack=7962 Win=49280 Len=0 TSval=1790761161 TSecr=1952736482"
"365","0.000012466","tanvi-HP-Notebook-d18b","twitch.map.fastly.net","TCP","66","56876  >  443 [ACK] Seq=1345 Ack=9362 Win=52224 Len=0 TSval=1790761161 TSecr=1952736482"
"368","0.000013614","tanvi-HP-Notebook-d18b","twitch.map.fastly.net","TCP","66","56876  >  443 [ACK] Seq=1345 Ack=10762 Win=55040 Len=0 TSval=1790761163 TSecr=1952736482"
"371","0.000011853","tanvi-HP-Notebook-d18b","twitch.map.fastly.net","TCP","66","56876  >  443 [ACK] Seq=1345 Ack=13538 Win=60928 Len=0 TSval=1790761163 TSecr=1952736482"
"381","0.002243747","tanvi-HP-Notebook-d18b","twitch.map.fastly.net","TCP","66","56876  >  443 [ACK] Seq=1345 Ack=13550 Win=60928 Len=0 TSval=1790761206 TSecr=1952736482"
"382","0.040985061","twitch.map.fastly.net","tanvi-HP-Notebook-d18b","TLSv1.2","324","New Session Ticket, Change Cipher Spec, Finished"
"386","0.000023064","tanvi-HP-Notebook-d18b","twitch.map.fastly.net","TCP","66","56876  >  443 [ACK] Seq=1345 Ack=14938 Win=63744 Len=0 TSval=1790761259 TSecr=1952736506"
"388","0.000007260","tanvi-HP-Notebook-d18b","twitch.map.fastly.net","TCP","66","56876  >  443 [ACK] Seq=1345 Ack=16326 Win=66688 Len=0 TSval=1790761259 TSecr=1952736506"
"398","0.000385328","tanvi-HP-Notebook-d18b","twitch.map.fastly.net","TCP","66","56878  >  443 [ACK] Seq=611 Ack=5186 Win=43520 Len=0 TSval=1790761290 TSecr=2040498615"
"417","0.000024739","tanvi-HP-Notebook-d18b","twitch.map.fastly.net","TCP","66","56876  >  443 [ACK] Seq=1345 Ack=17714 Win=69504 Len=0 TSval=1790761341 TSecr=1952736527"
"419","0.000008660","tanvi-HP-Notebook-d18b","twitch.map.fastly.net","TCP","66","56876  >  443 [ACK] Seq=1345 Ack=19102 Win=72448 Len=0 TSval=1790761341 TSecr=1952736527"
"421","0.000021453","tanvi-HP-Notebook-d18b","twitch.map.fastly.net","TCP","66","56876  >  443 [ACK] Seq=1345 Ack=20490 Win=75392 Len=0 TSval=1790761341 TSecr=1952736527"
"423","0.000010324","tanvi-HP-Notebook-d18b","twitch.map.fastly.net","TCP","66","56876  >  443 [ACK] Seq=1345 Ack=21878 Win=78208 Len=0 TSval=1790761341 TSecr=1952736527"
"425","0.000009101","tanvi-HP-Notebook-d18b","twitch.map.fastly.net","TCP","66","56876  >  443 [ACK] Seq=1345 Ack=23266 Win=81152 Len=0 TSval=1790761341 TSecr=1952736527"
"427","0.000008613","tanvi-HP-Notebook-d18b","twitch.map.fastly.net","TCP","66","56876  >  443 [ACK] Seq=1345 Ack=24654 Win=84096 Len=0 TSval=1790761341 TSecr=1952736527"
"429","0.000009684","tanvi-HP-Notebook-d18b","twitch.map.fastly.net","TCP","66","56876  >  443 [ACK] Seq=1345 Ack=26042 Win=86912 Len=0 TSval=1790761341 TSecr=1952736527"
"431","0.000006967","tanvi-HP-Notebook-d18b","twitch.map.fastly.net","TCP","66","56876  >  443 [ACK] Seq=1345 Ack=27430 Win=89856 Len=0 TSval=1790761341 TSecr=1952736527"
"435","0.000077397","tanvi-HP-Notebook-d18b","twitch.map.fastly.net","TCP","66","56876  >  443 [ACK] Seq=1345 Ack=28818 Win=92672 Len=0 TSval=1790761343 TSecr=1952736528"
"437","0.000011931","tanvi-HP-Notebook-d18b","twitch.map.fastly.net","TCP","66","56876  >  443 [ACK] Seq=1345 Ack=30206 Win=95616 Len=0 TSval=1790761343 TSecr=1952736528"
"439","0.000023028","tanvi-HP-Notebook-d18b","twitch.map.fastly.net","TCP","66","56876  >  443 [ACK] Seq=1345 Ack=31594 Win=98560 Len=0 TSval=1790761343 TSecr=1952736528"
"441","0.000008105","tanvi-HP-Notebook-d18b","twitch.map.fastly.net","TCP","66","56876  >  443 [ACK] Seq=1345 Ack=32982 Win=101376 Len=0 TSval=1790761343 TSecr=1952736528"
"443","0.000013715","tanvi-HP-Notebook-d18b","twitch.map.fastly.net","TCP","66","56876  >  443 [ACK] Seq=1345 Ack=33461 Win=104192 Len=0 TSval=1790761343 TSecr=1952736528"
"446","0.012989411","safebrowsing.googleapis.com","tanvi-HP-Notebook.local","TCP","94","443  >  53698 [SYN, ACK] Seq=0 Ack=1 Win=65535 Len=0 MSS=1360 SACK_PERM=1 TSval=2837291266 TSecr=3884263637 WS=256"
"447","0.000042608","tanvi-HP-Notebook.local","safebrowsing.googleapis.com","TCP","86","53698  >  443 [ACK] Seq=1 Ack=1 Win=28800 Len=0 TSval=3884263712 TSecr=2837291266"
"466","0.023919821","safebrowsing.googleapis.com","tanvi-HP-Notebook.local","TCP","86","443  >  53698 [ACK] Seq=1 Ack=518 Win=66816 Len=0 TSval=2837291351 TSecr=3884263713"
"469","0.034158838","h2.twitch.map.fastly.net","tanvi-HP-Notebook-d18b","TCP","74","443  >  49712 [SYN, ACK] Seq=0 Ack=1 Win=28160 Len=0 MSS=1400 SACK_PERM=1 TSval=1955068055 TSecr=3998324261 WS=512"
"470","0.000047360","tanvi-HP-Notebook-d18b","h2.twitch.map.fastly.net","TCP","66","49712  >  443 [ACK] Seq=1 Ack=1 Win=29312 Len=0 TSval=3998324459 TSecr=1955068055"
"471","0.000095357","twitch.map.fastly.net","tanvi-HP-Notebook-d18b","TCP","74","443  >  56882 [SYN, ACK] Seq=0 Ack=1 Win=28160 Len=0 MSS=1400 SACK_PERM=1 TSval=216156720 TSecr=1790761292 WS=512"
"472","0.000014370","tanvi-HP-Notebook-d18b","twitch.map.fastly.net","TCP","66","56882  >  443 [ACK] Seq=1 Ack=1 Win=29312 Len=0 TSval=1790761494 TSecr=216156720"
"473","0.000087983","h2.twitch.map.fastly.net","tanvi-HP-Notebook-d18b","TCP","74","443  >  49716 [SYN, ACK] Seq=0 Ack=1 Win=28160 Len=0 MSS=1400 SACK_PERM=1 TSval=871038535 TSecr=3998324267 WS=512"
"474","0.000012492","tanvi-HP-Notebook-d18b","h2.twitch.map.fastly.net","TCP","66","49716  >  443 [ACK] Seq=1 Ack=1 Win=29312 Len=0 TSval=3998324460 TSecr=871038535"
"479","0.004958178","h2.twitch.map.fastly.net","tanvi-HP-Notebook-d18b","TCP","74","443  >  49714 [SYN, ACK] Seq=0 Ack=1 Win=28160 Len=0 MSS=1400 SACK_PERM=1 TSval=1932659154 TSecr=3998324266 WS=512"
"480","0.000034147","tanvi-HP-Notebook-d18b","h2.twitch.map.fastly.net","TCP","66","49714  >  443 [ACK] Seq=1 Ack=1 Win=29312 Len=0 TSval=3998324466 TSecr=1932659154"
"484","0.000176322","tanvi-HP-Notebook.local","safebrowsing.googleapis.com","TCP","86","53698  >  443 [ACK] Seq=518 Ack=1209 Win=31232 Len=0 TSval=3884263862 TSecr=2837291411"
"486","0.000068746","tanvi-HP-Notebook.local","safebrowsing.googleapis.com","TCP","86","53698  >  443 [ACK] Seq=518 Ack=2417 Win=33664 Len=0 TSval=3884263862 TSecr=2837291411"
"488","0.000128257","tanvi-HP-Notebook.local","safebrowsing.googleapis.com","TCP","86","53698  >  443 [ACK] Seq=518 Ack=3069 Win=36096 Len=0 TSval=3884263862 TSecr=2837291411"
"499","0.011477042","safebrowsing.googleapis.com","tanvi-HP-Notebook.local","TCP","86","443  >  53698 [ACK] Seq=3069 Ack=582 Win=66816 Len=0 TSval=2837291506 TSecr=3884263868"
"501","0.000141148","tanvi-HP-Notebook.local","safebrowsing.googleapis.com","HTTP2","117","SETTINGS[0]"
"502","0.003200916","safebrowsing.googleapis.com","tanvi-HP-Notebook.local","HTTP2","117","SETTINGS[0]"
"503","0.006681434","safebrowsing.googleapis.com","tanvi-HP-Notebook.local","TCP","86","443  >  53698 [ACK] Seq=3680 Ack=1481 Win=68352 Len=0 TSval=2837291515 TSecr=3884263868"
"504","0.033878740","tanvi-HP-Notebook.local","safebrowsing.googleapis.com","TCP","86","53698  >  443 [ACK] Seq=1512 Ack=3680 Win=38528 Len=0 TSval=3884263996 TSecr=2837291510"
"507","0.004202538","static.twitchcdn.net","tanvi-HP-Notebook-d18b","TCP","74","443  >  44146 [SYN, ACK] Seq=0 Ack=1 Win=28160 Len=0 MSS=1400 SACK_PERM=1 TSval=1951183345 TSecr=1990834408 WS=512"
"508","0.000036847","tanvi-HP-Notebook-d18b","static.twitchcdn.net","TCP","66","44146  >  443 [ACK] Seq=1 Ack=1 Win=29312 Len=0 TSval=1990834596 TSecr=1951183345"
"511","0.000097663","tanvi-HP-Notebook.local","safebrowsing.googleapis.com","TCP","86","53698  >  443 [ACK] Seq=1512 Ack=3997 Win=40960 Len=0 TSval=3884264018 TSecr=2837291574"
"513","0.000015259","tanvi-HP-Notebook.local","safebrowsing.googleapis.com","TCP","86","53698  >  443 [ACK] Seq=1512 Ack=4345 Win=43392 Len=0 TSval=3884264018 TSecr=2837291574"
"515","0.000077078","tanvi-HP-Notebook.local","safebrowsing.googleapis.com","TCP","86","53698  >  443 [ACK] Seq=1512 Ack=4556 Win=45824 Len=0 TSval=3884264020 TSecr=2837291574"
"517","0.000012141","tanvi-HP-Notebook.local","safebrowsing.googleapis.com","TCP","86","53698  >  443 [ACK] Seq=1512 Ack=4595 Win=45824 Len=0 TSval=3884264020 TSecr=2837291575"
"519","0.012416533","science-edge-external-prod-73889260.us-west-2.elb.amazonaws.com","tanvi-HP-Notebook-d18b","TCP","74","443  >  50906 [SYN, ACK] Seq=0 Ack=1 Win=26847 Len=0 MSS=1400 SACK_PERM=1 TSval=69124396 TSecr=2603562531 WS=256"
"520","0.000034188","tanvi-HP-Notebook-d18b","science-edge-external-prod-73889260.us-west-2.elb.amazonaws.com","TCP","66","50906  >  443 [ACK] Seq=1 Ack=1 Win=29312 Len=0 TSval=2603562865 TSecr=69124396"
"522","0.003921870","e9221.i.akamaiedge.net","tanvi-HP-Notebook-d18b","TCP","74","443  >  54180 [SYN, ACK] Seq=0 Ack=1 Win=28960 Len=0 MSS=1400 SACK_PERM=1 TSval=1919351589 TSecr=338126508 WS=128"
"523","0.000032296","tanvi-HP-Notebook-d18b","e9221.i.akamaiedge.net","TCP","66","54180  >  443 [ACK] Seq=1 Ack=1 Win=29312 Len=0 TSval=338126604 TSecr=1919351589"
"525","0.005283140","h2.twitch.map.fastly.net","tanvi-HP-Notebook-d18b","TCP","66","443  >  49712 [ACK] Seq=1 Ack=518 Win=29696 Len=0 TSval=1955068104 TSecr=3998324461"
"526","0.000097074","safebrowsing.googleapis.com","tanvi-HP-Notebook.local","TCP","86","443  >  53698 [ACK] Seq=4595 Ack=1512 Win=68352 Len=0 TSval=2837291595 TSecr=3884263952"
"528","0.000008981","tanvi-HP-Notebook-d18b","h2.twitch.map.fastly.net","TCP","66","49712  >  443 [ACK] Seq=518 Ack=1389 Win=32128 Len=0 TSval=3998324655 TSecr=1955068105"
"530","0.000004953","tanvi-HP-Notebook-d18b","h2.twitch.map.fastly.net","TCP","66","49712  >  443 [ACK] Seq=518 Ack=2777 Win=35072 Len=0 TSval=3998324655 TSecr=1955068105"
"532","0.000003899","tanvi-HP-Notebook-d18b","h2.twitch.map.fastly.net","TCP","66","49712  >  443 [ACK] Seq=518 Ack=4165 Win=37888 Len=0 TSval=3998324655 TSecr=1955068105"
"534","0.000014903","tanvi-HP-Notebook-d18b","h2.twitch.map.fastly.net","TCP","66","49712  >  443 [ACK] Seq=518 Ack=4922 Win=40704 Len=0 TSval=3998324658 TSecr=1955068105"
"535","0.001288726","h2.twitch.map.fastly.net","tanvi-HP-Notebook-d18b","TCP","66","443  >  49716 [ACK] Seq=1 Ack=518 Win=29696 Len=0 TSval=871038585 TSecr=3998324461"
"536","0.000228144","h2.twitch.map.fastly.net","tanvi-HP-Notebook-d18b","TCP","74","443  >  49722 [SYN, ACK] Seq=0 Ack=1 Win=28160 Len=0 MSS=1400 SACK_PERM=1 TSval=1951947321 TSecr=3998324461 WS=512"
"537","0.000026793","tanvi-HP-Notebook-d18b","h2.twitch.map.fastly.net","TCP","66","49722  >  443 [ACK] Seq=1 Ack=1 Win=29312 Len=0 TSval=3998324659 TSecr=1951947321"
"541","0.000037441","tanvi-HP-Notebook-d18b","h2.twitch.map.fastly.net","TCP","66","49716  >  443 [ACK] Seq=518 Ack=1389 Win=32128 Len=0 TSval=3998324662 TSecr=871038585"
"542","0.000056165","twitch.map.fastly.net","tanvi-HP-Notebook-d18b","TCP","66","443  >  56882 [ACK] Seq=1 Ack=518 Win=29696 Len=0 TSval=216156771 TSecr=1790761495"
"544","0.000007178","tanvi-HP-Notebook-d18b","h2.twitch.map.fastly.net","TCP","66","49716  >  443 [ACK] Seq=518 Ack=2777 Win=35072 Len=0 TSval=3998324663 TSecr=871038585"
"546","0.000004646","tanvi-HP-Notebook-d18b","h2.twitch.map.fastly.net","TCP","66","49716  >  443 [ACK] Seq=518 Ack=4165 Win=37888 Len=0 TSval=3998324663 TSecr=871038585"
"548","0.000004308","tanvi-HP-Notebook-d18b","h2.twitch.map.fastly.net","TCP","66","49716  >  443 [ACK] Seq=518 Ack=4922 Win=40704 Len=0 TSval=3998324663 TSecr=871038585"
"550","0.000004565","tanvi-HP-Notebook-d18b","twitch.map.fastly.net","TCP","66","56882  >  443 [ACK] Seq=518 Ack=1389 Win=32128 Len=0 TSval=1790761697 TSecr=216156772"
"552","0.000004258","tanvi-HP-Notebook-d18b","twitch.map.fastly.net","TCP","66","56882  >  443 [ACK] Seq=518 Ack=2777 Win=35072 Len=0 TSval=1790761697 TSecr=216156772"
"554","0.000003668","tanvi-HP-Notebook-d18b","twitch.map.fastly.net","TCP","66","56882  >  443 [ACK] Seq=518 Ack=4165 Win=37888 Len=0 TSval=1790761697 TSecr=216156772"
"556","0.000003899","tanvi-HP-Notebook-d18b","twitch.map.fastly.net","TCP","66","56882  >  443 [ACK] Seq=518 Ack=4928 Win=40704 Len=0 TSval=1790761697 TSecr=216156772"
"560","0.001996083","h2.twitch.map.fastly.net","tanvi-HP-Notebook-d18b","TCP","66","443  >  49714 [ACK] Seq=1 Ack=518 Win=29696 Len=0 TSval=1932659207 TSecr=3998324466"
"562","0.000010040","tanvi-HP-Notebook-d18b","h2.twitch.map.fastly.net","TCP","66","49714  >  443 [ACK] Seq=518 Ack=1389 Win=32128 Len=0 TSval=3998324680 TSecr=1932659208"
"564","0.000005133","tanvi-HP-Notebook-d18b","h2.twitch.map.fastly.net","TCP","66","49714  >  443 [ACK] Seq=518 Ack=2777 Win=35072 Len=0 TSval=3998324680 TSecr=1932659208"
"566","0.000077903","tanvi-HP-Notebook-d18b","h2.twitch.map.fastly.net","TCP","66","49714  >  443 [ACK] Seq=518 Ack=4165 Win=37888 Len=0 TSval=3998324695 TSecr=1932659208"
"568","0.000105664","tanvi-HP-Notebook-d18b","h2.twitch.map.fastly.net","TCP","66","49714  >  443 [ACK] Seq=518 Ack=4922 Win=40704 Len=0 TSval=3998324695 TSecr=1932659208"
"574","0.017784417","safebrowsing.googleapis.com","tanvi-HP-Notebook.local","TCP","86","443  >  53698 [ACK] Seq=4595 Ack=1551 Win=68352 Len=0 TSval=2837291661 TSecr=3884264020"
"576","0.002118046","e9221.i.akamaiedge.net","tanvi-HP-Notebook-d18b","TCP","66","443  >  54180 [ACK] Seq=1 Ack=518 Win=30080 Len=0 TSval=1919351684 TSecr=338126604"
"578","0.000013435","tanvi-HP-Notebook-d18b","e9221.i.akamaiedge.net","TCP","66","54180  >  443 [ACK] Seq=518 Ack=1389 Win=32128 Len=0 TSval=338126701 TSecr=1919351685"
"580","0.000134879","tanvi-HP-Notebook-d18b","e9221.i.akamaiedge.net","TCP","66","54180  >  443 [ACK] Seq=518 Ack=2777 Win=35072 Len=0 TSval=338126711 TSecr=1919351685"
"582","0.000192090","tanvi-HP-Notebook-d18b","e9221.i.akamaiedge.net","TCP","66","54180  >  443 [ACK] Seq=518 Ack=4038 Win=37888 Len=0 TSval=338126711 TSecr=1919351685"
"584","0.018457970","api2.branch.io","tanvi-HP-Notebook.local","TCP","94","443  >  45008 [SYN, ACK] Seq=0 Ack=1 Win=24160 Len=0 MSS=1220 SACK_PERM=1 TSval=1177971509 TSecr=2401778001 WS=256"
"585","0.000034510","tanvi-HP-Notebook.local","api2.branch.io","TCP","86","45008  >  443 [ACK] Seq=1 Ack=1 Win=28800 Len=0 TSval=2401778084 TSecr=1177971509"
"587","0.018985366","pubsub-edge.chat.twitch.tv","tanvi-HP-Notebook-d18b","TCP","74","443  >  34518 [SYN, ACK] Seq=0 Ack=1 Win=26847 Len=0 MSS=1400 SACK_PERM=1 TSval=1386877811 TSecr=89416311 WS=256"
"588","0.000036890","tanvi-HP-Notebook-d18b","pubsub-edge.chat.twitch.tv","TCP","66","34518  >  443 [ACK] Seq=1 Ack=1 Win=29312 Len=0 TSval=89416629 TSecr=1386877811"
"589","0.000005886","science-edge-external-prod-73889260.us-west-2.elb.amazonaws.com","tanvi-HP-Notebook-d18b","TCP","74","443  >  50912 [SYN, ACK] Seq=0 Ack=1 Win=26847 Len=0 MSS=1400 SACK_PERM=1 TSval=69124438 TSecr=2603562687 WS=256"
"590","0.000007360","tanvi-HP-Notebook-d18b","science-edge-external-prod-73889260.us-west-2.elb.amazonaws.com","TCP","66","50912  >  443 [ACK] Seq=1 Ack=1 Win=29312 Len=0 TSval=2603563022 TSecr=69124438"
"593","0.013528869","static.twitchcdn.net","tanvi-HP-Notebook-d18b","TCP","66","443  >  44146 [ACK] Seq=1 Ack=518 Win=29696 Len=0 TSval=1951183396 TSecr=1990834598"
"595","0.000016585","tanvi-HP-Notebook-d18b","static.twitchcdn.net","TCP","66","44146  >  443 [ACK] Seq=518 Ack=1389 Win=32128 Len=0 TSval=1990834801 TSecr=1951183396"
"597","0.000007236","tanvi-HP-Notebook-d18b","static.twitchcdn.net","TCP","66","44146  >  443 [ACK] Seq=518 Ack=2777 Win=35072 Len=0 TSval=1990834801 TSecr=1951183396"
"599","0.000005129","tanvi-HP-Notebook-d18b","static.twitchcdn.net","TCP","66","44146  >  443 [ACK] Seq=518 Ack=4165 Win=37888 Len=0 TSval=1990834801 TSecr=1951183396"
"601","0.000005418","tanvi-HP-Notebook-d18b","static.twitchcdn.net","TCP","66","44146  >  443 [ACK] Seq=518 Ack=4928 Win=40704 Len=0 TSval=1990834801 TSecr=1951183396"
"604","0.033232287","h2.twitch.map.fastly.net","tanvi-HP-Notebook-d18b","TCP","66","443  >  49722 [ACK] Seq=1 Ack=518 Win=29696 Len=0 TSval=1951947369 TSecr=3998324660"
"606","0.000061279","tanvi-HP-Notebook-d18b","h2.twitch.map.fastly.net","TCP","66","49722  >  443 [ACK] Seq=518 Ack=1389 Win=32128 Len=0 TSval=3998324856 TSecr=1951947370"
"608","0.000046627","tanvi-HP-Notebook-d18b","h2.twitch.map.fastly.net","TCP","66","49722  >  443 [ACK] Seq=518 Ack=2777 Win=35072 Len=0 TSval=3998324856 TSecr=1951947370"
"610","0.000062281","tanvi-HP-Notebook-d18b","h2.twitch.map.fastly.net","TCP","66","49722  >  443 [ACK] Seq=518 Ack=4165 Win=37888 Len=0 TSval=3998324856 TSecr=1951947370"
"612","0.000008840","tanvi-HP-Notebook-d18b","h2.twitch.map.fastly.net","TCP","66","49722  >  443 [ACK] Seq=518 Ack=4922 Win=40704 Len=0 TSval=3998324856 TSecr=1951947370"
"613","0.001960211","h2.twitch.map.fastly.net","tanvi-HP-Notebook-d18b","TLSv1.2","324","New Session Ticket, Change Cipher Spec, Finished"
"615","0.005801480","twitch.map.fastly.net","tanvi-HP-Notebook-d18b","TLSv1.2","324","New Session Ticket, Change Cipher Spec, Finished"
"616","0.012209007","e9221.i.akamaiedge.net","tanvi-HP-Notebook-d18b","TLSv1.3","337","New Session Ticket"
"618","0.000000681","h2.twitch.map.fastly.net","tanvi-HP-Notebook-d18b","TLSv1.2","324","New Session Ticket, Change Cipher Spec, Finished"
"619","0.000154827","api2.branch.io","tanvi-HP-Notebook.local","TCP","86","443  >  45008 [ACK] Seq=1 Ack=518 Win=25344 Len=0 TSval=1177971517 TSecr=2401778085"
"621","0.000056662","tanvi-HP-Notebook.local","api2.branch.io","TCP","86","45008  >  443 [ACK] Seq=518 Ack=1209 Win=31232 Len=0 TSval=2401778179 TSecr=1177971517"
"623","0.000017492","tanvi-HP-Notebook.local","api2.branch.io","TCP","86","45008  >  443 [ACK] Seq=518 Ack=2417 Win=33664 Len=0 TSval=2401778179 TSecr=1177971517"
"625","0.000016473","tanvi-HP-Notebook.local","api2.branch.io","TCP","86","45008  >  443 [ACK] Seq=518 Ack=3625 Win=36096 Len=0 TSval=2401778179 TSecr=1177971517"
"627","0.000034912","tanvi-HP-Notebook.local","api2.branch.io","TCP","86","45008  >  443 [ACK] Seq=518 Ack=4794 Win=38528 Len=0 TSval=2401778179 TSecr=1177971517"
"628","0.000453727","tanvi-HP-Notebook-d18b","e9221.i.akamaiedge.net","TCP","66","54180  >  443 [ACK] Seq=598 Ack=4580 Win=43392 Len=0 TSval=338126832 TSecr=1919351804"
"634","0.016514935","tanvi-HP-Notebook-d18b","h2.twitch.map.fastly.net","TCP","66","49712  >  443 [ACK] Seq=611 Ack=5180 Win=43520 Len=0 TSval=3998324900 TSecr=1955068155"
"635","0.000621101","h2.twitch.map.fastly.net","tanvi-HP-Notebook-d18b","TLSv1.2","324","New Session Ticket, Change Cipher Spec, Finished"
"637","0.000403556","tanvi-HP-Notebook-d18b","h2.twitch.map.fastly.net","TCP","66","49714  >  443 [ACK] Seq=1172 Ack=5246 Win=43520 Len=0 TSval=3998324901 TSecr=1932659262"
"639","0.002773006","tanvi-HP-Notebook-d18b","twitch.map.fastly.net","TCP","66","56882  >  443 [ACK] Seq=611 Ack=5186 Win=43520 Len=0 TSval=1790761938 TSecr=216156821"
"641","0.007113658","tanvi-HP-Notebook-d18b","h2.twitch.map.fastly.net","TCP","66","49716  >  443 [ACK] Seq=611 Ack=5180 Win=43520 Len=0 TSval=3998324920 TSecr=871038636"
"642","0.027832499","h2.twitch.map.fastly.net","tanvi-HP-Notebook-d18b","TCP","66","443  >  49714 [ACK] Seq=5246 Ack=1172 Win=30720 Len=0 TSval=1932659275 TSecr=3998324696"
"643","0.029516741","api2.branch.io","tanvi-HP-Notebook.local","TCP","86","443  >  45008 [ACK] Seq=4794 Ack=737 Win=25344 Len=0 TSval=1177971528 TSecr=2401778184"
"644","0.000070717","api2.branch.io","tanvi-HP-Notebook.local","TCP","86","443  >  45008 [ACK] Seq=4794 Ack=1056 Win=26368 Len=0 TSval=1177971528 TSecr=2401778186"
"645","0.000078423","api2.branch.io","tanvi-HP-Notebook.local","TCP","86","443  >  45008 [ACK] Seq=4794 Ack=2462 Win=29184 Len=0 TSval=1177971528 TSecr=2401778186"
"648","0.000027994","tanvi-HP-Notebook.local","api2.branch.io","TCP","86","45008  >  443 [ACK] Seq=2462 Ack=4923 Win=38528 Len=0 TSval=2401778280 TSecr=1177971528"
"650","0.005560748","science-edge-external-prod-73889260.us-west-2.elb.amazonaws.com","tanvi-HP-Notebook-d18b","TCP","66","443  >  50906 [ACK] Seq=1 Ack=518 Win=28160 Len=0 TSval=69124481 TSecr=2603562865"
"652","0.000012461","tanvi-HP-Notebook-d18b","science-edge-external-prod-73889260.us-west-2.elb.amazonaws.com","TCP","66","50906  >  443 [ACK] Seq=518 Ack=1389 Win=32128 Len=0 TSval=2603563204 TSecr=69124481"
"654","0.000008055","tanvi-HP-Notebook-d18b","science-edge-external-prod-73889260.us-west-2.elb.amazonaws.com","TCP","66","50906  >  443 [ACK] Seq=518 Ack=2777 Win=35072 Len=0 TSval=2603563204 TSecr=69124481"
"656","0.000006378","tanvi-HP-Notebook-d18b","science-edge-external-prod-73889260.us-west-2.elb.amazonaws.com","TCP","66","50906  >  443 [ACK] Seq=518 Ack=4165 Win=37888 Len=0 TSval=2603563204 TSecr=69124481"
"658","0.000005285","tanvi-HP-Notebook-d18b","science-edge-external-prod-73889260.us-west-2.elb.amazonaws.com","TCP","66","50906  >  443 [ACK] Seq=518 Ack=5296 Win=40704 Len=0 TSval=2603563204 TSecr=69124481"
"663","0.039607223","static.twitchcdn.net","tanvi-HP-Notebook-d18b","TLSv1.2","324","New Session Ticket, Change Cipher Spec, Finished"
"664","0.041318735","tanvi-HP-Notebook-d18b","static.twitchcdn.net","TCP","66","44146  >  443 [ACK] Seq=611 Ack=5186 Win=43520 Len=0 TSval=1990835051 TSecr=1951183448"
"665","0.001810429","h2.twitch.map.fastly.net","tanvi-HP-Notebook-d18b","TLSv1.2","324","New Session Ticket, Change Cipher Spec, Finished"
"669","0.024608895","tanvi-HP-Notebook-d18b","h2.twitch.map.fastly.net","TCP","66","49722  >  443 [ACK] Seq=611 Ack=5180 Win=43520 Len=0 TSval=3998325112 TSecr=1951947423"
"670","0.014030303","api2.branch.io","tanvi-HP-Notebook.local","TCP","86","443  >  45008 [ACK] Seq=4923 Ack=2500 Win=29184 Len=0 TSval=1177971542 TSecr=2401778280"
"671","0.002051988","tanvi-HP-Notebook-d18b","h2.twitch.map.fastly.net","TCP","66","49714  >  443 [ACK] Seq=1210 Ack=5676 Win=46336 Len=0 TSval=3998325128 TSecr=1932659309"
"672","0.004739143","science-edge-external-prod-73889260.us-west-2.elb.amazonaws.com","tanvi-HP-Notebook-d18b","TCP","66","443  >  50912 [ACK] Seq=1 Ack=518 Win=28160 Len=0 TSval=69124520 TSecr=2603563022"
"673","0.000041995","h2.twitch.map.fastly.net","tanvi-HP-Notebook-d18b","TCP","66","443  >  49714 [ACK] Seq=5676 Ack=1210 Win=30720 Len=0 TSval=1932659317 TSecr=3998324902"
"675","0.000009997","tanvi-HP-Notebook-d18b","science-edge-external-prod-73889260.us-west-2.elb.amazonaws.com","TCP","66","50912  >  443 [ACK] Seq=518 Ack=1389 Win=32128 Len=0 TSval=2603563353 TSecr=69124520"
"676","-0.000009586","pubsub-edge.chat.twitch.tv","tanvi-HP-Notebook-d18b","TCP","66","443  >  34518 [ACK] Seq=1 Ack=518 Win=28160 Len=0 TSval=1386878130 TSecr=89416629"
"677","0.000077413","twitch.map.fastly.net","tanvi-HP-Notebook-d18b","TCP","74","443  >  56906 [SYN, ACK] Seq=0 Ack=1 Win=28160 Len=0 MSS=1400 SACK_PERM=1 TSval=1955068221 TSecr=1790761947 WS=512"
"678","0.000018454","tanvi-HP-Notebook-d18b","twitch.map.fastly.net","TCP","66","56906  >  443 [ACK] Seq=1 Ack=1 Win=29312 Len=0 TSval=1790762167 TSecr=1955068221"
"680","0.000007308","tanvi-HP-Notebook-d18b","pubsub-edge.chat.twitch.tv","TCP","66","34518  >  443 [ACK] Seq=518 Ack=1389 Win=32128 Len=0 TSval=89416960 TSecr=1386878131"
"682","0.000010911","tanvi-HP-Notebook-d18b","pubsub-edge.chat.twitch.tv","TCP","66","34518  >  443 [ACK] Seq=518 Ack=2777 Win=35072 Len=0 TSval=89416960 TSecr=1386878131"
"684","0.000006206","tanvi-HP-Notebook-d18b","pubsub-edge.chat.twitch.tv","TCP","66","34518  >  443 [ACK] Seq=518 Ack=4097 Win=37888 Len=0 TSval=89416960 TSecr=1386878131"
"686","0.000008074","tanvi-HP-Notebook-d18b","pubsub-edge.chat.twitch.tv","TCP","66","34518  >  443 [ACK] Seq=518 Ack=5265 Win=40576 Len=0 TSval=89416961 TSecr=1386878132"
"689","0.000044546","tanvi-HP-Notebook-d18b","science-edge-external-prod-73889260.us-west-2.elb.amazonaws.com","TCP","66","50912  >  443 [ACK] Seq=518 Ack=2777 Win=35072 Len=0 TSval=2603563354 TSecr=69124520"
"691","0.000017373","tanvi-HP-Notebook-d18b","science-edge-external-prod-73889260.us-west-2.elb.amazonaws.com","TCP","66","50912  >  443 [ACK] Seq=518 Ack=4165 Win=37888 Len=0 TSval=2603563354 TSecr=69124520"
"693","0.000016167","tanvi-HP-Notebook-d18b","science-edge-external-prod-73889260.us-west-2.elb.amazonaws.com","TCP","66","50912  >  443 [ACK] Seq=518 Ack=5296 Win=40704 Len=0 TSval=2603563354 TSecr=69124520"
"696","0.014517464","irc-ws-edge.chat.twitch.tv","tanvi-HP-Notebook-d18b","TCP","74","443  >  44534 [SYN, ACK] Seq=0 Ack=1 Win=26847 Len=0 MSS=1400 SACK_PERM=1 TSval=2824441897 TSecr=3101976148 WS=256"
"697","0.000039407","tanvi-HP-Notebook-d18b","irc-ws-edge.chat.twitch.tv","TCP","66","44534  >  443 [ACK] Seq=1 Ack=1 Win=29312 Len=0 TSval=3101976479 TSecr=2824441897"
"701","0.000050035","tanvi-HP-Notebook.local","api2.branch.io","TCP","86","45008  >  443 [ACK] Seq=2500 Ack=5341 Win=40960 Len=0 TSval=2401778526 TSecr=1177971553"
"702","0.086864271","h2.twitch.map.fastly.net","tanvi-HP-Notebook-d18b","HTTP2","132","SETTINGS[0], WINDOW_UPDATE[0], SETTINGS[0]"
"703","0.000038326","tanvi-HP-Notebook-d18b","h2.twitch.map.fastly.net","TCP","66","49716  >  443 [ACK] Seq=1357 Ack=5246 Win=43520 Len=0 TSval=3998325311 TSecr=871038747"
"705","0.017198236","science-edge-external-prod-73889260.us-west-2.elb.amazonaws.com","tanvi-HP-Notebook-d18b","TCP","66","443  >  50906 [ACK] Seq=5296 Ack=1726 Win=29952 Len=0 TSval=69124567 TSecr=2603563207"
"706","0.000102852","science-edge-external-prod-73889260.us-west-2.elb.amazonaws.com","tanvi-HP-Notebook-d18b","TLSv1.2","356","New Session Ticket, Change Cipher Spec, Finished"
"708","0.000045703","tanvi-HP-Notebook-d18b","science-edge-external-prod-73889260.us-west-2.elb.amazonaws.com","TCP","66","50906  >  443 [ACK] Seq=2153 Ack=5664 Win=43520 Len=0 TSval=2603563549 TSecr=69124567"
"710","0.000897656","tanvi-HP-Notebook-d18b","science-edge-external-prod-73889260.us-west-2.elb.amazonaws.com","HTTP2","104","SETTINGS[0]"
"711","0.009173540","twitch.map.fastly.net","tanvi-HP-Notebook-d18b","TCP","66","443  >  56906 [ACK] Seq=1 Ack=518 Win=29696 Len=0 TSval=1955068275 TSecr=1790762168"
"713","0.000053755","tanvi-HP-Notebook-d18b","twitch.map.fastly.net","TCP","66","56906  >  443 [ACK] Seq=518 Ack=1389 Win=32128 Len=0 TSval=1790762374 TSecr=1955068275"
"715","0.000020771","tanvi-HP-Notebook-d18b","twitch.map.fastly.net","TCP","66","56906  >  443 [ACK] Seq=518 Ack=2777 Win=35072 Len=0 TSval=1790762374 TSecr=1955068275"
"717","0.000013262","tanvi-HP-Notebook-d18b","twitch.map.fastly.net","TCP","66","56906  >  443 [ACK] Seq=518 Ack=4165 Win=37888 Len=0 TSval=1790762374 TSecr=1955068275"
"719","0.000014949","tanvi-HP-Notebook-d18b","twitch.map.fastly.net","TCP","66","56906  >  443 [ACK] Seq=518 Ack=4928 Win=40704 Len=0 TSval=1790762374 TSecr=1955068275"
"722","0.012300839","h2.twitch.map.fastly.net","tanvi-HP-Notebook-d18b","TCP","66","443  >  49716 [ACK] Seq=5246 Ack=1357 Win=30720 Len=0 TSval=871038759 TSecr=3998325088"
"729","0.002877765","science-edge-external-prod-73889260.us-west-2.elb.amazonaws.com","tanvi-HP-Notebook-d18b","TLSv1.2","356","New Session Ticket, Change Cipher Spec, Finished"
"730","0.000150863","pubsub-edge.chat.twitch.tv","tanvi-HP-Notebook-d18b","TLSv1.2","117","Change Cipher Spec, Finished"
"731","0.001478870","tanvi-HP-Notebook-d18b","pubsub-edge.chat.twitch.tv","HTTP","848","GET /v1 HTTP/1.1 "
"733","0.000065689","tanvi-HP-Notebook-d18b","science-edge-external-prod-73889260.us-west-2.elb.amazonaws.com","TCP","66","50912  >  443 [ACK] Seq=644 Ack=5655 Win=43520 Len=0 TSval=2603563683 TSecr=69124603"
"736","0.011475601","irc-ws-edge.chat.twitch.tv","tanvi-HP-Notebook-d18b","TCP","66","443  >  44534 [ACK] Seq=1 Ack=518 Win=28160 Len=0 TSval=2824442227 TSecr=3101976480"
"738","0.000018788","tanvi-HP-Notebook-d18b","irc-ws-edge.chat.twitch.tv","TCP","66","44534  >  443 [ACK] Seq=518 Ack=1389 Win=32128 Len=0 TSval=3101976811 TSecr=2824442227"
"740","0.000022199","tanvi-HP-Notebook-d18b","irc-ws-edge.chat.twitch.tv","TCP","66","44534  >  443 [ACK] Seq=518 Ack=2777 Win=35072 Len=0 TSval=3101976811 TSecr=2824442227"
"742","0.000007262","tanvi-HP-Notebook-d18b","irc-ws-edge.chat.twitch.tv","TCP","66","44534  >  443 [ACK] Seq=518 Ack=4097 Win=37888 Len=0 TSval=3101976811 TSecr=2824442227"
"744","0.000015565","tanvi-HP-Notebook-d18b","irc-ws-edge.chat.twitch.tv","TCP","66","44534  >  443 [ACK] Seq=518 Ack=5275 Win=40576 Len=0 TSval=3101976811 TSecr=2824442228"
"746","0.009366600","h2.twitch.map.fastly.net","tanvi-HP-Notebook-d18b","TCP","66","443  >  49716 [ACK] Seq=5246 Ack=1395 Win=30720 Len=0 TSval=871038795 TSecr=3998325312"
"749","0.001876545","twitch.map.fastly.net","tanvi-HP-Notebook-d18b","TLSv1.2","324","New Session Ticket, Change Cipher Spec, Finished"
"750","0.002370757","twitch.map.fastly.net","tanvi-HP-Notebook-d18b","HTTP","642","HTTP/1.1 200 OK "
"751","0.000093289","tanvi-HP-Notebook-d18b","twitch.map.fastly.net","TCP","66","56906  >  443 [ACK] Seq=1143 Ack=5762 Win=46336 Len=0 TSval=1790762578 TSecr=1955068325"
"759","0.013221161","tanvi-HP-Notebook-d18b","h2.twitch.map.fastly.net","TCP","66","49716  >  443 [ACK] Seq=1395 Ack=6428 Win=46336 Len=0 TSval=3998325580 TSecr=871038804"
"766","0.028748571","twitch.map.fastly.net","tanvi-HP-Notebook-d18b","TCP","74","443  >  56908 [SYN, ACK] Seq=0 Ack=1 Win=28160 Len=0 MSS=1400 SACK_PERM=1 TSval=982097966 TSecr=1790762484 WS=512"
